Disclaimer: CPSC does not guarantee the accuracy, completeness, or adequacy of the contents of the Publicly Available Consumer Product Safety Information Database on SaferProducts.gov, particularly with respect to information submitted by people outside of CPSC.
Title,Date,Summary,Recall Number,Recall URL
"Toy Vehicles Recalled by Supreme Toys",2/8/2001 ,"Toy Vehicles Recalled by Supreme Toys NEWS from CPSC U.S. Consumer Product Safety Commission Office of Information and Public Affairs Washington, DC 20207 FOR IMMEDIATE RELEASE February 8, 2001 Release # 01-080 Supreme Toys Recall Hotline: (800) 567-1774 CPSC Consumer Hotline: (800) 638-2772 CPSC Media Contact: Ken Giles, (301) 504-7052 CPSC, Supreme Toys Announce Recall of Toy Vehicles WASHINGTON, D.C. - In cooperation with the U.S. Consumer Product Safety Commission (CPSC), Supreme Toys (H.K) Ltd., of Hong Kong, is recalling about 290,000 toy vehicles. Small parts can break off of the toy vehicles, posing a choking hazard to young children. Supreme Toys has not received any reports of small parts breaking off the toy vehicles. The recalled vehicles are airplanes, cars, dump trucks, trains and fire engines sold under the PLAYGO brand name. They are made of multicolored plastic with red, blue, green and yellow parts. Each vehicle has a battery-operated, detachable remote control with a 40-inch cord. Enclosed in the cab of each vehicle are small multicolor balls about 1/4 inch in diameter. A label on the vehicles and the remote reads PLAYGO. The words, PLAYGO LTD (HONG KONG) MADE IN CHINA are imprinted on the bottom of each toy. Drug, grocery, variety stores, and discount department stores, including Wal-Mart, sold these toys from June 1995 through December 1998 for about $5. Consumers should take these toy vehicles away from children immediately. Consumers should cut the remote control cord off the toy, discard the vehicle, and mail just the cord to Supreme at 8348 C, Olive Road, St. Louis, MO 63132 for a $5 refund plus the cost of postage. For more information, call Supreme Toys toll free at (800) 567-1774 Monday through Friday between 9 a.m. and 5 p.m. CT.",01080,https://www.cpsc.gov/Recalls/2001/CPSC-Supreme-Toys-Announce-Recall-of-Toy-Vehicles
"CPSC, FAO Schwarz Inc. Announce Recall of Fire Engine Pull-Along Toys",3/4/2004 ,"These fire engine pull-along toys are red with a yellow ladder, and are made of wood. They are about 18 inches long and come with six toy firemen. Fire Dept. is written on the sides of the toy.",04095,https://www.cpsc.gov/Recalls/2004/CPSC-FAO-Schwarz-Inc-Announce-Recall-of-Fire-Engine-Pull-Along-Toys-
"Fire Company Toy Recalled by Larami Fire Company",7/27/1989 ,"Fire Company Toy Recalled by Larami Fire Company NEWS from CPSC U.S. Consumer Product Safety Commission Office of Information and Public Affairs Washington, DC 20207 FOR IMMEDIATE RELEASE July 27, 1989 Release # 89-074 Commission Announces Larami Fire Company Recall WASHINGTON, DC -- The Consumer Product Safety Commission warns consumers of a hazardous toy called Fire Company, Item No. 1134-0 imported by Larami Corporation of Philadelphia, Pennsylvania.- The toy contains small parts that present a choking hazard to small children. The firm imported approximately 24,000 of these toys from September 1987 to September 1988. The Fire Company toy consists of a small red plastic fire truck, a red hook and ladder truck with a moveable white ladder, two plastic firemen dressed in black and one plastic street railroad sign. These items were mounted on a colorful display card, and were sold at retail for approximately $1 to $2. The words MADE IN HONG KONG appear on the bottom of all the pieces except the street railroad sign. The display card says Fire Company in large red letters at the top, and 11LARAMI11 and the item number in black letters at the bottom. Plastic pieces of the toys, such as the wheels, may come off during ordinary use and could present a choking hazard to young children. Larami has recalled these toys from retailers and has asked retailers to post recall notices to inform purchasers about the recall. Consumers should either throw away these toys, or if they want a refund, they should return the toy to the store where it was purchased. U.S. customs Service identified the potentially hazardous toys at the Port of Philadelphia during the joint surveillance program conducted with the U.S. Consumer Product Safety Commission.",89074,https://www.cpsc.gov/Recalls/1989/Commission-Announces-Larami-Fire-Company-Recall
"Wooden Toy Truck Recall by Division Sales",4/17/1997 ,"Wooden Toy Truck Recall by Division Sales NEWS from CPSC U.S. Consumer Product Safety Commission Office of Information and Public Affairs Washington, DC 20207 FOR IMMEDIATE RELEASE CONTACT: Nychelle White April 17, 1997 (301) 504-7063 Release # 97-104 CPSC and Division Sales Inc. Announce Wooden Toy Truck Recall WASHINGTON, D.C. - In cooperation with the U.S. Consumer Product Safety Commission (CPSC), Division Sales Inc. of Itasca, Ill., is recalling about 6,300 wooden toy trucks. The toy trucks have wooden balls and figures in the cab that are a small parts choking hazard to young children. CPSC and Division Sales Inc. are not aware of any injuries involving these toys. This recall is being conducted to prevent the possibility of injury. The natural wood toy truck, measuring 12 inches long and 4 inches high, has six easy moving red wheels, two red headlights, and a 14-inch red pull cord. There are 16 blue, green, red, and yellow alphabet blocks with two green and blue balls in the truck. Two figures sit in the cab of the truck. The toy is packaged in a box labeled in part, WOOD BLOCKS &TRUCK...MADE IN CHINA...FOR JUSTEN PRODUCTS... Dollar-type, discount, hardware, thrift, and drug stores nationwide sold the toys from October 1993 through November 1996 for about $1 to $5. Consumers should take the recalled toys away from young children immediately and return them to the store where purchased for a full refund. For more information, consumers can call Division Sales Inc. at (800) 621-8134.",97104,https://www.cpsc.gov/Recalls/1997/CPSC-and-Division-Sales-Inc-Announce-Wooden-Toy-Truck-Recall
"Wooden Toy Fire Trucks Recalled by Marlon",11/6/1986 ,"Wooden Toy Fire Trucks Recalled by Marlon NEWS from CPSC U.S. Consumer Product Safety Commission Office of Information and Public Affairs Washington, DC 20207 FOR IMMEDIATE RELEASE November 6, 1986 Release # 86-068 Wooden Toy Fire Trucks Recalled Because Of Choking Hazard Washington, DC -- In cooperation with the U.S. Consumer Product Safety Commission, Marlon Creations, Inc., of Long Island City, New York is recalling 430 toy Fire Trucks with Four Firemen-Hardwood Utility Truck Model 5044 imported from West Germany and sold nationwide between May 1986 and July 1986 for approximately $6.00 each. Tests conducted by CPSC showed that the firemen figures, which detach from the truck, are small parts and present a choking hazard. To meet CPSC toy safety requirements, toys intended f or children younger than 3 must not have any small parts. The 5 1/2-inch long wooden fire truck is painted red and has a blue knob on the top of the cab, an unpainted ladder and six red wheels. The two-inch tall firemen are painted blue. The fire truck is package in a clear plastic bag with a cardboard header labeled, Quality Wooden Toys made in West Germany. There is no labeling on the toy. Although the CPSC and Marlon have not received reports of any injuries involving this toy, consumers should take these toys away from children immediately. Consumers may return the toy-for a full refund to the retail store where they were purchased or to Marlon Creations, Inc., 35-01 36th Avenue, Long Island City, New York 11106. Anyone wishing additional information may call Marlon at 718-361-2088 or CPSC's toll-free hotline number at 800-638-CPSC. A teletypewriter number for the hearing impaired is (301) 595-7054.",86068,https://www.cpsc.gov/Recalls/1986/Wooden-Toy-Fire-Trucks-Recalled-Because-Of-Choking-Hazard
"Big Save International Corp. Recalls Toy Play Tool Truck",12/1/1994 ,"December 1, 1994 Release # 95-034 WASHINGTON, D.C. - CPSC, Big Save International Corp., of Los Angeles, Calif., is voluntarily recalling about 1,000 toy trucks.The toy truck was identified during a joint CPSC and U.S. Customs surveillance at the port of Long Beach, Calif. CPSC testing found that the toy contained small parts that present a potential choking hazards to young children.The multicolored plastic truck is approximately 8 inches long with a removable drive and passenger seat set. The truck is equipped with a plastic hammer, screw driver, and wrench and plastic screws, bolts, and nails. A decal on each side of the truck reads, Play Tool Truck. The underside of the truck is embossed with No. 3009 and Made in China. The truck is packaged in a cardboard container labeled in part, ... Educational Play Tool Truck... NO. 3009... MADE IN CHINA. The toy was imported from China and sold in Indiana and Alabama from August 1994 to November 1994 at independent toy and retail stores for $3.95. The toy should be taken away from young children immediately and destroyed, discarded, or if possible, returned to the store where purchased for a full refund. However, the firm, Big Save International Corp., is out of business and cannot be contacted.Neither CPSC nor Big Save International Corp. is aware of any injuries involving these toys; this recall is being conducted to prevent the possibility of injury",95034,https://www.cpsc.gov/Recalls/1995/Big-Save-International-Corp-Recalls-Toy-Play-Tool-Truck
"Engineering Truck Recalled by Christmas Tree Shops",8/1/1996 ,"Engineering Truck Recalled by Christmas Tree Shops NEWS from CPSC U.S. Consumer Product Safety Commission Office of Information and Public Affairs Washington, DC 20207 FOR IMMEDIATE RELEASE CONTACT: Nychelle White August 1, 1996 (301) 504-7063 Release # 96-179 CPSC and Christmas Tree Shops Announce Toy Truck Recall WASHINGTON, D.C. - In cooperation with the U.S. Consumer Product Safety Commission (CPSC), Christmas Tree Shops Inc. of South Yarmouth, Mass., is voluntarily recalling about 12,000 toy Engineering Trucks. The toys contain small parts, such as the driver figure in the truck's front cab, which may break off during use presenting a potential choking hazard to young children. CPSC is not aware of any injuries involving this toy. This recall is being conducted to prevent the possibility of injury. The State of Connecticut identified the small parts hazard. The wooden Engineering Truck toys (Item 00011-34416) measure approximately 6 inches long and 2 inches wide. Each truck has a front cab section with a small, peg-shaped driver figure which measures approximately 1.5 inches high. The truck's flat bed body features a hauler, a cement mixer, an asphalt roller, a crane, or an extension ladder. The truck has no labeling. The trucks were packaged in small blue and white cardboard boxes featuring photographs of the toys. Labeling on the box reads in part, ENGINEERING TRUCK EDUCATIONAL TOY... MADE IN CHINA. The box also includes the SKU number 000011 34416 2. Christmas Tree Shops in New England sold the Engineering Truck toys from April 1994 through March 1996 for $1 each. Consumers should take the truck away from young children immediately and return the toy either to the store where purchased or the nearest Christmas Tree Shop. For more information about this recall consumers should call Christmas Tree Shop at (800) 876-9677.",96179,https://www.cpsc.gov/Recalls/1996/CPSC-and-Christmas-Tree-Shops-Announce-Toy-Truck-Recall
"CPSC, Nikko America Announce Recall of Radio-Control Toy Trucks",4/13/2004 ,"The recalled toy trucks were manufactured from April 2003 through January 2004. The trucks are 1/10 scale models (approximately 18 inches in length) of the Chevy Avalanche (model 100021A), the Jeep Wrangler Rubicon (model 100022A and 100022B), the Hummer Wagon (model 100023A and 100023B) and the Ford F150 (model 100024A and 100024B). Model numbers can be found on the body of the truck, along with the vehicle make and model names.",04117,https://www.cpsc.gov/Recalls/2004/CPSC-Nikko-America-Announce-Recall-of-Radio-Control-Toy-Trucks-
"Everything's A Dollar, Inc. Recalls Toy Wooden Block Truck Due To Choking Hazard",7/13/1992 ,"July 13, 1992 Release # 92-109 Everything's A Dollar, Inc. Recalls Toy Wooden Block Truck Due To Choking Hazard PRODUCT: Toy Wooden Block Trucks, item GW-25 sold by Everything's A Dollar, Inc. PROBLEM: The wooden head of the driver and a white 5/8-inch diameter cylinder block are a potential choking hazard for young children. WHAT TO DO: Return the toy truck to any Everything's A Dollar store for a full refund. WASHINGTON, DC -- In cooperation with the U.S. Consumer Product Safety Commission (CPSC), Everything's A Dollar, Inc., of Milwaukee, WI is voluntarily recalling 10,944 Toy Wooden Block Trucks, item GW-25. When CPSC tested the Toy Wooden Block Trucks in accordance with regulations under the Federal Hazardous Substances Act, it was determined that the wooden head of the driver and a white 5/8-inch diameter cylinder block posed a potential choking hazard for young children. The Toy Wooden Block Truck is a simple, undetailed wooden truck measuring 4-3/4 inches long, 2-3/4 inches wide, and 2-1/2 inches high. The truck consists of a peg figure glued into the driver's seat and an open-lift bed with three colored removable building blocks. The clear cellophane wrapping in which the toy was sold had a label on it that read, MADE IN CHINA. The Toy Wooden Block Truck was sold on the East Coast and in the Midwest exclusively at 49 Everything's A Dollar retail stores from September 1991 to January 1992. The trucks sold for a retail price of $1.00 each. Consumers are urged to take the trucks away from young children immediately and return them to any Everything's A Dollar store for a full refund. For more information about this recall, consumers may contact Everything's A Dollar, Inc. at 1-414-274-2938. Neither CPSC nor the company is aware of any injuries involving these products. This voluntary recall is being conducted to prevent the possibility of injury. The potentially hazardous toys were identified during CPSC's Central Regional Office's routine examination of Everything's A Dollar retail stores. CPSC is announcing this recall as part of its mission to protect the public from unreasonable risks of injury and death associated with consumer products. The Commission's objective is to reduce the estimated 28.5 million injuries and 21,600 deaths associated each year with the 15,000 different types of consumer products under CPSC's jurisdiction",92109,https://www.cpsc.gov/Recalls/1992/Everythings-A-Dollar-Inc-Recalls-Toy-Wooden-Block-Truck-Due-To-Choking-Hazard
"Wooden Vehicle Toys Recalled by Al-Dan Trading",10/8/1997 ,"Wooden Vehicle Toys Recalled by Al-Dan Trading NEWS from CPSC U.S. Consumer Product Safety Commission Office of Information and Public Affairs Washington, DC 20207 FOR IMMEDIATE RELEASE Originally issued October 8, 1997, Revised July 10, 2001 Release # 98-005 CPSC Consumer Hotline: (800) 638-2772 CPSC Media Contact: Nchelle Fleming, (301) 504-7063 Note: Firm contact information not available. CPSC, Al-Dan Trading Inc. Announce Recall of Wooden Vehicle Toys WASHINGTON, D.C. - In cooperation with the U.S. Consumer Product Safety Commission (CPSC), Al-Dan Trading Inc. of Miami, Fla. is recalling over 5,800 wooden vehicle toys. The toys have small parts that could separate and present a choking hazard to young children. CPSC and Al-Dan are not aware of any injuries involving these toys. This recall is being conducted to prevent the possibility of injury. The wooden vehicles include trucks, trains, race cars, motorcycles, airplanes, and cranes with parts painted red, blue, green, yellow and/or white. Vehicles range in sizes as small as 5 1/2 inches long and 2 1/2 inches high and as large as 15 inches long and 7 inches high. The small vehicles (trucks, trains, race cars, motorcycles and airplanes) could have a driver in the cab, movable parts, square and hexagon blocks with painted on numerals and letters, and a clock face. The big vehicles all have movable parts like the crane's operable hook, the truck's removable animals, and the locomotive's drive wheel connectors. Some toys may have a warning sticker stating /!\ WARNING CHOKING HAZARD - small parts not suitable for children under 3 years. NON-TOXIC AND MADE IN CHINA and/or another sticker stating 18 DANIEL BRAND with a UPC code number beginning with 69658. Despite the warning label, these toys present a choking hazard to young children. These toys were mainly sold in the following Florida discount stores: All for 99 Cents, Always 99 Cents, Dollar Store, Dollar Dave's, Daniel Club Wholesalers, and Swamis Trading from June 1996 through June 1997 for about $1. Consumers should take the recalled toys away from children immediately and discard or destroy them, or if possible, return them to the store where purchased for a full refund. However, the firm, Al-Dan Trading Inc., does not have contact information at this time.",98005,https://www.cpsc.gov/Recalls/1998/CPSC-Al-Dan-Trading-Inc-Announce-Recall-of-Wooden-Vehicle-Toys
"Radio Control Toy Trucks Sold by QVC Recalled for Fire Hazard",3/29/2006 ,"The Thunder Spin R.C. Road Rage Stunt Machine is 10 inches by 11 inches and was sold in blue or green. The radio-controlled Stunt Machine comes with one charger, one 9.6V rechargeable battery pack, and one 9-volt battery. The model number, T23624, is written only on the product's packaging, located above the Universal Product Code. The Stunt Machine comes with two orange flame decals on each side of the vehicle, one of which includes Stunt Machine in orange block lettering. A Thunder Spin logo can be found on the bottom of the vehicle.",06539,https://www.cpsc.gov/Recalls/2006/Radio-Control-Toy-Trucks-Sold-by-QVC-Recalled-for-Fire-Hazard
"CPSC, Division Sales, Inc. Announce Wooden Toy Truck Recall",12/19/1995 ,"December 19, 1995 Release # 96-048 WASHINGTON,D.C. - CPSC, Division Sales Inc., of Itasca, Ill., is recalling 44,000 wooden toy trucks. The truck's driver and wheels can break off, presenting a choking hazard to young children.The natural wood trucks, measuring approximately 5 inches long by 2 inches wide, were sold in six styles: two styles of dump trucks; a cement truck; a truck with a large, wooden, rotating cylinder; a truck with crane; and a truck with ladder. A small gold decal on the underside of the truck reads, MADE IN CHINA. Each truck is packaged with a small wooden driver figure in a blue cardboard box labeled, WOOD TOY ... ENGINEERING TRUCK EDUCATIONAL TOY. Various retail stores and discount centers sold the trucks nationwide from December 1993 through December 1995 for approximately $1 each.Consumers should take the toy vehicles away from young children immediately and return the trucks to the store where they were purchased for a full refund. For more information, consumers should call Division Sales Inc. at (800) 621-8134.CPSC and Division Sales, Inc. are not aware of any injuries involving these toy trucks. This recall is being conducted to prevent the possibility of injury",96048,https://www.cpsc.gov/Recalls/1996/CPSC-Division-Sales-Inc-Announce-Wooden-Toy-Truck-Recall
"Toy Trucks Recalled by MagicCabin",8/4/2003 ,"Toy Trucks Recalled by MagicCabin Recall Alert U.S. Consumer Product Safety Commission Office of Information and Public Affairs Washington, DC 20207 August 4, 2003 Alert #03-549 CPSC, MagicCabin Announce Recall of Toy Trucks The following product safety recall was conducted voluntarily by the firm in cooperation with the CPSC. Consumers should stop using the product immediately unless otherwise instructed. It is illegal to resell or attempt to resell a recalled consumer product. Name of Product: Big Boy Trucks (Dump Truck & Tow Truck)  Units: 220 Manufacturer: Magic Cabin, of Viroqua, Wis., HearthSong, of Madison, Va. Hazard: Small parts can break off of the toy trucks posing a choking hazard to young children. Incidents/Injuries: No injuries have been reported. Description: The Big Boy Trucks are made of oak, maple, or walnut wood with a natural oil finish. The trucks are about 9 to 12 inches high. Sold At: Magic Cabin sold the toy trucks through their catalog and Web site from September 2002 through March 18, 2003 for about $16. Manufactured In: U.S.A. Remedy: Consumers should take the toys away from young children immediately and return to Magic Cabin for a refund, including the cost of postage. Send the toy trucks to Magic Cabin, Attn: Returns, 3700 Wyse Road, Dayton, OH 45414-2541. Consumer Contact: Call toll-free at (888) 623-6557 between 9 a.m. and 5 p.m. ET Monday through Friday. Media Contact: Ms. Linda DeRose-Droubay at (540) 948-7353",03549,https://www.cpsc.gov/Recalls/2003/CPSC-MagicCabin-Announce-Recall-of-Toy-Trucks
"LEGO Recalls Toy Trucks Due to Puncture Hazard to Young Children",9/20/2006 ,"LEGO EXPLORE Super Truck is a toy-in-toy product designed for children ages 18 months and up. The toy features a red plastic pick-up/dump truck that measures about 15 inches high and 19 inches wide with four 7-inch black plastic wheels that are packed with a box of 40 LEGO DUPLO bricks in the cargo area. The unit has a row of DUPLO studs across the top of the cab, molded yellow headlights and stickers on the front and sides of the unit create the idea of a windshield, windows and doors depicting a LEGO figure in the driver's seat. The LEGO Explore logo is printed on the door stickers. The box of DUPLO bricks is not included in this recall.",06262,https://www.cpsc.gov/Recalls/2006/LEGO-Recalls-Toy-Trucks-Due-to-Puncture-Hazard-to-Young-Children
"Toy Trucks Recalled by Variety Wholesalers Due to Violation of Lead Paint Standard",12/10/2009 ,"This recall involves Super Rig Transport toy truck with trailer and vehicles. The truck and trailer are multi-colored, holding two vehicles and two action figures. Super Rigs Play Set is labeled on the outside of the packaging. The box back has a bar code square with Item No. 67007, Made in China and Bar Code 6-98567-67007-3. The bottom of the trailer has an engraved code 45TNGO9.",10061,https://www.cpsc.gov/Recalls/2010/Toy-Trucks-Recalled-by-Variety-Wholesalers-Due-to-Violation-of-Lead-Paint-Standard
"Tonka(r) Toy Trucks Recalled by Isaac Morris",6/7/1999 ,"Isaac Morris Ltd., of New York, N.Y., is voluntarily recalling about 3,300 Tonka toy trucks.",99120c,https://www.cpsc.gov/Recalls/1999/Tonkar-Toy-Trucks-Recalled-by-Isaac-Morris
"Henry Gordy International Recalls Eggscavators Toy Trucks",4/18/1990 ,"CONTACT: April 18, 1990 (301) 504-7908 Release # 90-075 Henry Gordy International Recalls Eggscavators Toy Trucks WASHINGTON, DC -- In cooperation with the U.S. Consumer Product Safety Commission (CPSC), Henry Gordy International, Plainfield, New Jersey is voluntarily recalling 40,000 Eggscavators Toy Trucks because the mixer on the cement truck may detach posing a choking hazard to young children. The product known as Eggscavators (Item Number 187) is a set of three plastic construction vehicles. Each set includes one of each of the following (colors may vary): - A dump truck with blue wheels, blue body and yellow dumper. - A cement truck with blue wheels, red body and yellow mixer. - A bulldozer with blue wheels, yellow body and red dumper and steering wheel. Embossed on the bottom of each vehicle are the words MADE IN HONGKONG. The cement and dump trucks have white sticker labels on them that read EGGScavators. Each vehicle is two inches wide and two and one-half inches long. These egg-shaped construction trucks have been sold nationwide since 1987 for under $2.00 a set. Neither the CPSC nor the company is aware of any injuries involving this product. This voluntary recall is being conducted to prevent the possibility of injury. Consumers are urged to take these toys away from young children immediately and return them to the store where purchased for a refund. These potentially hazardous toys were reported to CPSC by the Oregon State Public Interest Reseach Group",90075,https://www.cpsc.gov/Recalls/1990/Henry-Gordy-International-Recalls-Eggscavators-Toy-Trucks
"CPSC And Everything's A Dollar Announce Toy Truck Recall",2/22/1996 ,"February 22, 1996 Release # 96-073 WASHINGTON, D.C. - CPSC, Everything's A Dollar, Inc. of Milwaukee, Wisc. doing business as Everything's $1.00, is voluntarily recalling 9,382 Big Wooden Trucks. The toy trucks' driver, wheel, and axle pieces pose a potential choking hazard to young children.The trucks were sold in three styles: one with multi-colored abacus beads, one with six multi-color discs, and one with five lettered and numbered discs. The wooden trucks each measure 5.5 inches long with red wheels and headlights, and a driver with a yellow hat, white face and red body. Each toy is labeled, LIDCO, North York, Ontario Canada... SKU 58188... UPC number 0 59584 05230 1. More than 200 Everything's $1.00 retail stores nationwide sold the trucks for $1each. Consumers should take the trucks away from children under three years of age immediately. The firm is out of business. Consumers should discard or destroy these products.CPSC and Everything's A Dollar, Inc. are not aware of any injuries involving these products. This voluntary recall is being conducted to prevent the possibility of injury.The potentially hazardous toys were identified during the State of Kentucky Product Safety Branch's examination of the Everything's $1.00 retail store in Florence, Ky",96073,https://www.cpsc.gov/Recalls/1996/CPSC-And-Everythings-A-Dollar-Announce-Toy-Truck-Recall
