"Target Stores Recalls Trucks And Dolls Because Of Choking Hazards",5/9/1990 ,"May 9, 1990 Release # 90-092 Target Stores Recalls Trucks And Dolls Because Of Choking Hazards WASHINGTON, DC -- In cooperation with the U.S. Consumer Product Safety Commission (CPSC), Target Stores of Minneapolis, MN is voluntarily recalling My First Buddys Wrecker Truck, My First Buddys Pumper Truck and their Potpourri Baby Doll because of small parts that present potentially fatal choking hazards to young children. The recalled items sold nationwide in 1988 and 1989 in Target Stores are as follows:MY FIRST BUDDYS WRECKER TRUCK Amount Sold: 27,000 (approximate) Average Price: $4.99 This truck is all plastic, has an orange body with My First Buddys embossed on the right side and WRECKER printed in white on both sides in all capital letters, has yellow rails, a blue pulley on a string for towing, a moving emergency light, black tires on white wheels, and a white built-in handle with BUDDYL embossed on the front. The truck makes a clicking sound when rolled back and forth. The emergency light on the top of the truck separates during use and abuse testing and is a small part. MY FIRST BUDDYS PUMPER Amount Sold: 27,000 (approximate) Average Price: $4.99 This truck is all plastic, has a red body with PUMPER printed in white on both sides in all caps, has yellow and white fire equipment attached, and has a white built-in handle with BUDDYL embossed on the back and blue tires on white wheels. The truck makes a clicking sound when pushed back and forth. The yellow fire fighting nozzle on top of the truck is a small part. POTPOURRI BABY DOLLS Amount Sold: 1,497 Average Price: $2.49 The dolls stand 3-1/2 inches tall and have moveable limbs. They are wearing solid or multi-colored shorts and come with a two-inch by three-inch scented pillow made of the same fabric trimmed with lace. The dolls come with straight blonde hair and freckled faces. The arms and legs of the doll separate during use and abuse testing and are small parts. Neither the CPSC nor the company is aware of any injuries involving this product. This voluntary recall is being conducted to prevent the possibility of injury. Consumers are urged to take these toys away from young children immediately and return them to the store where purchased for a refund of the purchase price. Consumers with questions about this recall may contact Target Store headquarters at (612) 370-6000. These three potentially hazardous toys were identified at the Ports of Los Angeles and Oakland, California during a joint CPSC/U.S. Customs Service surveillance program",90092,https://www.cpsc.gov/Recalls/1990/Target-Stores-Recalls-Trucks-And-Dolls-Because-Of-Choking-Hazards
"Harco, Inc. Recalls Rescue Truck",5/28/1991 ,"May 28, 1991 Release # 91-077 Harco, Inc. Recalls Rescue Truck WASHINGTON, DC -- In cooperation with the U.S. Consumer Product Safety Commission (CPSC), Harco, Inc., Tuscaloosa, AL is voluntarily recalling approximately 1,100 units of the Rescue Truck friction toys, model number 8115. When CPSC tested the trucks in accordance with regulations under the Federal Hazardous Substances Act, the truck wheels and rims separated and are small parts that pose a potential choking hazard for young children. The trucks are sold in three styles: a red fire truck, a blue police truck, and a white ambulance. Each vehicle is made of hard plastic and has a bear as the driver whose head nods back and forth when in motion. The trucks have yellow wheels with white rims and the friction on the rear wheels gives the trucks power to move. The license plate on the front bumpers bears the number 8115. The trucks measure four and one-half inches long, three inches wide, and three and one-half inches high. A label on the box reads 1987 Action Toys Co. Ltd. . . . Made in China. The statement Action Toys, Made in China, is embossed in the bottom of the trucks. The trucks were sold in Alabama, Florida, and Mississippi at Harco Drug Stores from September 1990 to April 1991 for approximately $4.99 each. Neither the CPSC nor the company is aware of any injuries involving this product. This voluntary recall is being conducted to prevent the possibility of injury. Consumers are urged to take these toys away from young children immediately and return them to the store where purchased for a full refund of the purchase price. For more information about this recall, consumers may call the firm at 1-800-477-9138. The CPSC's mission is to protect the public from unreasonable risks of injury and death associated with consumer products. The CPSC is the Federal agency responsible for consumer product safety. Some 15,000 different types of consumer products fall within the Commission's jurisdiction and each year these products are involved in an estimated 29 million injuries and 22,000 deaths",91077,https://www.cpsc.gov/Recalls/1991/Harco-Inc-Recalls-Rescue-Truck
"Toy Puzzle Vehicle Sets Recalled Due to Violation of Lead Paint Standard; Sold Exclusively by QVC",3/20/2008 ,"The recall includes the 16 piece Puzzle Track Play sets also known as Battery Operated Puzzle Vehicle sets. QVC item number T16876 is printed on the exterior of the brown box packaging. The sets have plastic puzzle pieces that when put together form a track with a battery operated train, fire engine or school bus vehicle designed to run on the track. Miniature street signs, traffic cones, and a battery for the vehicle are also included in the sets.",08551,https://www.cpsc.gov/Recalls/2008/Toy-Puzzle-Vehicle-Sets-Recalled-Due-to-Violation-of-Lead-Paint-Standard-Sold-Exclusively-by-QVC
"CPSC And Wholesale Warehousing Recall Toy Truck",11/1/1994 ,"November 1, 1994 Release # 95-016 Washington, D.C. - CPSC, DS-MAX U.S.A. Inc. (formerly Wholesale Warehousing Industries) of Irvine, Calif., had voluntarily recalled about 82,000 My Alphabetic Truck toys, style SHYE-AT-002. During CPSC use and abuse testing, small parts were generated, presenting a potential choking hazard to young children. Neither CPSC nor DS-MAX U.S.A. Inc. is aware of any injuries with the toy trucks.The My Alphabetic Trucks, which cost about $5, were sold door-to-door, nationwide between August 1993 and June 1994. The 12-inch truck is lacquered wood with red wheels and one or two non-removablewooden peg men in the front cab. Thirty wooden blocks with a picture on one side and a corresponding letter on the other are mounted to the truck's bed. A MADE IN CHINA sticker is located on the underside of the truck. Consumers should take the truck away from children and discard or destory the product. The firm is out of business and cannot be contacted",95016,https://www.cpsc.gov/Recalls/1995/CPSC-And-Wholesale-Warehousing-Recall-Toy-Truck
"CPSC, Dollar Tree Stores Announce Wooden Toy Truck Recall",1/19/1995 ,"January 19, 1995 Release # 95-063 WASHINGTON, D.C. - CPSC, Dollar Tree Stores Inc., of Norfolk, Va., is voluntarily recalling about 178,000 wooden construction and educational toy trucks, imported from China. CPSC testing found that the toys contained small figurines and truck pieces, which broke off during impact and tension testing. These small parts present a choking hazard to young children.The nine different styles of painted and natural wood trucks involved in this recall are approximately 5 1/2 inches long and 2 inches wide with a permanently attached driver figurine. The natural wood trucks come packaged either shrink-wrapped or in a blue cardboard box labeled, Wood Toy ... Engineering Truck...Made in China. The painted trucks only come packaged in shrink-wrap. All nine styles have a small gold decal on the underside that reads, Made in China.The natural wood four-wheeled construction trucks come in six styles: truck with a crane, truck with a ladder, cement truck, dump truck, dump truck with body on a swivel, and a truck with roller on back. All of these natural wood vehicles are covered with a clear varnish finish and contain a small figurine in the driver's seat.The painted wooden trucks come in three different styles. All three styles have four red wheels, two red head lights, with cabs hauling either a multi-colored abacus, a set of six moveable discs in different colors, or six natural-colored discs painted with math signs and numerals. Dollar Tree Stores Inc. sold these trucks nationwide at Dollar Tree stores from July to December 1994 for $1.00 each.Consumers are urged to take the vehicles away from young children immediately and return them to the Dollar Tree store where purchased for a full refund. Consumers who have questions about this recall can contact Dollar Tree Stores Inc. at (804) 857-5884.CPSC and Dollar Tree Stores Inc. are not aware of any injuries involving these toy trucks; this recall is being conducted to prevent the possibility of injury",95063,https://www.cpsc.gov/Recalls/1995/CPSC-Dollar-Tree-Stores-Announce-Wooden-Toy-Truck-Recall
"New York Firm Recalls Toy Police Car And Dumper",7/20/1993 ,"JULY 20, 1993 Release # 93-094 PRODUCT: The My First Buddys Police Car and My First Buddys Dumper toys. The toy cars and trucks were imported from China by SLM, Inc. and were sold nationwide in retail stores from January 1990 through December 1992. The police car is red, white and blue and the dumper is red, white and yellow. The toys also came in gift packs with either one or both of the vehicles. PROBLEM: Small parts may separate from the vehicles, presenting a potential choking and aspiration hazard to young children. WHAT TO DO: Consumers are urged to take the toys away from young children immediately and return them to the stores where purchased for a full refund. For more information, consumers may call SLM at 1-800-260-1398. WASHINGTON, DC -- CPSC, SLM, Inc., Gloversville, NY, is voluntarily recalling approximately 125,000 My First Buddys Police Cars model 4505 and approximately 184,000 My First Buddys Dumpers model 4500. During routine CPSC testing, small components separated from the vehicles, presenting a potential choking and aspiration hazard to young children. SLM, Inc. is also recalling two four-piece gift packs that include either one or both of the vehicles; gift pack model 4538 includes one police car and one dumper, and gift pack model 4539 includes one dumper. The other toys packaged in the gift packs, but are not involved in this recall, may include a pumper, a scooper, a helicopter or a wrecker. About 13,000 gift packs, model 4538, and about 4,000 gift packs, model 4539 are being recalled. The police car and dumper are the only products in the gift packs that are affected by this recall. The My First Buddys Police Car measures 7 inches long, 3 3/4 inches wide, and 4 inches high. The police car is blue and white and has a handle that extends from the top of the car's front window to its trunk. A plastic flasher with a red rectangular block inside moves from side to side when the car is pushed. A clicking sound is made when the rear wheels are moved. The car's interior consists of a front seat and a center raised platform in the back. The interior, bumper guards, and hub caps are white and the wheels are red. A gold sticker with the word POLICE printed in black is on the front window. The word POLICE is printed in white on both sides of the car. The BUDDY L insignia serves as the front and rear license plates. A police badge printed in white on the car's hood reads My First Buddys Police Patrol. The embossed label underneath the car reads in part:  . . . BUDDY L CORP, MADE IN CHINA. The My First Buddys Dumper measures 7 inches long, 3 3/4 inches wide, and 4 inches high. The dumper is yellow and has a white handle that extends from the front bumper guard to the cab of the truck. The BUDDY L insignia serves as the front license plate. The dumper has a yellow dumper bed that can be lifted and and lowered and the word DUMPER is printed in red on both sides of the bed. The wheels are red with white hub caps. A clicking sound is made when the front wheels are moved. The embossed label on the floor of the dumper bed reads in part:  . . . BUDDY L CORP, MADE IN CHINA. The police car, model 4505, and dumper, model 4500 were sold for an average retail price of $4.99 each. The gift packs, models 4538 and 4539, were sold for an average retail price of $16.99 each. The police car and dumper were imported by SLM, Inc. from China and were sold nationwide in retail stores from January 1990 through December 1992. Consumers are urged to take the toys away from young children immediately and return them to the stores where purchased for a full refund. For more information, consumers may call SLM, Inc. at 1-800-260-1398. Neither CPSC nor the firm is aware of any injuries involving these products. This voluntary recall is being conducted to prevent the possibility of injury. The potentially hazardous toys were identified at the U.S. Customs Container Station in Atlanta, GA during a joint CPSC/U.S. Customs surveillance program. CPSC is announcing this recall as part of its mission to protect the public from unreasonable risks of injury and death associated with consumer products. The Commission's objective is to reduce the estimated 28.6 million injuries and 21,700 deaths associated each year with the 15,000 different types of consumer products under CPSC's jurisdiction",93094,https://www.cpsc.gov/Recalls/1993/New-York-Firm-Recalls-Toy-Police-Car-And-Dumper
"Wang's International, Inc. Recalls Wooden Christmas Toy Trucks Due To Choking Hazard",2/24/1993 ,"February 24, 1993 Release # 93-045 PRODUCT: Approximately 9,100 Wooden Christmas Toy Trucks, a set of six trucks (two dump trucks, a roller truck, a crane, a cement mixer, and a truck with a ladder). The trucks, model X4848, have a natural wood finish. Each truck has a non-removable peg driver with a painted-on face. PROBLEM: When CPSC tested the trucks, the drivers and other truck parts separated, presenting a potential choking hazard to young children. WHAT TO DO: Consumers are urged to take the trucks away from young children immediately and return them to the stores where purchased for a full refund. For more information, consumers may contact Charlotte Allison at 1-800-829-2647, ext. 3100. WASHINGTON, DC -- CPSC, Wang's International, Inc., of Memphis, TN, is voluntarily recalling approximately 9,100 Wooden Christmas Toy Trucks, model number X4848. When CPSC tested the trucks, the drivers and other truck parts separated, presenting a potential choking hazard to young children. The Wooden Christmas Toy Trucks were sold as a set of six trucks (two dump trucks, a roller truck, a crane, a cement mixer, and a truck with a ladder). Each truck measures 5-1/2 inches long, two inches wide, 2-3/4 inches high, and has a natural wood finish with no paint. Each truck has a non-removable peg driver with a painted-on face. The label underneath each truck reads in part: WANG'S INTERNATIONAL INC * * * MADE IN CHINA. The trucks, imported by Wang's International, Inc., were sold at retail stores nationwide from January 1992 through mid- December 1992 for a retail price of $3.99 per set. Consumers are urged to take the trucks away from young children immediately and return them to the stores where purchased for a full refund. For more information about this recall, consumers may contact Charlotte Allison at 1-800-829-2647, ext. 3100. Neither CPSC nor the company is aware of any injuries involving these trucks. This voluntary recall is being conducted to prevent the possibility of injury. The potentially hazardous toys were identified at the Port of Oakland, CA, during a joint CPSC/U.S. Customs surveillance program. CPSC is announcing this recall as part of its mission to protect the public from unreasonable risks of injury and death associated with consumer products. The Commission's objective is to reduce the estimated 28.6 million injuries and 21,700 deaths associated each year with the 15,000 different types of consumer products under CPSC's jurisdiction",93045,https://www.cpsc.gov/Recalls/1993/Wangs-International-Inc-Recalls-Wooden-Christmas-Toy-Trucks-Due-To-Choking-Hazard
"CPSC, Target Announce Recall of Summerville™ Toy Truck Sets",7/15/2004 ,"The recall includes Summerville™ four-piece truck sets. The multicolored trucks are about 4.5 inches long. Various types of trucks sold in the sets include dump trucks, cement trucks, utility trucks, garbage trucks, box trucks, fuel trucks, and tow trucks. Writing on the trucks includes EMERGENCY, HEAVY DUTY, or CITY SERVICE. Summerville™ and the item number 204 02 0458 are written on the packaging.",04179,https://www.cpsc.gov/Recalls/2004/CPSC-Target-Announce-Recall-of-Summerville-Toy-Truck-Sets-
"CPSC, Target Announce Recall of Children's Toy Trucks",7/19/2005 ,"The recall includes four-piece So Hot Way Cool Free Wheel Truck sets. Various trucks sold in the sets include a combination of fire trucks, oil trucks, vegetable trucks, sanitation trucks, tow trucks and box trucks. Writing on the trucks includes, EMERGENCY or CITY SERVICE. The words So Hot Way Cool Free Wheel Truck and the item number 204 02 0838 are written on the packaging.",05228,https://www.cpsc.gov/Recalls/2005/CPSC-Target-Announce-Recall-of-Childrens-Toy-Trucks-
"CPSC And Dan Brechner Announce The Recall Of Toy Bracelets And Wooden Dump Trucks",2/10/1995 ,"February 10, 1995 Release # 95-078 Washington, D.C. - CPSC, Dan Brechner and Co. Inc., of Floral Park, N.Y., is voluntarily recalling about 60,000 bracelets, model numbers 351-036 and 351-038, and 3,000 wooden dump trucks, model number TS 805 because of small parts that can be a hazard for young children.CPSC testing found that the beads can come off the bracelets. If ingested by young children, the beads can be inhaled into the lungs, causing breathing problems, recurring pneumonia, and even lung collapse that can lead to death. Testing of the wooden dump truck found that the figure in the driver's seat broke off the toy, which could cause a serious choking hazard to young children. To date, neither Dan Brechner nor CPSC has received reports of accidents or injuries associated with the bracelets or wooden dump truck.The model 351-036 bracelet has 10 pink, yellow, green, and orange round beads that are separated by black and white disks. The model 351-038 bracelet has eight salmon and white oblong twisted beads that are separated by eight smaller white beads. The beads are strung together on a white elastic cord, which makes the bracelets easy to slip on-and-off a young child's wrist.The 4 by 2-inch wooden dump truck is a red and natural wood color. It has a blue figure with a yellow cap in the driver's seat, the dump truck's bed can be lifted and lowered, and the truck rolls easily when pushed. The trucks are sold in a box labeled in part, EDUCATIONAL WOOD WORLD. . . DUMP TRUCK . . . TS 805 . . . MADE IN CHINA. A sticker underneath the dump truck reads, MADE IN CHINA.Dan Brechner distributed the recalled bracelets, which sold for $1.00, from May 1993 through August 1994. The recalled wooden dump trucks sold for $1.50 from May 1993 through August 1994. The bracelets and dump truck were sold nationwide at Sugar Loaf Mkt. Inc., Dream Machine, Amusement Games of Texas, Comeimex, Funspot, Dollar Fantasy, Funarama, Todi Toys Inc., and M.R. Distributing stores.Consumers should take the bracelets and dump truck away from young children immediately and destroy, discard, or if possible, return them to the store where they were purchased for a refund. However, the firm, Dan Brechner, is out of business and cannot be contacted",95078,https://www.cpsc.gov/Recalls/1995/CPSC-And-Dan-Brechner-Announce-The-Recall-Of-Toy-Bracelets-And-Wooden-Dump-Trucks
