Disclaimer: CPSC does not guarantee the accuracy, completeness, or adequacy of the contents of the Publicly Available Consumer Product Safety Information Database on SaferProducts.gov, particularly with respect to information submitted by people outside of CPSC.
Title,Date,Summary,Recall Number,Recall URL
"CPSC, Babies R Us and Playwell Announce Recall of Snail Push Toys",3/30/2004 ,"The brightly colored push toy is made of wood. The snail has moveable parts painted purple, green, yellow, or orange. The wheels have three colored balls (yellow, green and red) attached with string. The handle has a red ball on the end. The yellow and blue tag attached to the toy at point of sale states Imaginarium Baby and recommended for ages 1-3.",04109,https://www.cpsc.gov/Recalls/2004/CPSC-Babies-R-Us-and-Playwell-Announce-Recall-of-Snail-Push-Toys-
"Infantino Recalls Infant Toys Due to Choking Hazard",3/11/2009 ,"The recalled infant toys and their model numbers are listed below. Name of Toy Model Number Infantino Lil' Chef Set 158-201 and 558-201 Infantino Activity Stacker 158-202 Infantino Tag Along Chime Trio 150-3092 The model number is located on a yellow tag on the toy.",09146,https://www.cpsc.gov/Recalls/2009/Infantino-Recalls-Infant-Toys-Due-to-Choking-Hazard
"Imagine Nation Books Recalls Double Dazzler Light Show Toys Due to Burn Hazard",10/31/2012 ,"The recalled product is a silver, plastic, baton-like toy with white plastic tubes at each end that become multi-colored spinning lights when operated. The wand or stick device is 10.5 inches long and has an on button in the center hold area. The battery pack is located at the center handhold location. The package states DOUBLE DAZZLER LIGHT SHOW and Color Changing LEDs / Ages 8+ /Batteries Included.",13023,https://www.cpsc.gov/Recalls/2013/Imagine-Nation-Books-Recalls-Double-Dazzler-Light-Show-Toys-Due-to-Burn-Hazard
"CPSC, Käthe Kruse Doll Co. Announce Recall of Selecta Wooden Toys",12/15/1999 ,"Originally issued December 15, 1999, Revised July 9, 2001 Release # 00-033 Company Phone Number: (518) 273-0726 CPSC, Käthe Kruse Doll Co. Announce Recall of Selecta Wooden Toys WASHINGTON, D.C. - In cooperation with the U.S. Consumer Product Safety Commission (CPSC), Käthe Kruse Doll Co., of Troy, N.Y., is recalling about 2,400 Selecta wooden toys. The balls included with these toys are banned because they present a serious risk of choking deaths to young children.The CPSC and Käthe Kruse Doll Co. are not aware of any injuries involving the small balls contained in these toys. This recall is being conducted to prevent possible injuries.The Selecta brand toys being recalled are theQuatrino wooden shape sorter toys, Sorting Box shape sorter toys, Favola shape sorter toys, and Kugelbahn ball chute toys. The Selecta Quatrino wooden shape sorter toy has eight sides. There are shapes cut out of the top of the toy for inserting various wooden shaped pieces, including the two small balls. Four brightly colored doors on the side of the toy slide up to open the storage area for the wooden pieces. A sticker on one side of the toy shows a bee, and with beeswax is written on the sticker it in various languages. The Selecta Sorting Box wooden shape sorter toy has four sides. There are shapes cut out of the top of the toy for inserting various wooden-shaped pieces, including two small balls. A brightly colored door on the top of the toy slides out to open the storage area for the wooden pieces, including the two small balls. A sticker on the toy reads, Selecta Spieizeug, and Made in Germany.The Selecta Favola wooden shape sorter toy resembles a medieval castle with four sides and four cylindrical turrets. There is a wooden panel near the top of the toy that opens horizontally, allowing access to shape cut-outs for inserting various wooden pieces, including two small balls. A sticker on the bottom of the toy shows a bee, and with beeswax is written in various languages. The Selecta Kugelbahn wooden ball chute is a toy consisting of a series of four chutes attached to each other in an angled position designed to allow the two small balls included with the toy to descend and sound a number of bells that are attached to the chutes along the way. The toy includes a wooden painted clown attached to the center of the top chute. The Selecta brand logo appears on the front of the base of the toy.Toy stores and web sites sold these toys from January 1997 through November 1999 for $30 to $80.Consumers should take these toys away from young children immediately, and return them to the store where purchased for a refund. Consumers who purchased the toys from a web site should contact the web site to make arrangements for returning the toys for a refund. For more information, consumers should call Käthe Kruse Doll Co. at (518) 273-0726 between 9 a.m. and 5 p.m. ET Monday through Friday",00033,https://www.cpsc.gov/Recalls/2000/CPSC-Kathe-Kruse-Doll-Co-Announce-Recall-of-Selecta-Wooden-Toys
"Discovery Toys Recall of Children's Toy",4/2/2002 ,"Discovery Toys Recall of Children's Toy Recall Alert U.S. Consumer Product Safety Commission Office of Information and Public Affairs Washington, DC 20207 April 2, 2002 Alert #02-530 CPSC, Discovery Toys Announce Recall of Children's Toy PRODUCT: Children's maze toy -Discovery Toys of Livermore, Ca., is voluntarily recalling about 21,000 Up, Down & Around toddler maze toys, model #1612. The toy contains four-circuit flexible wires coated in blue, orange, red and yellow plastic tubes, sliding multi-colored shaped beads, and two abacuses that attach to a wooden base. The toy measures 9 1/2 inches by 8 inches by 7 inches. Four suction cups anchor the maze to most non-porous surfaces. Discovery Toys' Educational Consultants sold the recalled toy nationwide from July 2001 to January 2002. PROBLEM: The plastic tubes can break from the wooden base, releasing beads, posing a choking hazard to young children. INCIDENTS/INJURIES: Discovery Toys has received nine reports of the tubes breaking. No injuries have been reported. WHAT TO DO: Consumers should stop using the toy immediately and contact Discovery Toys to receive a free replacement. For more information, call Discovery Toys at (800) 341-8697, Monday through Friday PST 7:00 am to 3:30pm, visit the web site at www.discoverytoysinc.com, email productsupport@discoverytoys.net, or contact an educational consultant. Purchasers were sent direct mail notification of this recall.",02530,https://www.cpsc.gov/Recalls/2002/CPSC-Discovery-Toys-Announce-Recall-of-Childrens-Toy
"Bendable Dinosaur Toys Recalled by Kipp Brothers for Excessive Lead",10/11/2007 ,"The bendable dinosaur toys are about three inches long and come in brown, green or orange/green colors. While the toys were sold in boxes of 36, consumers may have received these products as a giveaway or promotional item from schools, libraries, churches, community groups, etc.",08020,https://www.cpsc.gov/Recalls/2008/Bendable-Dinosaur-Toys-Recalled-by-Kipp-Brothers-for-Excessive-Lead
"Imperial Toy Recall of Toy Feeding Sets",7/10/2001 ,"Imperial Toy Recall of Toy Feeding Sets NEWS from CPSC U.S. Consumer Product Safety Commission Office of Information and Public Affairs Washington, DC 20207 FOR IMMEDIATE RELEASE July 10, 2001 Release # 01-194 Imperial Toy Recall Hotline: (800) 543-6551 CPSC Consumer Hotline: (800) 638-2772 CPSC Media Contact: Mark Ross, (301) 504-7076 CPSC, Imperial Toy Corp. Announce Recall of Toy Feeding Sets WASHINGTON, D.C.- In cooperation with the U.S. Consumer Product Safety Commission (CPSC), Imperial Toy Corp., of Los Angeles, Calif., is voluntarily recalling about 100,000 toy feeding sets. The nipple on the toy baby bottle included in these sets could come off, posing a serious choking hazard to small children. CPSC and Imperial Toy Corp. are not aware of any incidents or injuries involving these toys. This recall is being conducted to prevent the possibility of injury or death. The plastic toy feeding set includes a baby bottle, plastic dish, strainer, spoon, juicer, and, in some sets, a funnel. The plastic sets were sold in various colors including blue, yellow, pink and purple. The packaging reads, CUDDLES FEEDING SET or CUDDLES MEAL TIME. The packaging also reads, Imperial, and NO. 8327. Ben Franklin, Revco and other discount stores nationwide sold the toys from October 1995 through May 2001 for about $2. Consumers should take these recalled toys away from young children immediately, and return the toy set to the store where purchased for a refund. For more information about this recall, consumers should call Imperial Toy Corp, at (800) 543-6551 between 9 a.m. and 5 p.m. PT Monday through Friday or write to the company at 2060 E. 7th Street, Los Angeles, CA 90021.",01194,https://www.cpsc.gov/Recalls/2001/CPSC-Imperial-Toy-Corp-Announce-Recall-of-Toy-Feeding-Sets
"Ambi Jack in the Ball Toy Recalled by Five Importers",4/14/1986 ,"Ambi Jack in the Ball Toy Recalled by Five Importers NEWS from CPSC U.S. Consumer Product Safety Commission Office of Information and Public Affairs Washington, DC 20207 FOR IMMEDIATE RELEASE April 14, 1986 Release # 86-24 Five Importers Recall Ambi Jack in the Ball Toy Washington, D.C. -- In cooperation with the Consumer Product Safety Commission, the Firms of Davis-Grabowski, Inc., Miami, Florida; Small World Toys, Culver City, California; U.S. Toy Company Inc., Grandview, Missouri; Childcraft Education Corp., Edison, New Jersey; and Playspaces International, Sudbury, Massachusetts, today announced a voluntary recall of their Jack in the Ball toy. Under use and abuse testing, the button (belly button) which activates the jack could fall out, becoming a potential choking hazard for young children. CPSC safety standards specify that toys for children under three (3) years of age must not have such small parts, because they can be aspirated, choked on, or swallowed. Since January 1985, a total of approximately 20,000 Jack in the Ball toys have been distributed nationwide by the 5 distributors. The toy retails for approximately $10.00. The CPSC is not aware of any reports of injuries involving this toy. The plastic Jack in the Ball is a combination roly-poly toy and jack in the box. It is available in several different color combinations, and measures approximately 4 inches by 5 inches. The toy is packaged in a carton labeled Ambi toys Jack in the Ball E153. The manufacturer is Europlastic, Amsterdam, Holland. Consumers should remove this toy from use immediately and return it to the retailer where purchased for a full refund. Retailers should remove this toy from sale immediately and consult the appropriate importer regarding their account.",86024,https://www.cpsc.gov/Recalls/1986/Five-Importers-Recall-Ambi-Jack-in-the-Ball-Toy
"CPSC, Learning Curve Int'l Inc. Announce Recall of Lamaze Activity Toys",4/4/2003 ,"April 4, 2003Alert #03-532 CPSC, Learning Curve Int'l Inc. Announce Recall of Lamaze Activity Toys PRODUCT: Activity Toys In cooperation with the U.S. Consumer Product Safety Commission (CPSC), Racing Champions Ertl/Learning Curve Int'l., Inc. (RCE/LCI), of Chicago, IL is voluntarily recalling approximately 3,800 children's activity toys. There are two types of activity toys involved in this recall. One toy is a flower shaped toy intended to attach to a stroller, with a green painted metal wire on which plastic beads slide along. The item is the Lamaze Flower Stroller Wrap (SKU #97222). The other toy is a floor-based toy with a foam stuffed base, a blue painted metal wire on which plastic beads and stuffed animal heads slide along. This item is the Lamaze Soft Bead Buddies (SKU #97325). Each item has a sewn-in label with the Lamaze logo on the front. These toys were sold in March 2003 through specialty and toy stores nationwide for around $19.99. PROBLEM: The paint on the metal wires of these toys contains excess levels of lead. Lead poisoning is a serious hazard to children and is associated with behavioral problems, learning disabilities, hearing problems and growth retardation.INCIDENTS/INJURIES: RCE/LCI has not received any reports of incidents or injuries involving these toys. This recall is being conducted to prevent the possibility of injury. WHAT TO DO: Consumers should immediately take these toys away from infants and young children. Consumers should contact RCE/LCI for return and replacement instructions at (800) 704-8697 between 8:00 a.m. and 5:00 p.m. CT, Monday through Friday or visit the company's web site at www.learningcurve.com.",03532,https://www.cpsc.gov/Recalls/2003/CPSC-Learning-Curve-Intl-Inc-Announce-Recall-of-Lamaze-Activity-Toys-
"Animal Voices Musical Toys Recalled By Toys R Us",2/26/1987 ,"Animal Voices Musical Toys Recalled By Toys R Us NEWS from CPSC U.S. Consumer Product Safety Commission Office of Information and Public Affairs Washington, DC 20207 FOR IMMEDIATE RELEASE February 26, 1987 Release # 87-013 Animal Voices Musical Toys Recalled Because of Choking Hazard WASHINGTON, DC -- In cooperation with the U.S. Consumer Product Safety Commission, Toys-R-Us, Rochelle Park, New Jersey is recalling Animal Voices Musical Toys, Model 670508B, because they have small parts which are a choking hazard. Tests conducted by CPSC show that when the toys are dropped, the metal noisemakers and springs, which are small parts, detach. To meet CPSC safety requirements, toys intended for children younger than 3 years old must not have any small parts. The Animal Voices Musical Toys are cardboard cylinders measuring l-3/4 inches long by l-5/8 inches in diameter. One end of the cylinder is metal with holes in it. The other end is covered with green paper with the word, TAIWAN, printed on it in several places. Pictures of animals are printed on the side of the cylinder. When the cylinder is tilted it makes a noise like a baby animal. The Animal Voices Musical Toys are packaged,in pairs on a pink card labeled RECOMMENDED FOR AGES 6 MONTHS AND UP 2 PC ANIMAL VOICES 1986 SUMMCO INTERNATIONAL LTD., P.O. BOX 96-306 TAIPEI, TAIWAN DISTRIBUTED BY LASH DISTRIBUTORS, ROCHELLE PARK, N.J. 07662 NO. 670508 * * *. Approximately 56,500 of these toys, which were imported from Taiwan, were sold nationwide through Toys-R-Us stores from April, 1985 to December, 1986 for approximately $1.48. Although the CPSC and Toys-R-Us have not received reports of any injuries or deaths involving this toy, consumers should take these toys away from children and return them to any Toys-R-Us store for full refund of the purchase price. Anyone wishing additional information may call Toys-R-Us at 201-368-5433 or CPSC toll-free hotline number at 800-638-CPSC. A teletypewriter number for the hearing impaired is (301) 595-7054.",87013,https://www.cpsc.gov/Recalls/1987/Animal-Voices-Musical-Toys-Recalled-Because-of-Choking-Hazard
"CPSC, Wal-Mart Stores Announce Recall of Reef Rocker Infant Toys",2/15/2005 ,"This recall involves Baby Connection Reef Rocker infant toys. The floor toy is intended for children ages 3 months and above. The toy's water-filled dome and four toy balls have colorful sea creatures inside. Lights and music are activated when the toy is shaken.",05111,https://www.cpsc.gov/Recalls/2005/CPSC-Wal-Mart-Stores-Announce-Recall-of-Reef-Rocker-Infant-Toys-
"CPSC, Imperial Toy Corporation Announce Toy Recall",12/5/1995 ,"December 5, 1995 Release # 96-032 WASHINGTON, D.C. - In cooperation with the U.S. Consumer Product Safety Commission (CPSC). Imperial Toy Corporation of Los Angeles, Calif., is voluntarily recalling about100,000 toy vehicles, aquatic animals, bottle feeding sets, and meal time sets. The toys can break into small pieces, presenting a choking hazard to small children.The toy vehicles were sold in six styles: two types of cars, a bulldozer, tow truck, dump truck, and cement truck. The plastic vehicles, measuring 4 inches long, 2.75 inches wide, and 3 inches high, have black chassis and brightly colored carriages. The wheels generate sparks that are visible through the vehicles' windows as the toys roll. The toys were sold individually for $2 each from bulk containers labeled in part, Imperial Mighty Machines Motorized Big Wheel Sparklers***. The toys break into small pieces which could choke children.The aquatic animal toys, measuring 3 inches long, were sold in four styles with three of the styles included in this recall: Tammy the Turtle, Peppy the Penguin, and Sally the Seal. The brightly colored plastic wind-up toys have moving parts that propel them through water.The toys were sold individually for about $4 on blister packed cards labeled in part, Aqua Wind Ups *** Imperial *** Swimming Aqua Animals *** No 8180. The animals' flippers, feet and snouts break off and present a choking hazard to small children. The Benjie the Beaver aquatic toy is not included in this recall. The toy bottle feeding set consists of two 3-inch high plastic baby bottles. The orange bottle has blue trim with a blue cap. The clear bottle trimmed in pink has a pink cap. The bottles were sold in pairs for $2 and were blister packed on cardboard and labeled in part, Imperial Cuddles Bottle Feeding Set *** No 8233. If the bottle's nipple and funnel break apart and children put the pieces in their mouths, the children could choke.The plastic toy meal set includes a plastic dish, feeding bottle, two strainers, and a funnel made of blue, yellow, pink, and purple plastic. The toys sold for about $2 and were blister packed on a card labeled in part, Imperial *** My Dolly Meal Time *** NO. 8327. The end of the bottle breaks off and presents a choking hazard.Ben Franklin, Revco, and toy stores nationwide sold the toys imported from China from 1993 to April 1995. Consumers should take these recalled toys away from young children immediately and return the toys to the store where purchased for a full refund. For more information about this recall, consumers should call Imperial Toy Corporation at (800) 543-6551, or write to the company at 2060 E. 7th Street, Los Angeles, CA 90021.CPSC and Imperial Toy Corporation are not aware of any injuries involving these toys. This recall is being conducted to prevent the possibility of injury",96032,https://www.cpsc.gov/Recalls/1996/CPSC-Imperial-Toy-Corporation-Announce-Toy-Recall
"CPSC, Creative Consumer Concepts Inc. and Whataburger Inc. Announce Recall of Kid's Meal Toys",4/26/2001 ,"April 26, 2001Release # 01-135 Compass Toy Recall Hotline: (866) 327-2216 CPSC Consumer Hotline: (800) 638-2772 CPSC Media Contact: Nychelle Fleming, (301) 504-7063 CPSC, Creative Consumer Concepts Inc. and Whataburger Inc. Announce Recall of Kid's Meal Toys WASHINGTON, D.C. - In cooperation with the U.S. Consumer Product Safety Commission (CPSC), Creative Consumer Concepts Inc., of Overland Park, Kan., and Whataburger Inc., of Corpus Christi, Texas, are voluntarily recalling about 330,000 Whatagear compass toys. Creative Consumer Concepts Inc. manufactured these toys, which were distributed with kids' meals at Whataburger Restaurants. The clear, plastic lens covers on these compass toys can come off and pose a choking hazard to young children.Creative Consumer Concepts, Inc. has received four reports of the lens covers of the compass toys coming off. No injuries have been reported.The Whatagear compass is a plastic toy with a compass in its center. The toys have varied features, such as flashlights, magnifying lenses or tools. They come in various solid colors. The back of the compass reads, WHATAGEAR and WHATABURGER.Whataburger Restaurants in Alabama, Arizona, Florida, Louisiana, New Mexico, Oklahoma and Texas distributed the toys from March 2001 through April 2001.Parents should take these toys away from children immediately, and return the toy to any Whataburger Restaurant for a free replacement toy. For more information, call Creative Consumer Concepts toll-free at (866) 327-2216 anytime; write to: Creative Consumer Concepts Inc., ATTN: Compass, 10955 Granada Lane, Overland Park, KS 66211; or go to the firm's web site at www.c3.to",01135,https://www.cpsc.gov/Recalls/2001/CPSC-Creative-Consumer-Concepts-Inc-and-Whataburger-Inc-Announce-Recall-of-Kids-Meal-Toys
"Wooden Beads & Tops Recalled",12/17/1996 ,"Wooden Beads & Tops Recalled NEWS from CPSC U.S. Consumer Product Safety Commission Office of Information and Public Affairs Washington, DC 20207 FOR IMMEDIATE RELEASE CONTACT: Ken Giles December 17, 1996 (301) 504-7052 Release # 97-042 Wooden Toys Recalled Because of Lead Paint WASHINGTON, D.C. - In cooperation with the U.S. Consumer Product Safety Commission (CPSC), Oriental Trading Company of Omaha, Neb., is voluntarily recalling approximately 44,400 wooden toys because some of the paint on the toys contains high levels of lead. CPSC standards ban toys containing high levels of lead. Young children might swallow lead if they chewed on these toys. Although no reports of illness or injury have been received, this recall is being conducted to prevent the possibility of lead poisoning. Two types of wooden toys are involved in this recall. One toy is a set of 32 wooden beads with a cord for stringing the beads, packaged in a clear plastic bag labeled (in part): OTC Item No. M-027/653 QTY: 1PC MADE IN CHINA. The other toy is a set of six spinning tops, packaged in a clear plastic bag labeled (in part): OTC ITEM NO: M-027/294 QTY: 1 SET MADE IN CHINA. These two toys were sold from September 1994 to November 1996 through the firm's catalogs for under $4 and through retail stores. Consumers who purchased these wooden toys from toy stores should return them for a full refund or full credit. Consumers who purchased the toys through Oriental Trading's catalog should call the company at (800) 228-0045 to obtain refund instructions.",97042,https://www.cpsc.gov/Recalls/1997/Wooden-Toys-Recalled-Because-of-Lead-Paint
"Plush Shape Sorters and Stacking Toys Recalled by Gymboree",7/24/2000 ,"Plush Shape Sorters and Stacking Toys Recalled by Gymboree NEWS from CPSC U.S. Consumer Product Safety Commission Office of Information and Public Affairs Washington, DC 20207 FOR IMMEDIATE RELEASE July 24, 2000 Release # 00-150 Company Phone Number: (800) 222-7758 CPSC Consumer Hotline: (800) 638-2772 CPSC Media Contact: Kim Dulic, (301) 504-7058 CPSC, Gymboree Announce Recall of Plush Shape Sorters and Stacking Toys PRODUCT: Plush Shape Sorter Toys - The Gymboree Corp., of Burlingame, Calif., is voluntarily recalling about 19,000 plush shape sorter toys. The toy is a multi-colored, plush fabric sorter box with six shapes that rattle, crackle or squeak, and have a multi-pattern design including, green with blue polk-a-dots, red and orange checks, and blue and green stripes. A label on the toy reads, GYMBOREE and Made In China. Gymboree and Play & Music Stores, and the Gymboree web site sold the toys nationwide from November 1998 through April 2000 for about $20. PROBLEM: The stuffing of the toys can contain sewing needles and sharp metal pieces. Young children could ingest or be cut by these sharp metal pieces. INCIDENTS/INJURIES: There has been one report of a part of a sewing needle in the stuffing of the plush shape sorter toy. After searching through its inventory, the firm found five additional plush shape sorter toys with sharp metal pieces. No injuries have been reported. WHAT TO DO: Stop using the toys immediately, and return it to the store where purchased for a refund. For more information, contact Gymboree at (800) 222-7758 between 9:00 a.m. and 5:00 p.m. PT Monday through Friday. PRODUCT: Plush Stacking Toys - The Gymboree Corp., of Burlingame, Calif., is voluntarily recalling about 12,000 plush stacking toys. The toy has four mutli-colored stacking shapes that graduate from large to small with plush fabric that rattle, crackle or squeak. The shapes of the stacking toy are a circle, square, triangle and star, and have multi-pattern designs including green with purple polk-a-dots, red and orange checks, and blue and green stripes. A label on these toys read, GYMBOREE and Made In China. Gymboree and Play & Music Stores, and the Gymboree web site sold the toys nationwide from November 1998 through June 2000 for about $20. PROBLEM: The stuffing of the toys can contain sewing needles and sharp metal pieces. Young children could ingest or be cut by these sharp metal pieces. INCIDENTS/INJURIES: After searching through its inventory, the firm found sharp metal pieces in six of the plush shape stacking toys. No injuries have been reported. WHAT TO DO: Stop using the toys immediately, and return it to the store where purchased for a refund. For more information, contact Gymboree at (800) 222-7758 between 9:00 a.m. and 5:00 p.m. PT Monday through Friday.",00150,https://www.cpsc.gov/Recalls/2000/CPSC-Gymboree-Announce-Recall-of-Plush-Shape-Sorters-and-Stacking-Toys
