"One Step Ahead Recalls Children's Stacking Toys Due to Choking and Aspiration Hazard",6/3/2010 ,"This recall involves Animal Crackers Giant Stacking Toys. The multi-colored toy has five plush stacking rings that stack and rest on a stationary turtle base. The rings represent different animals including a frog, dog, cat, rabbit, mouse and chick. A fish is on top of the center pole. Each ring makes a different sound: rattle, jingle, crinkle and squeak. One Step Ahead is printed on a white tag attached to the toy. The toy measures about 19 inches high and 10 inches wide when assembled.",10741,https://www.cpsc.gov/Recalls/2010/One-Step-Ahead-Recalls-Childrens-Stacking-Toys-Due-to-Choking-and-Aspiration-Hazard
"CPSC, Playskool Announce Recall to Replace Busy Poppin' Pals Toys",8/16/2000 ,"Originally issued August 16, 2000, Revised October 24, 2002 Release # 00-164 Playskool Recall Hotline: (800) 752-9755 CPSC Consumer Hotline: (800) 638-2772 CPSC Media Contact: (301) 504-7908 Note: phone number change CPSC, Playskool Announce Recall to Replace Busy Poppin' Pals Toys WASHINGTON, D.C. - In cooperation with the U.S. Consumer Product Safety Commission (CPSC), Playskool, of Pawtucket, R.I., is voluntarily recalling to replace 420,000 Busy Poppin' Pals toys. Small springs inside the toy can break loose, posing a choking and laceration hazard to young children.Playskool has received 16 reports of the springs breaking. Five children put the broken springs in their mouths, resulting in two children suffering lacerations. The Playskool Busy Poppin' Pals is a 13 inch long white plastic toy with blue, yellow and red buttons, levers and knobs of various shapes that, when activated, make animal characters pop up from under the toy's base. The animals are hidden under blue, yellow or red lids that have the numbers one through five on top. The lid colors match the color of the buttons, levers and knobs that activate them. The pop-up animals are a giraffe, elephant, panda bear, lion and monkey. The toy has a white carry handle and has the Playskool logo on the front. The model number 5415 and MADE IN CHINA are imprinted on the bottom of the toy. Mass merchandise and toy stores, including Toys R Us, sold these toys nationwide for about $10. The toys were sold from January 1996 through August 2000.Consumers should take these toys away from young children immediately and contact Playskool at (800) 752-9755 anytime or visit their web site at http://www.hasbro.com/consumer/safety.html to receive a free, redesigned replacement toy.Busy Poppin Pals, with model number 6205 have different springs, and are not part of the recall. Consumers can also view a video clip about this recall (transcript). This is in streaming video format",00164,https://www.cpsc.gov/Recalls/2000/CPSC-Playskool-Announce-Recall-to-Replace-Busy-Poppin-Pals-Toys
"Wooden Stacking Ring Toys Voluntary Recall by IKEA",5/11/1999 ,"Wooden Stacking Ring Toys Voluntary Recall by IKEA NEWS from CPSC U.S. Consumer Product Safety Commission Office of Information and Public Affairs Washington, DC 20207 FOR IMMEDIATE RELEASE May 11, 1999 Release # 99-110 Company Phone Number: (800) 793-5408 CPSC Consumer Hotline: (800) 638-2772 CPSC Media Contact: Nychelle Fleming, (301) 504-7063 CPSC, IKEA Announce Voluntary Recall of Wooden Stacking Ring Toys to Replace Top Red Ball Pieces WASHINGTON, D.C. - In cooperation with the U.S. Consumer Product Safety Commission (CPSC), IKEA U.S. Inc., of Plymouth Meeting, Pa., is voluntarily replacing the red ball pieces on top of the wooden stacking rings on about 28,000 stacking ring toys. The red ball that tops this toy poses a choking hazard to young children. IKEA has received one report of a 4-year-old boy in Europe choking to death on the top ball portion of the stacking ring toy. No other injuries have been reported. The stacking ring toy, called MULA, is 8.5 inches high. The toy consists of eight brightly colored, wooden rings; a red, top ball; and a pedestal base with a stacking rod. When all the pieces are stacked in order, the toy resembles an inverted cone with the red ball capping it. There is a sticker under the pedestal base with the words, Design and Quality and IKEA of Sweden written on it. The toy is packaged in either a white cardboard box with MULA printed in orange, or sold shrink-wrapped with MULA and Stacking rings printed on the plastic wrapping. IKEA stores nationwide sold these stacking toys from October 1991 through April 1999 for about $6. Consumers should take the red ball that tops this toy away from children immediately. Consumers can mail the ball to IKEA or take it to any IKEA store to receive a redesigned top piece. The red ball can be mailed to IKEA U.S. Inc., 496 West Germantown Pike, Plymouth Meeting, PA 19462. Postage costs will be reimbursed. Consumers also can return the stacking ring toy to any IKEA store for a refund. For more information, consumers should call IKEA at (800) 793-5408 between 9 a.m. and 9 p.m. EDT Monday through Saturday.",99110,https://www.cpsc.gov/Recalls/1999/CPSC-IKEA-Announce-Voluntary-Recall-of-Wooden-Stacking-Ring-Toys-to-Replace-Top-Red-Ball-Pieces
"CPSC, Schylling Associates Inc. Announce Recall of More Jack-In-the-Box Type Toys",12/12/2003 ,"Two designs of the Jack-In-the-Box type toys are included in this recall, both of which play Pop Goes the Weasel when the crank is turned. One is based on Dr. Seuss' Cat in the Hat, and the other is based on Ian Falconer's Olivia the Pig character. The Cat in the Hat box is red, yellow and blue and has a black and white cat dressed in a red and white hat that pops out of the box. CAT IN THE HAT is written on the box lid. The Olivia box is black- and salmon-colored with CIRCUS written around the top sides. The Olivia character dressed as clown pops out. Schylling Associates Inc. previously recalled a Bear Jack-In-the-Box type toy in November with the same hazard.",04050,https://www.cpsc.gov/Recalls/2004/CPSC-Schylling-Associates-Inc-Announce-Recall-of-More-Jack-In-the-Box-Type-Toys
"CPSC, BRIO® Corporation Announce Recall of Caterpillar Pull Toy",10/10/2002 ,"The recalled pull-along caterpillar is bright red and yellow and was sold under the Plan Toys brand name. The wooden caterpillar is about 7 inches long and is pulled by a nylon string. The caterpillar's antenna are two blue protruding pegs that extend about 1/2 inch from the head. The recalled lot numbers are 0645917, 12142323 and 0724423 and are printed on the inside flap of the packaging. A stamp on the top of the tail end of the caterpillar displays the Plan Toys logo and the words Made in Thailand.",03013,https://www.cpsc.gov/Recalls/2003/CPSC-BRIO-Corporation-Announce-Recall-of-Caterpillar-Pull-Toy-
"CPSC, Maxim Enterprise Inc. and Zany Brainy Inc. Announce Recall of Wooden Pull Toy",3/20/2000 ,"March 20, 2000Release # 00-081 Company Phone Number: (888) 266-2946 CPSC Consumer Hotline: (800) 638-2772 CPSC Media Contact: Nychelle Fleming, (301) 504-7063 CPSC, Maxim Enterprise Inc. and Zany Brainy Inc. Announce Recall of Wooden Pull Toy WASHINGTON, D.C. - In cooperation with the U.S. Consumer Product Safety Commission (CPSC), Maxim Enterprise Inc., of Middleboro, Mass., and Zany Brainy Inc., of King of Prussia, Pa., are recalling about 4,900 wooden pull toys. The pull toy's wheels can break off and the bead can detach from the pull string, posing small parts choking hazards to young children. The firms have received a report of wheels coming off and a report of the bead detaching from the pull string. The detached bead was found in a child's mouth. No injuries were reported. The toy is called the Wooden Pull Along Bead Coaster, which is written on the packaging. It is a flat, wooden platform with wooden wheels, and is about 10 inches long. On top of the platform are twisting, red and blue plastic wires threaded with multi-colored beads. The red pull string that attaches to the platform has a bead at the end. BEAD COASTER is printed on top of the wood platform of the toy in multicolor block letters. The pull toy was part of a toy box set from the Childhood Classics Wooden Chest and Toy Collection. The other toys in the set included wood puzzles, a pounding bench and a block set",00081,https://www.cpsc.gov/Recalls/2000/CPSC-Maxim-Enterprise-Inc-and-Zany-Brainy-Inc-Announce-Recall-of-Wooden-Pull-Toy
"Klackeroo Toy Recalled by Playskool",9/14/2000 ,"Klackeroo Toy Recalled by Playskool NEWS from CPSC U.S. Consumer Product Safety Commission Office of Information and Public Affairs Washington, DC 20207 FOR IMMEDIATE RELEASE Originally issued September 14, 2000, Revised October 24, 2002 Release # 00-181 Recall Hotline: (800) 752-9755 CPSC Consumer Hotline: (800) 638-2772 CPSC Media Contact: Kim Dulic, (301) 504-7058 Playskool Contact: Audrey Basso, (401) 727-5857 Note: phone number change CPSC, Playskool Announce Recall to Replace Infant Toys WASHINGTON, D.C. - In cooperation with the U.S. Consumer Product Safety Commission (CPSC), Playskool, of Pawtucket, R.I., is voluntarily recalling to replace about 550,000 Klackeroo toys. The toy's brightly colored end knobs can detach and allow small, geometric-shaped pieces to come loose, posing a choking hazard to infants and young children. Playskool has received 10 reports of the toy's knobs detaching to release small parts, including four reports of a small part from the toy being found in the mouths of infants and young children. There have been no reported injuries. Playskool's Klackeroo is a brightly colored toy with orange plastic rods and small geometric shapes that move through a center purple ball. Solid-colored knobs with animal faces or the sun and moon imprinted on them cap both ends of each orange rod. When shaken, the rods move through the ball and the geometric shapes slide along each rod, making a clacking sound. The knobs are green, yellow, blue and red. The Playskool logo is imprinted on one end knob and MADE IN CHINA is imprinted on the center ball. Toy and mass merchandise stores, including Toys R Us and Wal- Mart, sold these toys from October 1997 through September 2000 for about $8. Parents and caregivers should take the toy away from infants and young children immediately, and contact Playskool anytime at (800) 752-9755 to receive a free, redesigned replacement toy. The recalled products will be replaced by a redesigned Klackeroo toy (model number 5542) which will feature a red center ball with no sliding geometric shapes.",00181,https://www.cpsc.gov/Recalls/2000/CPSC-Playskool-Announce-Recall-to-Replace-Infant-Toys
"Children's Outdoor Water Toy Corrected by Wham-O",3/10/1980 ,"Children's Outdoor Water Toy Corrected by Wham-O NEWS from CPSC U.S. Consumer Product Safety Commission Office of Information and Public Affairs Washington, DC 20207 FOR IMMEDIATE RELEASE March 10, 1980 Release # 80-007 Wham-O To Correct Potential Hazard In Children's Outdoor Water Toy WASHINGTON, D.C. (March 10)-- A program to correct more than 100,000 outdoor Fun Fountain water toys which may cause serious injuries to children is being conducted by the Wham-O Mfg. Co. of San Gabriel, California. The firm, in cooperation with the U.S. Consumer Product Safety Commission, voluntarily will supply free corrective water flow control valve inserts for its Fun Fountain toys produced from 1977 through November, 1979. The toy consists of a clown hat and head which attaches onto the end of a garden hose so that the hat rises in the air when water flows through the clown's head. Children may be inclined to peer into the water outlet and the stream of water could cause serious eye injuries, especially in communities with high water pressure. CPSC so far has been informed of two consumer complaints since June, 1979, involving a six-year-old boy and a seven-year- old boy who suffered eye injuries when struck at close distance by water emitted from the Fun Fountain toys. The Wham-O Fun Fountain water toys were sold nationwide in toy stores and variety stores for approximately $10.00 each. The model number of the toy, #237, is imprinted on the toy's package. According to the company, the potential hazard has been corrected on all Fun Fountain toys manufactured since December, 1979 when the toys began to be produced with a water flow control valve to decrease and control the water flow. Such new editions are readily identifiable since they are equipped with a blue hose connector (the older design has a red connector) at the base of the clown head. The words Important Notice and Safety Check List also are imprinted on the new toy cartons. If the hose connector is red but contains a blue insert which is clearly visible, then it also has been corrected and is equipped with a water flow control valve. To correct the potential hazard in Fun Fountain toys manufactured before December, 1979, parents are urged to go to the place of purchase to receive a free water flow control valve insert, or they may contact Wham-O directly to receive a free valve insert (Customer Service Dept. 7, 835 East El Monte Street, San Gabriel, California, 91778). Consumers also may telephone Wham-O toll-free at 800/423-4174 (in California, call collect at 213/287-9681). The water flow control valve snaps easily into the hose connector and once installed will remain firmly within the connector, according to the company.",80007,https://www.cpsc.gov/Recalls/1980/Wham-O-To-Correct-Potential-Hazard-In-Childrens-Outdoor-Water-Toy
"U.S. Toy Company, Inc. Recalls Four Toys Because Of A Potential Choking Hazard",3/27/1991 ,"March 27, 1991 Release # 91-049 U.S. Toy Company, Inc. Recalls Four Toys Because Of A Potential Choking Hazard WASHINGTON, DC -- U.S. Toy Co., Inc. of Grandview, MO is voluntarily recalling four toys because small components separate from the toys and are a choking or aspiration hazard to young children. The recall of the following four toys is being conducted in cooperation with the U.S. Consumer Product Safety Commission (CPSC). These toys were originally sold throughout the country from 1988 through July 1990. Hippo Counter (#RO-1005) Imported from Taiwan, consists of a two-tone plastic body with pasted-on eyes. There are four metal wires mounted on the Hippo's back for counting beads. The wires may detach from the body of the hippo releasing the counting beads. The package reads in part: Ages 2 and up, Toddlers learn to count from 1 to 5 by 'flipping' the easy-moving counters... Approximately 1,000 toys sold for $4.95 each and were made in Taiwan. 9 Angel Doll (#MU69) Imported from China, consists of a soft body with a plastic head and painted on face. The hair is made of straight fine yarn with a bow at the top of the head. These dolls are dressed in a one-piece outfit which has elastic at the neck, wrists, and legs. Their hands hold a bouquet of flowers. These flowers have a plastic center which could break during use and present an aspiration hazard to children. Approximately 600 dolls sold for $2.50 and were made in China. Pull-Along Activity Loco (#HKT-7277) Imported from Hong Kong, consists of an eight and one-quarter-inch tall train engine on four red plastic wheels. The toy has nine different fun activities which include a spinning telephone dial with ringing bell, a squeaking whistle, windows with sliding mirrored shades, a funny clock face with movable hands, a colorful wheel that turns around, a spinning ball headlight, colorful counting rings, a see-through smokestack with tumbling beads and a click-click sound when moved along. This toy may break during during use releasing the tumbling beads from the see-through smokestack and exposing sharp points under the front wheels. An estimated 900 Pull-Along Activity Locos sold for approximately $14.95 each and were made in China. The package states in part Age over 18 months. Tell By Touch (#CPX-48) Imported from Thailand, consists of a wooden board with 10 circular openings for placement of 10 matching cylinders. Each opening and each cylinder has a textured top surface ranging from soft velvet to rough sandpaper. The cylinder pieces are small enough to present a serious choking hazard to young children. Approximately 800 toys were sold for an estimated $14.95 each and were made in Thailand. This recall affects only those Tell by Touch toys that have cylinders with red painted sides purchased before January 1, 1990. Consumers are urged to take these toys away from young children and return them to the store where purchased for a exchange or gift certificate. Consumers with additional concerns or questions about this recall may write to U.S. Toy Co., Inc., 1227 East 119th Street, Grandview, MO 64030. These hazardous toys were identified as a result of a consumer complaint in addition to a joint surveillance program conducted between the CPSC and the U.S. Customs Service at the Port of Kansas City. Neither the CPSC nor the U.S. Toy Company is aware of any injuries caused by these four toys. The CPSC's mission is to protect the public from unreasonable risks of injury and death associated with consumer products. The CPSC is the Federal agency responsible for consumer product safety. Some 15,000 different kinds of consumer products fall within the Commission's jurisdiction and each year these products are involved in an estimated 30 million injuries and 22,000 deaths",91049,https://www.cpsc.gov/Recalls/1991/US-Toy-Company-Inc-Recalls-Four-Toys-Because-Of-A-Potential-Choking-Hazard
"Spinning Ride Toys Recalled by Today's Kids",6/27/2000 ,"Spinning Ride Toys Recalled by Today's Kids NEWS from CPSC U.S. Consumer Product Safety Commission Office of Information and Public Affairs Washington, DC 20207 FOR IMMEDIATE RELEASE Originally issued June 27, 2000, Revised April 16, 2004 Release # 00-133 CPSC Consumer Hotline: (800) 638-2772 CPSC Media Contact: Ken Giles, (301) 504-7052 Note: Firm is out of business and a replacement toy is no longer available. Do not use these products. Please discard or destroy these products. CPSC, Today's Kids Announce Recall of Spinning Ride Toys WASHINGTON, D.C. - In cooperation with the U.S. Consumer Product Safety Commission (CPSC), Today's Kids, of Dallas, Texas, recalledabout 103,000 spinning ride toys. The center column can break, causing a child to suddenly fall backward or be hit in the face by the broken column. Today's Kids had received 1,427 reports of the toys'columns breaking off, resulting in five injuries. Injuries include bumps on heads, cut faces and split lips. Two children required stitches. The Music & Lights Kidaround Spinner? is a purple turntable with a green column through the middle, which is topped by a yellow steering wheel. The child sits on the turntable and spins around by turning on the steering wheel. The toy plays five songs and lights flash while the child is spinning. The toy's packaging indicates it is intended for children 11/2 to 5 years old. A sticker on the center of the steering wheel reads, today's kids®. The battery cover, on the side of the green column reads, MADE IN CHINA. The bottom of the turntable reads, MADE IN U.S.A.. Toy and discount department stores nationwide sold these spinning ride toys from July 1999 through May 2000 for about $20. Consumers should take these spinning ride toys away from children immediately, and discard or destroy these products. The firm is out of business and cannot be contacted, and a replacement toy is no longer available.",00133,https://www.cpsc.gov/Recalls/2000/CPSC-Todays-Kids-Announce-Recall-of-Spinning-Ride-Toys
"Toy Phonograph Recalled by Electronic Creations",1/14/1977 ,"Toy Phonograph Recalled by Electronic Creations NEWS from CPSC U.S. Consumer Product Safety Commission Office of Information and Public Affairs Washington, DC 20207 FOR IMMEDIATE RELEASE January 14, 1977 Release # 77-004 CPSC Bans Toy Phonograph NEW YORK (Jan. 14) -- The U.S. Consumer Product Safety Commission today announced the recall of a toy phonograph which poses a possible electric shock hazard to the user. The toy, Teletone Model 54740 Phonograph manufactured by Electronic Creations Co., Inc., Mt. Vernon, New York fails to comply with Federal regulations for electrically operated toys and is banned from sale. Although no injuries associated with this product have been reported, the phonograph case split open during use and abuse testing by the Commission staff exposing the live parts of the mechanism. Additionally, the cord is not adequately secured to the unit and is shorter than the minimum required length of 5 feet. The phonograph comes packaged in a cardboard box that has a picture of the phonograph and a blue, black and white label on the front which reads in part Solid State Phonograph Teletone Caution- Electric Toy Not Recommended for Children Under 3 Years of Age **Model 54740** UL. The phonograph case is brown and white plaid and white pressboard. The phonograph was distributed nationwide to department stores, toy stores, electronic stores and other retail outlets. It sold for about $20.95. Approximately 4,200 units are involved in the recall. Electronic Creations Co., Inc. is voluntarily recalling the phonograph. Consumers should return it to the place of purchase or directly to the manufacturer at 444 South 9th Avenue, Mt. Vernon, New York 10550 for a full refund. Electric toys are subject to regulation under the Federal Hazardous Substances Act, which requires products banned to be repurchased by the manufacturer, distributor, or dealer. The Commission learned of this product as the result of a nationwide electric toy survey it conducted late last year. The Commission's New York Area Office is monitoring the recall.",77004,https://www.cpsc.gov/Recalls/1977/CPSC-Bans-Toy-Phonograph
"Holgate Toys Recalls Playmat Sets Due to Choking Hazard; Sold Exclusively at Wegmans Food Stores",8/8/2013 ,"The Wegmans Playmat Set includes a 24-inch by 30-inch cotton canvas playmat and four toy wooden vehicles. The toy vehicles include a blue car, a red Wegmans delivery van, a green Wegmans farm tractor and a yellow School Bus. The sets were sold in a yellow box measuring about 12-inches by 12-inches with Wegmans Playmat Set, an age label circle with 2+ and Made in the USA printed on the front of the box. UPC Code 0 7789028735 4 is printed on the back of the box.",13262,https://www.cpsc.gov/Recalls/2013/Holgate-Toys-Recalls-Playmat-Sets
"CPSC, Tai Tung International Recall Car and Washing Machine Toys",10/21/2004 ,"The recall includes an ice cream car, a police car and a toy washing machine. The multicolored cars are about 5 inches long and contain various stickers. The pink, white, or red toy washing machines are 4.5 inches high. The toys make animal and music sounds. When the music and animal sounds play, lights flash and the toy's multicolored beads can be seen moving inside. CE and MADE IN CHINA are written on the battery cover.",05020,https://www.cpsc.gov/Recalls/2005/CPSC-Tai-Tung-International-Recall-Car-and-Washing-Machine-Toys-
"Wooden Toys Recalled by Earth Friendly Due To Choking Hazards",10/30/2008 ,"This recall involves three models of wooden toys. Moee the car, Cubby the stackable bear and the Bell rattle. The toys are painted in glossy red, orange, green, red, black and yellow.",09030,https://www.cpsc.gov/Recalls/2009/Wooden-Toys-Recalled-by-Earth-Friendly-Due-To-Choking-Hazards
"Laugh & Learn™ Kitchen Toys Recalled by Fisher-Price Due To Choking Hazard",11/6/2007 ,"The recall involves a play kitchen learning toy with a pretend refrigerator, range and sink. The product's item number L5067 is stamped in several locations on the toy and printed on the product's packaging above the UPC.",08063,https://www.cpsc.gov/Recalls/2008/Laugh--Learn-Kitchen-Toys-Recalled-by-Fisher-Price-Due-To-Choking-Hazard
"Children's Toys Recalled by Dollar Tree Stores Due to Violation of Lead Paint Standard",12/13/2007 ,"The Baby Bead & Wire Toys are colored wires and colored beads that can slide on a natural wood platform. These bead toys have item number 903419 and date code 71 printed on the back of the packaging. The Speed Racer Pull Back & Go Action! Cars are yellow with black stripes and white with red stripes. Item number 873820 and date code 77 is printed on the back of the packaging.",08133,https://www.cpsc.gov/Recalls/2008/Childrens-Toys-Recalled-by-Dollar-Tree-Stores-Due-to-Violation-of-Lead-Paint-Standard
"Folding Toy Beach Chairs Recalled by Build-A-Bear Workshop Due to Laceration Hazard",5/14/2009 ,"This recall involves a wood frame, canvas seat, toy beach chair for stuffed animals. Some styles include an attached pillow. The toy chairs are blue (style #'s 002281, 004463, 009907, 011565, 102281, 109907, 111565), red (style #'s 007391, 011566, 107391, 111566), fuchsia/white stripe (style #'s 013226, 113226), Orange/white stripe (style #'s 013227, 113227).",09220,https://www.cpsc.gov/Recalls/2009/Folding-Toy-Beach-Chairs-Recalled-by-Build-A-Bear-Workshop-Due-to-Laceration-Hazard
"AAFES Recalls Soldier Bear Toys Due to Violation of Lead Paint Standard",12/19/2007 ,"This recall involves the following wooden toys and a plastic military vehicle toy playset. The style number, UPC codes and Soldier Bear logo are printed on the toy's packaging. Toy Description Style UPC Wooden Pull-Along Learning Blocks Wagon (alphabet blocks in a wooden wagon) 6320 834162002158 Time Teacher (magnetic shapes & clock in pull cart) 6231 834162002646 Wooden Riding Horse 6349 834162003698 Vehicle Playset (blue military vehicle with action figures) 1007 4895130810072",08141,https://www.cpsc.gov/Recalls/2008/AAFES-Recalls-Soldier-Bear-Toys-Due-to-Violation-of-Lead-Paint-Standard
