Disclaimer: CPSC does not guarantee the accuracy, completeness, or adequacy of the contents of the Publicly Available Consumer Product Safety Information Database on SaferProducts.gov, particularly with respect to information submitted by people outside of CPSC.
Title,Date,Summary,Recall Number,Recall URL
"Speed Wheels Riding Toy Repair by Schaper Manufact.",4/20/1988 ,"Speed Wheels Riding Toy Repair by Schaper Manufact. NEWS from CPSC U.S. Consumer Product Safety Commission Office of Information and Public Affairs Washington, DC 20207 FOR IMMEDIATE RELEASE April 20, 1988 Release # 88-023 Repair Offered For Schaper Manufacturing Co. Speed Wheels Riding Toy WASHINGTON, D.C. -- Schaper Speed Wheels ride-on toys, which have been associated with eight incidents of laceration or fingertip severance, are the subject of a repair program announced today. In cooperation with the U.S. Consumer Product Safety Commission, Tyco Toys, Inc., Mt. Laurel, NJ is offering a free guard kit for approximately 25,000 1986 models sold without guards. Tyco Toys, Inc. purchased the Schaper Manufacturing Company's toy business in 1986. Schaper, of Minneapolis, MN, originally designed and manufacturerd the toy. Injuries have resulted from entrapment of children's fingers between the pedal bar and the body of the toy. This corrective action program applies only to 1986 (Schaper Model No. 61106) models sold without guard kit. Other toys distributed by Tyco Toys, Inc. are not affected. Owners of this model should call Tyco at its toll-free number, 800-257-7728 (in New Jersey, call 800-322-8011). They may also write: Speed Wheels Corrective Action Program Tyco Toys, Inc. 540 Glen Avenue Moorestown, NJ 08057",88023,https://www.cpsc.gov/Recalls/1988/Repair-Offered-For-Schaper-Manufacturing-Co-Speed-Wheels-Riding-Toy
"Aprica Ride-On Toy Recalled",12/11/1991 ,"December 11, 1991 Release # 92-031 Aprica Ride-On Toy Recalled WASHINGTON, DC -- In cooperation with the U.S. Consumer Product Safety Commission (CPSC), Aprica Kassai U.S.A., Inc., Aneheim, CA is voluntarily recalling approximately 400 Aprica Rockin Rollin Rider toys (Model No. 92090) because of reports that children have fallen from the toy. Aprica reported incidents of the toy tipping over and of children falling off the toy. The Rockin Rollin Rider is a wheeled ride-on toy car that can be converted to a rocking toy or a push-walker. The toy was sold nationwide during 1991 for approximately $110-$120. The name Aprica appears in white lettering on both sides of the ride-on car and is molded into the bottom of the yellow plastic rocker base. Consumers who have the Rockin Rollin Rider should stop use immediately and return it to the retailer for a full refund. The U.S. Consumer Product Safety Commission is announcing this recall as part of its mission to protect the public from unreasonable risks of injury and death associated with consumer products. Some 15,000 different types of consumer products fall within the Commission's jurisdiction",92031,https://www.cpsc.gov/Recalls/1992/Aprica-Ride-On-Toy-Recalled
"CPSC, Tek Nek Toys Announce Recall of Ride-On Toys",4/14/2004 ,"The ride-on toys were sold under five model names including Butterfly Girl, Fire Rescue, Mermaid, Police Car, and Tonka Construction Crew. The toys can be used as a ride-on or push walker toy, with a handle on the back of the seat rest. These toys were sold for children ages 1 to 3 years old. On the dash of the ride-on toys are buttons which produce sounds when activated. The recalled Ride-on vehicles have a date code from 20021127 to 20030319. The date code is located in the battery compartment located on the top panel next to the steering wheel.",04119,https://www.cpsc.gov/Recalls/2004/CPSC-Tek-Nek-Toys-Announce-Recall-of-Ride-On-Toys-
"Replacement Of On Switch Offered For Big Wheel Battery-Operated Riding Toy",6/27/1989 ,"June 27, 1989 Release # 89-061 Replacement Of On Switch Offered For Big Wheel Battery-Operated Riding Toy WASHINGTON, D.C. -- Empire of Carolina, Inc., Tarboro, North Carolina is offering to replace the ON switch for approximately 39,000 battery-operated, Big Wheel-ride-on toys sold nationwide from 1986 through 1988. The ON switch can overheat and may burn a child's hand or may become stuck causing loss of control of the riding toy.Empire and the U.S. Consumer Product Safety Commission are aware of five instances in which the switch overheated or burned out, and one incident in which the switch stuck in the ON position and the operator was unable to stop the riding toy. Two of the incidents involved minor burns from contact with the overheated switch.Battery-operated, Big Wheel toys by Empire are three-wheel, ride-on toys which come in several models: Kawasaki KLT 250 Prairie Big Wheel (item numbers 1215, 1220, and 1223) and Sweet- Tee-Nuff Big Wheel-(item number 1221). All models are decorated with decals which read either Kawasaki or Sweet-Tee- Nuff. The models are also marked by decals which read Electric Rechargeable. NOTE: Kawasaki permits the use of its name, but is not the manufacturer of the product.The ON switch of the riding toy is located on the handlebar and is pushed down to drive the toy. The toy should stop when the push button is released. The riding toy can travel up to five mph.Consumers should immediately discontinue using the battery- operated Big Wheel riding toy until the switch is replaced. Empire of Carolina will send a new switch and handlebar free of charge to all owners. This repair is necessary even for a previously replaced switch. owners should call Empire of Carolina toll-free at 1-800-334-5666. In North Carolina, owners should call collect: 919-823-4111. owners should have the model name and number of their toy ready when calling. Owners may also write for their new switch to: EMPIRE CAMPAIGN, c/o Empire of Carolina, Inc., P.O. Box 427, Daniel Street Extension, Tarboro, North Carolina 27886",89061,https://www.cpsc.gov/Recalls/1989/Replacement-Of-On-Switch-Offered-For-Big-Wheel-Battery-Operated-Riding-Toy
"Probe VI Riding Toy Repair by Hedstrom",7/11/1988 ,"Probe VI Riding Toy Repair by Hedstrom NEWS from CPSC U.S. Consumer Product Safety Commission Office of Information and Public Affairs Washington, DC 20207 FOR IMMEDIATE RELEASE Originally issued July 7, 1988 Revised October 21, 2004 Release # 88-046 Note: Firm out of business. Consumers should discard or destroy the products to prevent injuries. Hedstrom Makes Second Appeal for Repair of Riding Toy ATV WASHINGTON, D.C. -- Hedstrom Corporation of Bedford, Pa., again warned consumers to obtain a free repair kit for the company's Probe VI battery-powered toy all-terrain vehicle following reports to government safety experts that three more riding toys have caught fire or smoked. Hedstrom first announced availability of the repair kit last December, but consumer response has been slow. According the U.S. Consumer Product Safety Commission, there have been 11 reported incidents of the six-wheeled toy ATVs catching fire. Serious personal injury or property damage could result if the riding toys are not modified with the repair kit to reduce the risk of fire. Hedstrom said affected riding toys may be identified by checking the model label on the front underside of the plastic body. Models subject to the repair program, all of which do not contain fuses, are 67-3890, 67-3891, 67-3892, 67-3893 and 67- 38931. The label shows a manufacturing date prior to June, 1985, after which the company added fuses to the wiring harness. All riding toys equipped with fuses are not subject to the repair program. Consumers having any of the affected Hedstrom Probe VI - riding toys should immediately stop using the toy and discard or destroy the toy.The firm is out of business and a remedy is no longer available. The ones manufactured prior to June 1985 can catch fire because they do not have fuses. Models affected are: 67-3890 67-3891 67-3892 67-38921 67-3893 67-38931 with dates of manufacture prior to June 1985, as shown on the model identification label.",88046,https://www.cpsc.gov/Recalls/1988/Hedstrom-Makes-Second-Appeal-for-Repair-of-Riding-Toy-ATV
"Toy ATV's Recalled by Pines",7/3/1985 ,"Toy ATV's Recalled by Pines NEWS from CPSC U.S. Consumer Product Safety Commission Office of Information and Public Affairs Washington, DC 20207 Note: Firm is out of business. Do not use these products. Please discard or destroy these products. FOR IMMEDIATE RELEASE Originally issued July 3, 1985, Revised July 10, 2001 Release # 85-035 Battery Operated Toy ATV's Recalled WASHINGTON, D.C. -- Pines of America Inc., a toy manufacturer located in Fort Wayne, Indiana, is out of business. Owners of the ATV Trailblazer - Model No. PP9083 are to discontinue use immediately. The ATV Trailblazer is a battery operated ride-on toy motorcycle for children ages 4-7. It sold for approximately $99.00. Pines had learned that under certain circumstances a short circuit can occur in the battery wiring harness. Pines of America was aware of 30 reports of incidents involving a short circuit, which have resulted in overheating at the battery harness location. While no injuries have been reported as a result of the overheating, consumers owning this toy are requested to discontinue use immediately. The problem applies only to the ATV Trailblazers -Model PP9083 produced between July 21, 1983 and April 16, 1984 and not to any other Pines' Riding Toys. The affected model can be identified by a decal on the rear of the toy which designates the name Trailblazer. Further information on this recall can be obtained by calling the Consumer Product Safety Commission's toll-free Hotline at 800-638-CPSC. A teletypewriter number for the hearing-impaired is (301) 595-7054. Pines of America Battery Operated ATV Trailblazer, Model No. PP9083",85035,https://www.cpsc.gov/Recalls/1985/Battery-Operated-Toy-ATVs-Recalled
"CPSC, Far East Brokers and Consultants Inc. Announce Recall of Kiddie Car Cruisers Sold Exclusively at Big Y Stores",6/9/2004 ,"The Kiddie Car Cruiser is a battery-operated ride-on toy car that measures about 27 inches high by 30 inches wide and 44 inches long. Turbo and Cruiser are printed on labels on the side of the ride-on toys.",04555,https://www.cpsc.gov/Recalls/2004/CPSC-Far-East-Brokers-and-Consultants-Inc-Announce-Recall-of-Kiddie-Car-Cruisers-Sold-Exclusively-at-Big-Y-Stores
"Pop 'n Scoot Ride-on Toys Recalled by Little Tikes",6/12/2002 ,"Pop 'n Scoot Ride-on Toys Recalled by Little Tikes NEWS from CPSC U.S. Consumer Product Safety Commission Office of Information and Public Affairs Washington, DC 20207 FOR IMMEDIATE RELEASE Originally issued June 12, 2002, Revised April 30, 2007 Release # 02-175 Company Telephone Number: (800) 321-0183 CPSC Consumer Hotline: (800) 638-2772 CPSC Media Contact: Nychelle Fleming, (301) 504-7063 Little Tikes Media Contact: Laurie Yingling, (330) 650-3489 Note: Revised Telephone Number. CPSC, Little Tikes Announce Recall of Pop 'n Scoot Ride-on Toys WASHINGTON, D.C. - In cooperation with the U.S. Consumer Product Safety Commission (CPSC), The Little Tikes Company, of Hudson, Ohio, is voluntarily recalling about 21,400 Pop 'n Scoot Ride-on toys. Young children who lean forward can fall forward over the handlebars, causing facial injuries. Little Tikes has received 10 reports of children falling forward over the toy's handlebars. Seven injuries to children include damaged teeth, stitches to the chin, cuts and scratches to the mouth and face. The Pop 'n Scoot Ride-on toy is made of molded plastic with a clear dome filled with colorful beads attached to the handlebars. The riding toys have a yellow body, a red seat and red handlebars with blue hand grips. The identification number 32922XX 1 is molded on the underside of the ride-on body. The model number 1568-01 and Made In U.S.A. is molded on the bottom of the storage area below the red seat. The product was sold for children age 9 months to 36 months old. Toy stores nationwide sold the riding toys from March 2001 through May 13, 2002 for about $20. Consumers should stop using the toys immediately and contact Little Tikes at www.littletikes.com or call (800) 321-0183 anytime to receive a Little Tikes replacement product.",02175,https://www.cpsc.gov/Recalls/2002/CPSC-Little-Tikes-Announce-Recall-of-Pop-n-Scoot-Ride-on-Toys-
"Trolley-Ride Toys To Be Repaired",2/11/1980 ,"February 11, 1980 Release # 80-003 Trolley-Ride Toys To Be Repaired WASHINGTON, D.C. (February 11) -- A program to repair approximately 35,000 Fun Ride Trolley Ride toys which may seriously injure children is being conducted by the toy's manufacturer, Davis-Grabowski, Inc., of Miami, Florida. The company is conducting the voluntary program in cooperation with the U.S. Consumer Product Safety Commission (CPSC). The toy features four components: the trolley, which consists of two pulley-like grooved wheels encased within a plastic housing which supports two plastic handles; a 35-foot cable of either a single wire or seven intertwined strands of wire; and two clamps which serve to fasten the suspended cable around two tree trunks or posts. Once the cable is suspended, a child can propel himself along the cable by gripping the trolley's two handles. Although the toy is advertised as being capable of supporting an adult's weight, CPSC staff has been informed of nine incidents in which the cable broke under the weight of children and one incident in which it snapped under an adult's weight. These accidents reportedly resulted in concussions to a 9-year-old girl, and a 42-year-old woman, back injuries to a 10-year-old girl, and minor cuts and bruises to two other children. The trolley-ride toys were manufactured between January, 1976, and June, 1979. They have sold nationwide for approximately $15.00 in retail stores and are packaged in boxes labeled with the model number 30/1000. The manufacturer has agreed to mail consumers a free stranded cable to replace the single-wire cable, along with additional clamps to replace those sold with the toy. Anyone whose toy already includes the stranded cable will receive two additional clamps. The stranded cable and clamps can be obtained by writing to: Davis-Grabowski, Inc., P.O. Box 381594, 74 N.E. 74th Street, Miami, Florida, 33138. Consumers should include their names and addresses and specify the type of cable sold with their toy (whether single or stranded wire). Anyone requiring additional information about this program should contact CPSC's toll-free Hotline at 800-638-2772",80003,https://www.cpsc.gov/Recalls/1980/Trolley-Ride-Toys-To-Be-Repaired
"Riding Toy Recalled by Radio Flyer Due to Fall Hazard",8/16/2011 ,"The riding toy is red molded plastic with black wheels and measures 19 inches long, 11 inches wide and 13.5 inches tall. The riding toy's model number 711 can be found molded on the underside of the toy. Units with a yellow UPC sticker underneath the product with model #711B are not recalled.",11305,https://www.cpsc.gov/Recalls/2011/Riding-Toy-Recalled-by-Radio-Flyer-Due-to-Fall-Hazard
"Probe VI Battery-Powered Riding Toy Repair by Hedstrom",12/2/1987 ,"Probe VI Battery-Powered Riding Toy Repair by Hedstrom NEWS from CPSC U.S. Consumer Product Safety Commission Office of Information and Public Affairs Washington, DC 20207 FOR IMMEDIATE RELEASE Originally issued December 2, 1987, Revised October 22, 2004 Release # 87-078 Note: Firm out of business. Consumers should discard or destroy the products to prevent injuries. Hedstrom Offers Fuse Protector Kit For Probe VI Battery-Powered Riding Toy WASHINGTON, DC -- In cooperation with the U.S. Consumer Product Safety Commission, Hedstrom Corporation, Bedford, Pennsylvania, voluntarily repaired the wiring harness in approximately 30,000 Hedstrom Probe VI battery-powered riding toys manufactured prior to June 1985 without fuses. The Commission and Hedstrom are aware of eight reported incidents in which these vehicles have caught fire. One of these incidents resulted in a serious fire in a mobile home. Fire can occur either while the toy is being stored or while it is being ridden by a child. The Probe VI is a 6-wheeled, 2-speed toy all terrain vehicle with two motors powered by two 6-volt gel-type lead acid batteries. A separate charger is supplied with each vehicle. The manufacturer recommends this toy for children from 3 to 7 years of age. Probe VI toys without fuses were manufactured from 1983 to June 1985 and distributed nationally. The affected units can be identified by the model identification label located on the front underside of the plastic body (see attached diagram). Hedstrom began using wiring harnesses with fuses at the batteries in June 1985. Units with fuses are not affected. Models affected are: 67-3890, 67-3891, 67-3892, 67-38921, 67-3893 and 67-38931 with dates of manufacture prior to June 1985, as shown on the model identification label. Consumers should stop using the vehicles immediately and discard or destroy the product. The firm is out of business and the repair program is no longer available.",87078,https://www.cpsc.gov/Recalls/1987/Hedstrom-Offers-Fuse-Protector-Kit-For-Probe-VI-Battery-Powered-Riding-Toy
"Plush Rocker Toys Recalled By Tek Nek Toys Due to Fall Hazard",3/27/2008 ,"This recall involves Rock 'N Ride plush rocker toys sold in eight models: brown pony, pink pony, pink unicorn, deluxe pony, deluxe bull, lil' penguin, lil' propeller plane and Clifford big red rocker. The toys have molded plastic rocker bases and were sold for children at least 18 months old and up to 65 lbs. A button on the toy's ear, hat or dash activates songs and phrases when pressed. Rockers included in this recall have a date code from July 26, 2007 through December 29, 2007. The date codes are printed on a sticker inside the battery compartment.",08233,https://www.cpsc.gov/Recalls/2008/Plush-Rocker-Toys-Recalled-By-Tek-Nek-Toys-Due-to-Fall-Hazard
"Wonder Spring Ride-On Horses Recalled By CBS",10/15/1987 ,"Wonder Spring Ride-On Horses Recalled By CBS NEWS from CPSC U.S. Consumer Product Safety Commission Office of Information and Public Affairs Washington, DC 20207 Note: Firm out of business. Do not use these products. Please discard or destroy these products. FOR IMMEDIATE RELEASE Originally issued October 15, 1987; Revised September 5, 2001 Release # 87061 CBS Wonder Spring Ride-On Horses Recalled WASHINGTON, DC -- In cooperation with the U.S. Consumer Product Safety Commission, CBS Inc., New York, New York, announced a voluntary recall and replacement of the plastic bodies of its Clippety Clop Comanche and Colt ride-on toy Wonder horses because the plastic body may break during use. CBS has received 105 complaints that the body of the toy has broken without warning while being ridden, causing the rider to fall suddenly. Forty of these incidents resulted in injuries such as cuts, scrapes and bruises. The Wonder horse is a painted plastic riding toy, sometimes known as a hobby horse. The body of the horse is suspended by four springs from a tubular blue or blown metal frame. Children sit on these toys and rock or bounce while holding onto dowels attached to the horse's head. Over 114,000 of these ride-on toys, produced and distributed to retailers between March 1984 and May 1986, have been sold nationally for approximately $60 each. Only those units produced prior to June 1986 by the Wonder Unit of CBS Toys are affected by this recall. Any Wonder horse with a silver label on the horse's belly, or with a number higher than 86207 stamped on its belly, is not affected by this recall. These toys were produced beginning in June 1986 from a modified mold. Consumers should immediately stop using this product and retailers should immediately remove the product from sale. The firm is out of business and a replacement is no longer available. Please discard or destroy the recalled product. Consumers may also call the Commission's toll-free hotline number at 800-638-CPSC for assistance in identifying products subject to this recall. A teletypewriter number for the hearing impaired is (301) 595-7054.",87061,https://www.cpsc.gov/Recalls/1987/CBS-Wonder-Spring-Ride-On-Horses-Recalled
"My Pet Bear Ride-On Toy - Safety Warning",6/26/1996 ,"My Pet Bear Ride-On Toy - Safety Warning NEWS from CPSC U.S. Consumer Product Safety Commission Office of Information and Public Affairs Washington, DC 20207 FOR IMMEDIATE RELEASE CONTACT: Nychell White Originally issued June 26, 1996, Revised October 22, 2004 (301) 504-7063 Release # 96-151 Note: Firm out of business. CPSC, Hedstrom Issue Safety Warning for My Pet Bear Ride-On Toy WASHINGTON, D.C. - In cooperation with the U.S. Consumer Product Safety Commission (CPSC), Hedstrom Corporation of Bedford, Pa., warned owners of approximately 9,400 Hedstrom My Pet Bear ride-on toys to remove the foam covering from the two horizontal, metal support tubes in order to eliminate any risk of children choking on the foam. Hedstrom has received four reports of children biting off pieces of the protective foam. No injuries have been reported. My Pet Bear, model number 2-551, is a bouncing/rocking toy recommended for children ages nine months to 36 months. The ride, measuring 21 inches high, 36 inches long, and 22 inches wide, resembles a bear with a seat attached to its back. Four heavy springs attach the bear to a metal frame with two horizontal bars covered with light tan foam padding. Retail stores sold the My Pet Bear ride-on toy nationwide from January 1995 through May 1996 for about $45. The firm is out of business and can no longer be contacted.",96151,https://www.cpsc.gov/Recalls/1996/CPSC-Hedstrom-Issue-Safety-Warning-for-My-Pet-Bear-Ride-On-Toy
"Children's Riding Toy Recalled by Step2 Due to Fall Hazard",11/27/2012 ,"The recalled product is an X-Rider Car. It is a red, plastic toy scooter with a yellow handlebar and seat, and two blue stickers that simulate headlights. It is 14 inches high, 14 inches wide and 19 inches long. The middle of the handle bar contains the Step2 logo. Step2's contact information is located on the rider's left side of the car. Children use their feet to propel the toy.",13049,https://www.cpsc.gov/Recalls/2013/Childrens-Riding-Toy-Recalled-by-Step2-Due-to-Fall-Hazard
"Children's Riding Vehicles Recalled by Tek Nek Toys",8/31/2000 ,"Children's Riding Vehicles Recalled by Tek Nek Toys NEWS from CPSC U.S. Consumer Product Safety Commission Office of Information and Public Affairs Washington, DC 20207 FOR IMMEDIATE RELEASE Originally issued August 31, 2000, Revised July 17, 2003 Release # 00-177 Tek Nek Phone Number: (888) 900-0155 CPSC Consumer Hotline: (800) 638-2772 CPSC Media Contact: Kim Dulic or Mark Ross, (301) 504-7908 Note: Telephone number change. CPSC, Tek Nek Toys Announce Recall of Children's Riding Vehicles WASHINGTON, D.C. - In cooperation with the U.S. Consumer Product Safety Commission (CPSC), Tek Nek Toys, of Mokena, Ill., is recalling about 294,000 battery-powered children's riding vehicles to replace the battery chargers. The vehicles' battery charger or wires can overheat, presenting fire and injury hazards to children. CPSC and Tek Nek have received 17 reports of battery chargers and wires overheating, while vehicles were being charged. Two consumers burned their hands while unplugging or charging the vehicles. The Tek Nek vehicles being recalled are powered by one 6-volt battery and were manufactured before April 2000. The vehicles are made of plastic and were sold under the following model names: Prowler, Dodge Ram, Corvette, SPX Motorcycle and Honda. The model name appears on each vehicle. Some models have working lights and horn, engine and music sounds. A label on the vehicle reads MADE IN CHINA. Tek Nek vehicles are intended for children 1-1/2 to 4 years old, and the vehicles' speed ranges from 1 to 2 mph, depending on the model. Toy stores and discount department stores sold the vehicles nationwide from July 1998 through April 2000 for about $89. Consumers should stop using the vehicles immediately and contact Tek Nek at (888) 900-0155 between 8:30 a.m. and 5 p.m. CT Monday through Friday to receive a free, new charger. Consumers should not charge the vehicles or let children use the vehicles until they have received the new charger.",00177,https://www.cpsc.gov/Recalls/2000/CPSC-Tek-Nek-Toys-Announce-Recall-of-Childrens-Riding-Vehicles
"Step2® Recalls to Repair Riding Toys Due to Risk of Injury",5/12/2010 ,"The Step2® Push Around Buggy™ and Whisper Ride Buggy™ are ride-on toys. The buggy comes in various colors; such as, orange, red, blue, pink and green. The buggies have a red Step2 logo on the handle of the buggy. Buggies that have a handle attached by a bolt with a plastic white or black head and nut are not included in this recall.",10229,https://www.cpsc.gov/Recalls/2010/Step2-Recalls-to-Repair-Riding-Toys-Due-to-Risk-of-Injury
