"RC2 Recalls Knights of the Sword Toys Due to Violation of Lead Paint Standard",9/26/2007 ,"The three recalled silver knight toys are mounted on red horses sold individually in see-through blister cards. Britain's and Knights of the Sword are printed on the top of the card in the packaging. The recalled toys include a mounted silver knight on a red horse with an axe; a mounted silver knight on a red horse with two hands on a raised weapon; and a mounted silver knight on a red horse with a lance.",07310,https://www.cpsc.gov/Recalls/2007/RC2-Recalls-Knights-of-the-Sword-Toys-Due-to-Violation-of-Lead-Paint-Standard
"Toy Figures Recalled by Henry Gordy International Due to Violation of Lead Paint Standard",10/31/2007 ,"The posable spaceman figures are about 4½ inches tall and come with two accessories. They were sold in various colors including yellow, grey, silver, blue, green, gold, black, and red.",08060,https://www.cpsc.gov/Recalls/2008/Toy-Figures-Recalled-by-Henry-Gordy-International-Due-to-Violation-of-Lead-Paint-Standard
"Disney Donald Fun Farms & Disney World Airport Toys Recalled by Arcotoys",8/28/1989 ,"Disney Donald Fun Farms & Disney World Airport Toys Recalled by Arcotoys NEWS from CPSC U.S. Consumer Product Safety Commission Office of Information and Public Affairs Washington, DC 20207 FOR IMMEDIATE RELEASE August 28, 1989 Release # 89-082 Arcotoys Offers Parts Exchange For Disney Donald Fun Farms And Disney World Airport Toys WASHINGTON, D.C. -- Arcotoys Inc., Westbury, New York, has announced a voluntary recall of certain toy vehicles and the character Goofy contained in the company's Disney Donald's Fun Farm, Item No., 6112, and Disney World Airport, Item No. 6113. The sets were sold nationwide from February 1, 1988 through February 8, 1989 for approximately $12.99 each. Tests conducted by the U.S. Consumer Product Safety Commission (CPSC) revealed that the wheels attached to the vehicles' axles and Goofy's ears are small parts which can separate from the toys and present a potential choking hazard. Neither CPSC nor the company has received any reports or complaints of small parts separation or injury associated with these products. Consumers should remove only the following items and return them to Arcotoys Inc., 800 Shemes Drive, Westbury, NY 11590 for an exchange with comparable vehicles and characters: (1) Disney Donald's Fun Farm #6112: -remove the four-wheel tractor (2) Disney World Airport #6113: -remove the four-wheel blue, yellow and red vehicles which have blue or yellow wheels; and -remove Goofy who has long ears, gold hat and shoes, orange shirt, green vest, brown pants, and white hands. The Fun Farm toy was imported from Hong Kong, and identified by U.S. Customs at the Ports of Buffalo and Seattle during joint surveillance with the U.S. Consumer Product Safety Commission. For further information consumers may call Arcotoys at 1-800-442-2664.",89082,https://www.cpsc.gov/Recalls/1989/Arcotoys-Offers-Parts-Exchange-For-Disney-Donald-Fun-Farms-And-Disney-World-Airport-Toys
"OKK Trading Recalls Toy Army Figures Due to Violation of Lead Paint Standard",12/3/2008 ,"The recall involves 7½-inch tall plastic toy Army figures. The figures are dressed in Army fatigues and have guns.",09060,https://www.cpsc.gov/Recalls/2009/OKK-Trading-Recalls-Toy-Army-Figures-Due-to-Violation-of-Lead-Paint-Standard
"Toy Wrestler Figures Recalled by A.A. of America Due to Violation of Lead Paint Standard",1/15/2008 ,"The recalled toy is a package of four action figures. Each figure is about 5 3/4 inches high. The UPC number 604111230003 is printed on the product's packaging.",08164,https://www.cpsc.gov/Recalls/2008/Toy-Wrestler-Figures-Recalled-by-AA-of-America-Due-to-Violation-of-Lead-Paint-Standard
"Push Toys Recalled by Santa's Toy Corp. Due to Violation of Lead Paint Standard",4/16/2008 ,"The recall involves a push toy of a plastic horse with rider and a 20-inch-long pole/handle. The horse and pole/handle together measure about 26 inches. The rider is wearing red pants and a green shirt. The horse comes in various colors.",08249,https://www.cpsc.gov/Recalls/2008/Push-Toys-Recalled-by-Santas-Toy-Corp-Due-to-Violation-of-Lead-Paint-Standard-
"Liquidation Outlet, Inc. Recalls Action Figure Toys Due to Violation of Lead Paint Standard; Sold Exclusively at Dollar Stores",8/27/2009 ,"The Force Soldier playsets come in a plastic bag with SKU number 70134 printed on the header card. The soldiers (two per bag) are 5 in height and come with an airplane, machine guns and a tropical tree. The Pirate Expeditions come in blister packs in two styles with the SKU number 70136 printed on the header cards. Pirate Expedition figures are 6.5 in height and have assorted accessories including a parrot or a treasure chest.",09332,https://www.cpsc.gov/Recalls/2009/Liquidation-Outlet-Inc-Recalls-Action-Figure-Toys-Due-to-Violation-of-Lead-Paint-Standard-Sold-Exclusively-at-Dollar-Stores
"Toys Included with Kids Meals Recalled by Fazoli's",8/29/2000 ,"Toys Included with Kids Meals Recalled by Fazoli's NEWS from CPSC U.S. Consumer Product Safety Commission Office of Information and Public Affairs Washington, DC 20207 FOR IMMEDIATE RELEASE August 29, 2000 Release # 00-171 Fazoli's Recall Hotline: (877) 401-7408 CPSC Consumer Hotline: (800) 638-2772 CPSC Media Contact: Nychelle Fleming, (301) 504-7063 Fazoli's Media Contact: Charlie Lousignont, (859) 268-1668 CPSC, Fazoli's Announce Recall of Toys Included with Kids Meals WASHINGTON, D.C. - In cooperation with the U.S. Consumer Product Safety Commission (CPSC), Fazoli's Management Inc., is voluntarily recalling about 310,000 Pasta Pals toys included with Fazoli's Kids Meals. The toy is a plastic, barrel-shaped container with small, plastic tomato and ravioli figures inside. The bottom of the container can fit over a child's nose and mouth, which could pose a suffocation hazard to children under 3 years of age. Fazoli's has received one report of a child putting the container over his mouth. No injuries have been reported. The Pasta Pals toy's blue container measures about 2.5 inches in diameter and 2 inches deep. Inside are three red tomato figures and three yellow ravioli figures. Children can empty the figures out of the container and link them to form a chain. FAZOLI'S ITALIAN FOOD...FAST is imprinted onto the top of the barrel. (c)2000Fazoli's Management, Inc. and Made in China are imprinted into the bottom of the barrel. Fazoli's restaurants nationwide included the Pasta Pals toys with Fazoli's Kids Meals from January 2000 through August 2000. Consumers should immediately take the barrel-shaped container away from young children. Discard the container or return it to any Fazoli's restaurant for a free Italian Lemon Ice. For more information, consumers can call Fazoli's toll-free at (877) 401-7408 anytime or visit the firm's web site at http://www.fazolis.com/recall.html. Consumers can also view a video clip about this recall (transcript). This is in streaming video format.",00171,https://www.cpsc.gov/Recalls/2000/CPSC-Fazolis-Announce-Recall-of-Toys-Included-with-Kids-Meals
"Horse Toy Figures Recalled by Blip Toys Due to Violation of Lead Paint Standard",1/26/2010 ,"This recall involves the Nature Wonders HD pinto horse toy figures with model number 92093. The plastic horse is white with brown spots and measures about 4 inches tall. The model number and Nature Wonders HD are printed on the retail tag wrapped around the horse's leg.",10120,https://www.cpsc.gov/Recalls/2010/Horse-Toy-Figures-Recalled-by-Blip-Toys-Due-to-Violation-of-Lead-Paint-Standard
"MEGA Brands Recalls MagnaMan Magnetic Action Figures; Ingested Magnets Pose Aspiration and Intestinal Hazards",3/17/2008 ,"The recalled MagnaMan magnetic toys are figures that have body parts that attach with magnets. They come in either a Futuristic Warrior or Ancient Warrior theme. Each figure comes with three accessories. Name Color Model # Name Model # Alien Green 28170 Robot Assortment 28198 Robotor Red 28171 Vac Metal 28327 Flame Orange 28172 4-Pack 28175 Gigantor Blue 28173 3-Pack 28393 Toyoto the Samurai Purple 28164 2-Pack 28392 Sir Lancelot the Knight Gray 28165 Vac Metal Assortment 28327 Eric the Viking Blue 28166 Assortment 28254 or 28199 Brutus the Gladiator Yellow 28167 The model number is printed on the front of the product's packaging.",08222,https://www.cpsc.gov/Recalls/2008/MEGA-Brands-Recalls-MagnaMan-Magnetic-Action-Figures-Ingested-Magnets-Pose-Aspiration-and-Intestinal-Hazards
"Mattel Recalls Batman™ and One Piece™ Magnetic Action Figure Sets Due To Magnets Coming Loose",8/14/2007 ,"The recalled Batman™ toys include: The Batman™ Magna Battle Armor™ Batman™ figure with model number J1944, The Batman™ Magna Fight Wing™ Batman™ figure with model number J1946, The Batman™ Secret ID™ figure with model number J5114, and The Batman™ Flying Fox™ figure with model number J5115. The seven-inch-tall action figures include the Batman logo on the front and include magnetic accessories. The model number is located on the lower right corner of the tag which is sewn to the figure. The recalled One Piece™ toy is: One Piece™ Triple Slash Zolo Roronoa™ figure with model number J4142. The 5 ½ inch tall action figure has green hair, black pants, and has magnets in his hands, which connect to magnets on various swords that the figure can hold. The model number is printed on the back of the action figure's left leg.",07269,https://www.cpsc.gov/Recalls/2007/Mattel-Recalls-Batman-and-One-Piece-Magnetic-Action-Figure-Sets-Due-To-Magnets-Coming-Loose
"McDonald's Corp. and Bobble Dreams USA Recall of Chicago Bears Bobble Head Figurines",9/17/2002 ,"McDonald's Corp. and Bobble Dreams USA Recall of Chicago Bears Bobble Head Figurines NEWS from CPSC U.S. Consumer Product Safety Commission Office of Information and Public Affairs Washington, DC 20207 FOR IMMEDIATE RELEASE September 17, 2002 Release # 02-252 McDonald's Recall Hotline: (800) 244-6227 CPSC Consumer Hotline: (800) 638-2772 CPSC Media Contact: Kim Dulic, (301) 504-7058 McDonald's Media Contact: William Whitman, (630) 623-6745 Bobble Dreams Media Contact: Randy Thyberg, (714) 593-9940 CPSC, McDonald's Corp. and Bobble Dreams USA Announce Recall of Chicago Bears Bobble Head Figurines WASHINGTON, D.C. - In cooperation with the U.S. Consumer Product Safety Commission (CPSC), McDonald's Corp., of Oak Brook, Ill., and Bobble Dreams USA of Fountain Valley, Calif., are voluntarily recalling about 100,000 bobble head figurines. The paint on some of the figurines contains excess levels of lead. If ingested over time by children, the lead from the paint may present a lead poisoning hazard. McDonald's has not received any reports of injuries or incidents involving these figurines. This recall is being conducted to prevent the possibility of injury. The recalled bobble head figurines are designed in the likeness of NFL players Brian Urlacher and Anthony Thomas. The 7-inch tall figurines have heads on springs that cause them to bobble from side to side. The figurines are dressed in Chicago Bears' uniforms. The McDonald's logo and the player's name are printed across the front of the base. Labels on the bottom of the figurine read, BOBBLE DREAMS USA and MADE IN CHINA, and OFFICIAL NFL LICENSED PRODUCT. McDonald's restaurants sold the figurines in the greater Chicago area, Northwest Indiana, Central Illinois and Rockford as part of a promotion that ran from August 19, 2002 through September 12, 2002 for about $5.00. Consumers should keep these figurines away from children and contact McDonald's at (800) 244-6227 to receive return and refund instructions. Consumers can also visit the company's web site at www.mcdonalds.com (note added 01/18/2005 - recall information is no longer on the firm's web site).",02252,https://www.cpsc.gov/Recalls/2002/CPSC-McDonalds-Corp-and-Bobble-Dreams-USA-Announce-Recall-of-Chicago-Bears-Bobble-Head-Figurines-
"Halloween Figurines Recalled by Coyne's & Company for Lead Hazard",10/29/2008 ,"The recalled Casper the Friendly Ghost® mini-figurines are made of resin and paper, and are three inches tall. They were sold in mini bags decorated with a spider and web design. The Casper the Friendly Ghost® figurines are dressed as: Dracula in a red spider bag, Skeleton in a green spider bag, Devil in a purple spider bag, Mummy in an orange spider bag, Casper® in a blue spider bag, and Wendy the Witch® is in a yellow spider bag. The figurines are stamped with TM & ©Harvey Ent. Coyne's & Company and CP1030 are printed on a white sticker on the bottom of the bags.",09028,https://www.cpsc.gov/Recalls/2009/Halloween-Figurines-Recalled-by-Coynes--Company-for-Lead-Hazard
"Schylling Associates Recalls Collectable Toy Robot Due To Violation of Lead Paint Standard",11/7/2007 ,"The Robot 2000 is a battery-operated tin robot standing 12 tall. It has a red light on the head and chest panels that open.",08072,https://www.cpsc.gov/Recalls/2008/Schylling-Associates-Recalls-Collectable-Toy-Robot-Due-To-Violation-of-Lead-Paint-Standard
"Weight Watchers Recalls Plush Hungry Figures and Magnets Due to Puncture Hazard",8/20/2009 ,"The Hungry Figures and Hungry Magnets have orange plush exteriors. The Hungry Figure is about 6 inches long and the Hungry Magnet is about 4 inches long.",09318,https://www.cpsc.gov/Recalls/2009/Weight-Watchers-Recalls-Plush-Hungry-Figures-and-Magnets-Due-to-Puncture-Hazard
