"Steering Wheel on Toy Car Recalled by Radio Flyer Inc.",7/25/2002 ,"Steering Wheel on Toy Car Recalled by Radio Flyer Inc. NEWS from CPSC U.S. Consumer Product Safety Commission Office of Information and Public Affairs Washington, DC 20207 FOR IMMEDIATE RELEASE July 25, 2002 Release #02-214 Radio Flyer Recall Hotline: (800) 621-7613/(800) 708-9246 CPSC Consumer Hotline: (800) 638-2772 CPSC Media Contact: Kim Dulic, (301) 504-7058 CPSC, Radio Flyer Inc. Announce Recall to Replace Steering Wheel on Toy Car WASHINGTON, D.C. - In cooperation with the U.S. Consumer Product Safety Commission (CPSC), Radio Flyer Inc., of Chicago, Ill., is voluntarily recalling to replace the steering wheel on about 59,000 Model 8 Roadsters manufactured before January 2002. A child can pull the horn from the steering wheel, and a small part inside poses a choking hazard to young children. Radio Flyer has received 19 reports of horns detaching from the steering wheel. No injuries have been reported. This recall is being conducted to prevent the possibility of injuries. The Model 8 Roadster is about 26- inches long with a red steel body and a red rubber horn on a black steering wheel. The words Radio Flyer and the number 8 appear on both sides of the riding toy. Roadsters included in this recall have a date of manufacture of 12/2001 or earlier and have a horn symbol embossed on the red rubber horn. A label with the date of manufacture is located on the bottom of the Roadster. The label has the letters MD followed by a date code that represents the month and year of manufacture (for example, MD 12/2001 is for a manufacture date of December 2001). Toy stores, discount stores, catalogues and web retailers sold the Model 8 Roadsters nationwide between January 2001 and July 2002 for about $70. Consumers should take these Roadsters from young children immediately and contact Redwagons to order a replacement steering wheel. Consumers can contact Redwagons at (800) 708-9246 between 8:30 a.m. and 5 p.m. CT Monday through Friday or visit Radio Flyer's web site at www.radioflyer.com and complete an order form. For more information, consumers can contact Radio Flyer at (800) 621-7613 between 8 a.m. and 5 p.m. CT Monday through Friday. Model 8 Roadsters manufactured after January 2002 are not involved in this recall. Model 8 Roadsters with a star embossed on the horn, even if manufactured in 2001, have been re-designed and are not included in this recall.",02214,https://www.cpsc.gov/Recalls/2002/CPSC-Radio-Flyer-Inc-Announce-Recall-to-Replace-Steering-Wheel-on-Toy-Car
"Cinderella Battery-Powered Toy Cars Recalled by Dumar International USA Due to Fire and Burn Hazards",2/19/2008 ,"The electric ride-on toy resembles the Pontiac Solstice. It is light blue and has Cinderella graphics on the front and sides. The wheels, steering wheel and two seats are pink. The white dashboard may contain an optional radio. Pontiac Solstice is printed on the back of the car. Walt Disney's Cinderella Special Edition is printed on the license plate. It is designed for children 4 to 7 years old.",08195,https://www.cpsc.gov/Recalls/2008/Cinderella-Battery-Powered-Toy-Cars-Recalled-by-Dumar-International-USA-Due-to-Fire-and-Burn-Hazards
"Kiddieland Recalls Disney-branded Fairies Plastic Trikes Due to Laceration Hazard",11/1/2011 ,"his recall involves the Disney-branded Fairies Plastic Racing Trike. The trike is green and purple with a white seat and yellow wheels. On top of the handlebar, there is a Tinkerbell figure and three other rotating fairy figures. Disney Fairies is printed on the label in front of the trike just below the handlebar.",12029,https://www.cpsc.gov/Recalls/2012/Kiddieland-Recalls-Disney-branded-Fairies-Plastic-Trikes-Due-to-Laceration-Hazard
"Baja Motorsports Recalls Mini Bikes and Go-Carts Due to Fire and Burn Hazards",7/15/2010 ,"This recall involved Baja Motorsports mini bikes with model numbers beginning with HT65, MB165, WR65, MB196, DB30, WR90 and DR90 and go-carts with model numbers BB65, SD65, DN65 and TR65. The model number is located on the mini bikes' fenders and/or decorative fuel tank and on the go-carts' roll cage. They both have black plastic gas caps.",10304,https://www.cpsc.gov/Recalls/2010/Baja-Motorsports-Recalls-Mini-Bikes-and-Go-Carts-Due-to-Fire-and-Burn-Hazards
"Fisher-Price Recalls Children's Trikes Due to Risk of Serious Injury",9/30/2010 ,"This recall involves the Fisher-Price Trikes and Tough Trikes toddler tricycles with model numbers listed in the chart below and that have either a disc-shaped or D-shaped pretend key. The model numbers are located under the seat in the storage compartment. The trikes are intended for children 2 to 5 years of age. The pretend keys are located about 3 inches in front of the seat and protrude at least 5/8 inches above the trike's body. The trikes manufactured after June 16, 2010 are not included in this recall. These trikes have a modified key in a flattened D shape (see picture) and a manufacturer run number higher than 1670Q2. The run number indicates the trike was manufactured on the 167th day of 2010 or on June 16, 2010. The run number is found under the seat below the model number.",10359,https://www.cpsc.gov/Recalls/2010/Fisher-Price-Recalls-Childrens-Trikes-Due-to-Risk-of-Serious-Injury
"Disney Princess Plastic Trikes Recalled by Kiddieland Due to Laceration Hazard",4/21/2011 ,"This recall involves the Disney Princess Plastic Racing Trikes. The trikes are pink and fuchsia with a purple seat and wheels. On top of the handlebar, there is a rotating castle display surrounded by three princess figures. Disney Princess is printed on the label in front of the trike just below the handlebar.",11205,https://www.cpsc.gov/Recalls/2011/Disney-Princess-Plastic-Trikes-Recalled-by-Kiddieland-Due-to-Laceration-Hazard
"Children's Scooters Recalled by Kiddieland Due to Laceration Hazard",4/21/2011 ,"This recall involves three models of Kiddieland Lights and Sounds three-wheeled scooters including a red Spiderman, a blue Thomas & Friends™ and a pink girl's scooter. The scooters have buttons on the handle that play music and sounds. Kiddieland is molded on the back of the steering mechanism. Spiderman or Thomas & Friends™ are found on the steering mechanism and platform. The girl's model has butterflies on the platform.",11206,https://www.cpsc.gov/Recalls/2011/Childrens-Scooters-Recalled-by-Kiddieland-Due-to-Laceration-Hazard
"CPSC, Dorel Juvenile Group USA Announce Recall to Repair Battery-Powered Ride-On Vehicles",10/27/2005 ,"The recalled battery-powered ride-on vehicles include the Pink Corvette®, Torch Red Corvette®, Yellow Race Car Corvette®, Red Electroplate Corvette®, Fire Engine, and Batmobile® with the model numbers listed in the chart below. They were sold under the brands Safety 1st and Kid Trax by Safety 1st. The ride-on vehicles were manufactured between January 2004 and August 2005. The manufacture date is located on the underside of the unit and is molded into the plastic body as shown below. The circle on left displays the month of manufacture, the circle on the right displays the year of manufacture. The model numbers are located on the underside of the vehicles near the date code. Ride-On Vehicle Name Model Safety 1st Pink Corvette® 50503/50503A Safety 1st Torch Red Corvette® 50504/50504A Safety 1st Yellow Race Car Corvette® 50505/50505A Safety 1st Red Electroplate Corvette® 50521/50521A Kid Trax Fire Engine 50506/50506A Safety 1 st Batmobile® 50527",06018,https://www.cpsc.gov/Recalls/2006/CPSC-Dorel-Juvenile-Group-USA-Announce-Recall-to-Repair-Battery-Powered-Ride-On-Vehicles
"Children's Riding Vehicles Recalled by Fisher-Price",8/31/2000 ,"Children's Riding Vehicles Recalled by Fisher-Price NEWS from CPSC U.S. Consumer Product Safety Commission Office of Information and Public Affairs Washington, DC 20207 FOR IMMEDIATE RELEASE Originally issued August 31, 2000, Revised November 19, 2002 Release # 00-175 Fisher-Price Recall Hotline: (888) 289-9292 CPSC Consumer Hotline: (800) 638-2772 CPSC Media Contact: Kim Dulic or Mark Ross, (301) 504-7058 or 1188 Fisher-Price Media Contact: Laurie Oravec, (716) 687-3395 Note: Web site change. CPSC, Fisher-Price Announce Recall of Children's Riding Vehicles WASHINGTON, D.C. - In cooperation with the U.S. Consumer Product Safety Commission (CPSC), Fisher-Price, of East Aurora, N.Y., is recalling about 218,000 battery-powered Power Wheels Harley-Davidson motorcycle ride-ons for repair. The foot pedals, which activate the ride-ons, can stick in the on position. Children can be injured when the motorcycle ride-ons fail to stop and strike other objects. Fisher-Price has received nine reports of the foot pedal on these vehicles sticking. One 3-year-old boy suffered cuts and bruises when his motorcycle ride-ons ran into a home. The recalled Power Wheels Harley-Davidson motorcycle ride-ons have model numbers 74290, 74293 (with a red body) and 74298 (with a black body). A Power Wheels by Fisher-Price logo is located on the left side of the seat on the product, and the model number is located on a label in the battery compartment. Only model numbers 74290, 74293 and 74298 are being recalled. These vehicles are intended for children 3 and older, and the vehicles' speed is 2.5 or 5 mph. Toy, mass merchandise and discount stores, and Harley-Davidson dealerships sold the motorcycle ride-ons nationwide from September 1999 through August 2000 for about $190 for the red vehicle and $700 for the black vehicle. Consumers should stop using these motorcycle ride-ons immediately, and call Fisher-Price to determine if your vehicle is part of this recall. Consumers with recalled ride-ons will receive a free foot pedal repair kit. The repair can be easily completed in the home. Consumers should call Fisher-Price at (888) 289-9292 anytime, or visit the Fisher-Price web site at http://www.service.mattel.com/us/recall.asp for more information. Power Wheels Harley-Davidson motorcycle ride-ons that have model number 74370 (with a pink body) are not part of this recall.",00175,https://www.cpsc.gov/Recalls/2000/CPSC-Fisher-Price-Announce-Recall-of-Childrens-Riding-Vehicles
"Power Wheels Porsche Battery-Powered Riding Automobile For Children Recalled",10/25/1991 ,"October 25, 1991 Release # 92-008 Power Wheels Porsche Battery-Powered Riding Automobile For Children Recalled WASHINGTON, DC -- In cooperation with the U.S. Consumer Product Safety Commission (CPSC), Kransco Power Wheels of San Francisco, CA is voluntarily recalling the children's Power Wheels Porsche riding automobile which is powered by a rechargeable 18-volt battery. The automobile moves forward by pressing a foot pedal and stops when the pedal is released. A spring-loaded switch beneath the pedal is depressed to activate the motor. The recalled automobiles are equipped with a stronger, 18-volt battery system which, unlike the 12-volt battery used in previous models, may cause the switch's contact points to weld together during the initial surge of electricity. If this were to happen, the motor would remain running and the vehicle would continue moving forward, unable to stop. The CPSC was informed of this potential hazard by Kransco who discovered the problem when field testing the vehicle. The Power Wheels Porsche automobiles were distributed to retailers beginning August 21, 1991. On October 11, 1991, Kransco issued a voluntary recall to retailers of all 18-volt vehicles shipped as of that date. Approximately 12,000 vehicles were sold to retailers and the company estimates that about 1,000 units were sold to consumers. The vehicles sold for approximately $359-399 each. Owners of the affected units should stop use immediately. Consumers are asked to contact the company's customer service department at 1-800-348-0751 for instructions on how to disable the vehicle. Consumers will be sent a replacement switch which can be installed at home. Consumers are also given the option of returning the unit to one of the company's 260 nationwide service centers for the repair to be completed by an authorized service center employee. The U.S. Consumer Product Safety Commission joins Kransco in announcing this repair program as part of its mission to insure that products purchased by American consumers are safe",92008,https://www.cpsc.gov/Recalls/1992/Power-Wheels-Porsche-Battery-Powered-Riding-Automobile-For-Children-Recalled
"CPSC And Radio Flyer Announce Tricycle Recall",6/23/1995 ,"June 23, 1995 Release # 95-139 WASHINGTON, D.C.- CPSC, Radio Flyer, Inc. of Chicago, Ill., is voluntarily recalling 24,975 Tornado and Power Tricycles. A weld on the front fork may fail during use, which may cause a child riding the tricycle to fall.CPSC is aware of one incident in which a child received minor injuries from a fall after the weld on the front fork failed during use. This recall is being conducted to prevent the possibility of injury arising from a defective fork weld.This recall applies to the 300 Tornado (blue with light blue trim), PTG Power Trike (green with red trim), PTP Power Trike (purple with pink trim), and PTB Power Trike (blue with light blue trim) tricycles. Each tricycle's front wheel is approximately 12 inches in diameter. All of the tricycles except the 300 Tornado have Radio Flyer decals on the frame. The Tornado tricycles were sold nationwide through warehouse club outlets located in the Western United States between August 1, 1994 and December 31, 1994 for approximately $29.99. The 3 Power Trike models were sold nationwide through various retailers from August 1, 1994 through June, 1995 for approximately $39.99.Consumers should inspect their tricycle to determine whether it is affected by this recall. If the 1.5 inch washer between the front fork and tricycle frame is the same color as the frame, consumers should take the tricycle away from children immediately. Consumers should call Radio Flyer, Inc. at (800) 621-7613 for a free replacement piece. Consumers may also return the tricycle to the store where purchased for an exchange or refund. Radio Flyer tricycles with black 1.5 inch washers between the front fork and frame are not affected by this recall",95139,https://www.cpsc.gov/Recalls/1995/CPSC-And-Radio-Flyer-Announce-Tricycle-Recall
"Decals on Pedal Cars Recall/Replacement by Oscar Mayer",6/2/1998 ,"Decals on Pedal Cars Recall/Replacement by Oscar Mayer NEWS from CPSC U.S. Consumer Product Safety Commission Office of Information and Public Affairs Washington, DC 20207 FOR IMMEDIATE RELEASE Originally issued June 2, 1998, Revised May 28, 2002 Release # 98-118 Company Phone Number: (800) 323-0768 CPSC Consumer Hotline: (800) 638-2772 CPSC Media Contact: Nychelle Fleming, (301) 504-7063 Oscar Mayer Contact: Kathy Knuth, (847) 646-2666 Note: Telephone number change. CPSC, Oscar Mayer Announce Recall to Replace Decals on Pedal Cars Because of Lead Hazard Washington D,C - In cooperation with the U.S. Consumer Product Safety Commission (CPSC), Oscar Mayer Foods Corp., of Madison, Wis., is recalling the decals on about 16,000 Oscar Mayer Wienermobile pedal cars. These decals contain high levels of lead. High levels of lead presents a poisoning hazard to young children if ingested. Oscar Mayer is not aware of any illnesses or injuries involving this product. This recall is being conducted to prevent the possibility of illness or injury. These hot dog-shaped pedal cars are orange and yellow, and measure about 46 inches in length. They are intended for children 3 to 7 years of age. Decals on these cars are located on the front, back, sides and interior panels of the pedal cars. Grocery stores in the U.S. and Canada distributed many of these pedal cars through special promotions and also sold a small number by mail order from June 1995 through May 1998. The cars were not available for purchase in retail stores. Consumers should immediately stop children from playing with these pedal cars. Consumers should call (800) 323-0768 between 9 a.m. and 5 p.m. CDT Monday through Friday for instructions on how to receive new decals to replace the old decals.",98118,https://www.cpsc.gov/Recalls/1998/CPSC-Oscar-Mayer-Announce-Recall-to-Replace-Decals-on-Pedal-Cars-Because-of-Lead-Hazard
"Alpha International Recalls Pedal Cars",2/20/2002 ,"Alpha International Recalls Pedal Cars NEWS from CPSC U.S. Consumer Product Safety Commission Office of Information and Public Affairs Washington, DC 20207 FOR IMMEDIATE RELEASE February 20, 2002 Release # 02-104 Firm's Recall Hotline: (800) 368-6367 CPSC Consumer Hotline: (800) 638-2772 CPSC Media Contact: Nychelle Fleming, (301) 504-7063 CPSC, Alpha International Announce Recall of Pedal Cars WASHINGTON, D.C. - In cooperation with the U.S. Consumer Product Safety Commission, (CPSC), Alpha International Inc., also known as Gearbox Pedal Car Company, of Cedar Rapids, Iowa, is voluntarily recalling about 75,000 pedal cars. The paint coating on some of these pedal cars contains high lead levels. CPSC standards ban toys and other children's products containing high levels of lead. Young children could ingest the lead from the car's paint coating, presenting a lead poisoning hazard. Alpha International has not received any reports of injuries involving these pedal cars. This recall is being conducted to prevent the possibility of injury. There are 17 models of the pedal cars included in the recall. Models include three fire trucks, four police cars, eight sedans, one yellow taxi, and one dump truck. Model names are listed below: Fire Trucks: Fire Truck, John Deere and Texaco. Police Cars: NYPD, Chicago Police, Highway Patrol and EMERGENCY 911. Sedans: pink Champion, blue Champion, Texaco, John Deere, Citgo, Raley's Coca-Cola, Raley's Keebler, and Red Lion. All of the pedal cars are made of metal and come in a variety of colors. Most of the cars have a Gearbox logo on the seat back, the hubcaps, and/or the pedals. The pedal cars were manufactured in Korea. The two Raley's cars were sold exclusively at Raley's supermarkets from July 2000 through December 2000. Department, toy, and specialty/collectible stores sold all of the other pedal cars from November 1999 through January 2002 for between $100 and $500. Consumers should take these pedal cars away from young children immediately. Consumers can contact Alpha International at (800) 368-6367 between 9 a.m. and 5 p.m. CT Monday through Friday to receive a replacement car or return the products to the place where purchased to receive a full refund.",02104,https://www.cpsc.gov/Recalls/2002/CPSC-Alpha-International-Announce-Recall-of-Pedal-Cars
"Repair Ride-On Push Cars Recalled by Radio Flyer Inc.",6/18/2002 ,"Repair Ride-On Push Cars Recalled by Radio Flyer Inc. NEWS from CPSC U.S. Consumer Product Safety Commission Office of Information and Public Affairs Washington, DC 20207 FOR IMMEDIATE RELEASE June 18, 2002 Release # 02-176 Radio Flyer's Recall Hotline: (800) 621-7613 CPSC Consumer Hotline: (800) 638-2772 CPSC Media Contact: Nychelle Fleming, (301) 504-7063 CPSC, Radio Flyer Inc. Announce Recall to Repair Ride-On Push Cars WASHINGTON, D.C. - In cooperation with the U.S. Consumer Product Safety Commission (CPSC), Radio Flyer Inc. of Chicago, Ill., is voluntarily recalling about 15,000 Little Wooden Push Cars for repair. A child can pull the horn off the car's steering wheel, and a small part inside poses a choking hazard. Radio Flyer Inc. has received three reports of the horns being pulled off, but no injuries have been reported. The Little Wooden Push Car is about 24-inches long, 14-inches wide, and 18-inches high. The car has a natural wood body, a red steering wheel column, a red metal bar on the back, and a red plastic horn on the steering wheel. Radio Flyer is written on both sides of the car. A child sits in the push car and moves the car with his or her feet. The car is for use by children 1- to 3-years-old. Toy stores, catalogues and web retailers sold these cars nationwide from February 1999 through June 2002 for about $60. Consumers should take the recalled cars away from young children immediately and contact Radio Flyer Inc. to receive a replacement steering wheel. For more information, consumers can call Radio Flyer Inc. at (800) 621-7613 between 8:30 a.m. and 5 p.m. CT Monday through Friday. Consumers also can contact Radio Flyer Inc. at www.radioflyer.com or by e-mail at 218Repair@RadioFlyer.com. Some of these push cars do not have horns. Only Wooden Push Cars with horns are part of this recall. No other Radio Flyer products are involved in this recall.",02176,https://www.cpsc.gov/Recalls/2002/CPSC-Radio-Flyer-Inc-Announce-Recall-to-Repair-Ride-On-Push-Cars-
"Power Wheels Ride-On Battery-Powered Vehicles Recall to Repair",10/22/1998 ,"Power Wheels Ride-On Battery-Powered Vehicles Recall to Repair NEWS from CPSC U.S. Consumer Product Safety Commission Office of Information and Public Affairs Washington, DC 20207 FOR IMMEDIATE RELEASE October 22, 1998 Release # 99-012 Company Phone Number: (800) 977-7800 CPSC Consumer Hotline: (800) 638-2772 CPSC Media Contact: Nychelle Fleming, (301) 504-7063 CPSC, Fisher-Price Announce Recall to Repair Power Wheels Ride-On Battery-Powered Vehicles WASHINGTON, D.C. - In cooperation with the U.S. Consumer Product Safety Commission (CPSC), Fisher-Price, of East Aurora, N.Y., is conducting a voluntary recall involving up to 10 million battery-powered Power Wheels ride-on cars and trucks. The vehicles' electrical components can overheat and cause fires. Children can suffer injuries from fires and house fires can occur. Additionally, wiring problems can prevent the vehicles from stopping. CPSC and Fisher-Price have received approximately 700 reports of electrical components failing and overheating while the cars and trucks were being ridden, charged, parked or stored. About 150 fires have been reported. Nine children suffered minor burns to the hands, legs, or feet; and up to $300,000 in property damage to 22 houses and garages have been reported. There have also been 71 reports of vehicles not stopping. Six children suffered bruises, scratches or bumps when their vehicles hit a car, truck, pole, window or fence. Power Wheels Service Centers will repair the vehicles. These service centers will install the new parts free of charge and give all recalled vehicles a free safety check-up and tune-up. The recalled Power Wheels cars and trucks have been sold under nearly 100 model names. The Power Wheels logo and the model name are on each vehicle. All models with two batteries are recalled, and certain models with one battery are recalled. The company will help consumers identify if their model is part of the recall. Power Wheels cars and trucks are intended for children 2 to 7 years old, and the vehicles' speed ranges from 1 to 5 mph, depending on the model. Toy and mass merchandise stores nationwide sold the cars and trucks since 1984 for about $70 to $300. Consumers should remove the vehicles' batteries right away and not let children use these Power Wheels vehicles until the repair has been made at the service center. To schedule the repair, consumers should call Power Wheels at (800) 977-7800 anytime. Again, the company will help consumers identify if their vehicles are part of the recall. Power Wheels sold after October 1998 are not involved in this recall. Model names, including, but not limited to: 12 Volt Battery Models Super 6 Volt Battery Models Barbie Beach Buggie Barbie Corvette Barbie Beach Cruiser Barbie Lamborghini Barbie Beach Patrol Barbie Trail Rider Barbie Beach Ranger Big Jake Barbie Sports Quad Big Foot Barbie Sun Jammer Cartoon Network Big Foot Caterpillar Coyote Corvette Cycle Sound Suzuki/Quad Racer 900 Firetruck Extreme Machine Hot Wheels Lamborghini Fire Truck Kawasaki GPZ Ford F-150 Kmart Racing Truck High Rider Lamborghini Jeep Adventure Team Monster 4x4 Jeep Commando Monster Racing Truck Jeep Dune Squad My First Roadster Jeep Dune Watch Qua-Trax Jeep Enforcer Snake Bite Jeep Laredo Starfire Jeep Renegade Supervette 350 Jeep Safari Suzuki Quad Sport Jeep Wrangler Turbo Corvette Kawasaki Ninja ATV Speed Sound Lamborghini Monster Sound Big Foot Suzuki Quad Racer Raider Jeep Sahara Jeep Sand Blaster Super Sound Jeep 4x4 Sweetheart Super Bigfoot 400 SZ",99012,https://www.cpsc.gov/Recalls/1999/CPSC-Fisher-Price-Announce-Recall-to-Repair-Power-Wheels-Ride-On-Battery-Powered-Vehicles
