Disclaimer: CPSC does not guarantee the accuracy, completeness, or adequacy of the contents of the Publicly Available Consumer Product Safety Information Database on SaferProducts.gov, particularly with respect to information submitted by people outside of CPSC.
Title,Date,Summary,Recall Number,Recall URL
"Wooden Clown Toys Recalled by BRIO",11/6/1997 ,"Wooden Clown Toys Recalled by BRIO NEWS from CPSC U.S. Consumer Product Safety Commission Office of Information and Public Affairs Washington, DC 20207 FOR IMMEDIATE RELEASE November 6, 1997 Release # 98-024 Company Phone Number: (888) 274-6869 CPSC Consumer Hotline: (800) 638-2772 CPSC Media Contact: Nychelle Fleming, (301) 504-7063 CPSC, BRIO Announce Recall of Wooden Clown Toys to Replace Hats WASHINGTON, D.C. - In cooperation with the U.S. Consumer Product Safety Commission (CPSC), BRIO Corp. of Germantown, Wis., a subsidiary of BRIO AB of Sweden, is voluntarily replacing the hats on about 79,000 wooden clown toys. The hats present a potential choking hazard to young children. BRIO has received one report of a 22-month-old child in Germany reportedly choking to death on the clown's hat. No other injuries or complaints have been reported. The clown is a 9-inch high wooden stacking toy consisting of 12 brightly colored pieces, including the base. When all of the pieces are stacked in order, the toy resembles the figure of a clown with a yellow cone-shaped hat. The words, BRIO...MADE IN SWEDEN are stamped on the bottom of the toy's base. The toy is packaged in a red, white and yellow cardboard box. Pictures of the toy, model number 30130 and the words BRIO...CLOWN appear on the box. Specialty stores and mail order catalogs nationwide sold the toy from 1977 through September 1997, most recently for about $19. BRIO clown toys currently being sold have the redesigned hat and are in boxes labeled, CONTAINS NEW HAT DESIGN. Consumers should take the clown's hat away from children immediately and send the hat to BRIO Corp., N120 W18485 Freistadt Road, Germantown, WI 53022. BRIO will send consumers a redesigned replacement hat and postage reimbursement. Consumers with questions should call BRIO toll-free at (888) 274-6869 between 9 a.m. and 5 p.m. CST Monday through Friday.",98024,https://www.cpsc.gov/Recalls/1998/CPSC-BRIO-Announce-Recall-of-Wooden-Clown-Toys-to-Replace-Hats
"Barrels, Clowns and Bead Rattles Recalled by F.J. Strauss",12/5/1985 ,"Barrels, Clowns and Bead Rattles Recalled by F.J. Strauss NEWS from CPSC U.S. Consumer Product Safety Commission Office of Information and Public Affairs Washington, DC 20207 FOR IMMEDIATE RELEASE December 5, 1985 Release # 85-062 Baby Toys Recalled Because Of Choking Hazard WASHINGTON, D.C. -- In cooperation with the Consumer Product Safety Commission, F.J. STRAUSS CO., INC., North Bergen, New Jersey, today announced a voluntary recall of three styles of baby toys because of the danger of choking or suffocation to infants and young children. Since March of 1984, approximately 2,585 dozens of these baby toys have been sold for approximately $2.50 to $5.00 nationwide. These baby toys are banned under CPSC's Small Parts and Rattle Requirements because they have parts which are small enough to lodge in an infant's throat and cause obstruction of the airway. Neither CPSC nor Strauss knows of any injuries involving these toys. Three items are involved. One is style #29/2 Big Barrel, which was sold in a white package with a one piece red barrel on the outside. This toy has two pieces orange, green, white, yellow, blue and red barrels of various sizes that fit into each other. The firm had also marketed a later version of the style #29/2 Big Barrel which has five barrels and is not subject to this recall program. This later version was sold in a white package with three open barrels on the outside. The second style is identified as #29/5 Magic Clown. This toy is a plastic blue and yellow ball with a red colored clown figure sitting on top. The third style is identified as #29/7 Big Bead Rattle. This toy has six plastic ovals that are strung on a nylon string forming a loop connected to a white plastic handle. All three items were imported from Taiwan. Consumers should remove these products from use immediately and either discard them or return them to the retailer where purchased for a full refund. Retailers should remove these products from sale immediately and return them to F.J. STRAUSS CO., INC., 3900 West Side Avenue, North Bergen, New Jersey 07047. Anyone wishing additional information may contact F.J. Strauss Co., Inc. at (201) 864-0100 or CPSC's toll free HOTLINE at the following numbers: (800) 638-CPSC. A teletypewriter number for the hearing-impaired is (301) 595-7054.",85062,https://www.cpsc.gov/Recalls/1985/Baby-Toys-Recalled-Because-Of-Choking-Hazard
"Peek-A-Boo Clown Baby Toys Recalled by F.J. Strauss",10/8/1986 ,"Peek-A-Boo Clown Baby Toys Recalled by F.J. Strauss NEWS from CPSC U.S. Consumer Product Safety Commission Office of Information and Public Affairs Washington, DC 20207 FOR IMMEDIATE RELEASE October 8, 1986 Release # 86-061 Baby Toys Recalled Because of Choking Hazard Washington, DC -- In cooperation with the Consumer Product Safety Commission, F.J. STRAUSS Co., INC., North Bergen, New Jersey, today announced a voluntary recall of a Peek-A-Boo Clown because of the danger of choking or suffocation to infants and young children. Since February 1985, approximately 2880 of these baby toys have been sold for approximately $3.00 each nationwide. These baby toys are banned under CPSC's Small Parts Requirements because they have parts which are small enough to lodge in an infant's throat and cause obstruction of the airway. Neither CPSC nor Strauss of any injuries involving these toys. The Peek-A-Boo Clown, Style #29/31 is approximately four inches in diameter and made of red, white, blue and yellow molded plastic with a pop up clown head. The item is labeled Made in Taiwan.  Consumers should remove these products from use immediately and either discard them or return them to the retailer where purchased for a full refund. Retailers should remove these products from sale immediately and return them to F.J.STRAUSS CO., INC., 3900 West Side Avenue, North Bergen, New Jersey 07047. Anyone wishing additional information may contact F.J. STRAUSS CO., INC., at 201-864-0100 or CPSC's toll-free hotline number at 800-638-CPSC. A -teletypewriter number for the hearing-impaired is (301) 595-7054.",86061,https://www.cpsc.gov/Recalls/1986/Baby-Toys-Recalled-Because-of-Choking-Hazard
"Nebraska Importer Recalls Funny Clown Dressing DolL",11/21/1989 ,"Nebraska Importer Recalls Funny Clown Dressing DolL NEWS from CPSC U.S. Consumer Product Safety Commission Office of Information and Public Affairs Washington, DC 20207 FOR IMMEDIATE RELEASE CONTACT: November 21, 1989 (301) 504-7908 Release # 90-011 Nebraska Importer Recalls Funny Clown Dressing Doll WASHINGTON---Brightly colored toy clown dolls, marketed as the Dress Up Clown, are being recalled by Oriental Trading Company, Inc. of Omaha, Nebraska because they contain small parts that present a choking risk to young children. The recall is being conducted in cooperation with the U.S. Consumer Product Safety Commission. The clown dolls, although marketed as the Dress Up Clown, came in a package labeled Funny Clown. They were sold by mail order catalogue and by retailers nationwide for $3.00 each between December 1988 and the present. Clothed primarily in red, blue and yellow, this doll has yellow string hair, a clown's cap and is about 13 inches long. It also has a snap, a button, a zipper, a buckle and shoe laces intended to introduce young children to various dressing functions. The clown doll may be identified by a cloth tag sewn onto the doll's cap that says: Oriental Trading Co., Inc. When the Commission tested the clown dolls in accordance with the regulations under the Federal Hazardous Substances Act, zipper clasps, buttons and buckles came off the dolls. The Commission alleges that these small parts make the dolls banned hazardous substances because they present a choking, ingestion and aspiration hazard to children. Consumers owning the Funny Clown dress up dolls should return the dolls to the place of purchase for a full refund. Consumers who purchased the doll from Oriental by direct mail catalogue may arrange for a refund by phoning the company at its toll-free number, 1-800-327-9678.",90011,https://www.cpsc.gov/Recalls/1990/Nebraska-Importer-Recalls-Funny-Clown-Dressing-Doll
