"Child's Asphyxiation Death Prompts Recall of Toy Dart Gun Play Set by OKK Trading",12/17/2009 ,"The ACTION TEAM play set has a toy gun with three soft rubber darts, a S.W.A.T. watch, a baton, walkie-talkie, a whistle, and a badge with a clip and an identification card. The soft, pliable orange plastic darts have a nearly 2 ½ inch long shaft and an approximately ¾ inch diameter suction cup. The toy gun is black with an orange nose and trigger and red spring release mechanism. Made in China is printed on one side of the barrel.",10079,https://www.cpsc.gov/Recalls/2010/Childs-Asphyxiation-Death-Prompts-Recall-of-Toy-Dart-Gun-Play-Set-by-OKK-Trading
"Toy Firm Recalls Disney Baby Play Gyms",11/17/1988 ,"November 17, 1988 Release # 88-098 Toy Firm Recalls Disney Baby Play Gyms WASHINGTON - Illco Toy Company, USA, Inc., of New York is voluntarily recalling some of its Walt Disney Mickey Mouse Baby Play Gyms because buckles and loops may dislodge from the straps and, along with an attached rattle, may present a choking hazard to young children. This recall applies only to gyms with plastic or unstitched fabric straps. Gyms having fabric straps that are stitched in two locations are not being recalled. The freestanding activity center for infants, gym no. 8722, has four tubular-shaped supports and a crossbar with three fabric or plastic straps suspended from the crossbar. Each strap holds a toy, namely Mickey Mouse, Donald Duck and a disc-shaped baby rattle with a mirror on one side. The baby gym sold nationally for about $17.00 in 1987. Illco and the U.S. Consumer Product Safety Commission (CPSC) said some parents have complained about buckles coming off unstitched fabric straps on gym sets. CPSC tests have shown that buckles may also come loose from plastic straps. The buckles and loops of the gym are small enough to be ingested by an infant. In addition, the mirrored rattle may break into small parts and may present a potential choking hazard if it comes off the strap. Consumers having a gym set with plastic or unstitched fabric straps holding the figures and rattle to the crossbar should immediately take the toys away from infants and toddlers and request replacement straps, buckles, and rattles by writing to the Consumer Service Department, Illco Toy Company, 200 Fifth Avenue, New York, New York 10010",88098,https://www.cpsc.gov/Recalls/1988/Toy-Firm-Recalls-Disney-Baby-Play-Gyms
"Little Tikes Recalls Children's Toy Workshop Sets and Trucks Due to Choking Hazard",8/13/2009 ,"The oversized, plastic toy nail is about 3 inches long by 1 inch in diameter and comes in red or blue colors. It has a large round head; about 1 ¼ inches below the head is a plastic ridge, slightly smaller than the nail head and about 1 inch in diameter. They were sold with a variety of Little Tikes Children's products. The names, model numbers and UPC code of the products included in this recall are listed below: Model # Name 0914/430B Electronic Project Workshop SOLD FROM MARCH 1994 THROUGH DEC 2003 UPC: 0-50743-00914-3 UPC: 0-57043-52613-8 0920/612237 Little HandiWorker Workhorse SOLD FROM MARCH 1999 THROUGH JUNE 2009 UPC 0-50743-10920-1 UPC 0-50743-61223-7 4146 Home Improvements 2-Sided Workshop SOLD FROM FEBRUARY 2001 THROUGH JANUARY 2009 UPC 0-50743-04146-4 440Z Swirlin' Sawdust Workshop SOLD FROM APRIL 2004 THROUGH NOVEMBER 2008 UPC 0-50743-38540-7 4028 Black Pickup Truck with Tools SOLD FROM MARCH 2000 THROUGH APRIL 2009 UPC 0-50743-04028-3",09304,https://www.cpsc.gov/Recalls/2009/Little-Tikes-Recalls-Childrens-Toy-Workshop-Sets-and-Trucks-Due-to-Choking-Hazard
"BRIO Recall of Toy Baking Sets",6/13/2001 ,"BRIO Recall of Toy Baking Sets NEWS from CPSC U.S. Consumer Product Safety Commission Office of Information and Public Affairs Washington, DC 20207 FOR IMMEDIATE RELEASE June 13, 2001 Release # 01-170 BRIO Recall Hotline: (888) 274-6869 CPSC Consumer Hotline: (800) 638-2772 CPSC Media Contact: Nychelle Fleming, (301) 504-7063 BRIO Media Contact: Robin Lehnert, (888) 274-6869 CPSC, BRIO® Announce Recall of Toy Baking Sets WASHINGTON, D.C.- In cooperation with the U.S. Consumer Product Safety Commission (CPSC), BRIO® Corp., of Germantown, Wis., a subsidiary of BRIO AB of Sweden, is recalling 6,450 baking set toys. The sets include a hand mixer with a knob that can break off, posing a choking hazard to young children. CPSC and BRIO have not received any reports of incidents. This recall is being conducted to prevent the possibility of injuries. The yellow, blue and red hand mixers are 5.5 inches long, and are sold along with toy utensils, rolling pin, mixing bowl, and baking molds. The BRIO Small Baking Set and BRIO Baking Set are labeled for children ages 2 years and older and are packaged in a clear-plastic tote. Inside of the tote, a label reads, PARENTS: ENSURE THE ITEMS ARE WASHED THOROUGHLY BEFORE USE. The recalled baking sets have a model number of either 31798 or 31795. Specialty stores, Internet retailers, and mail order catalogs sold the toys nationwide from March 1999 through April 2001 for $15 to $25. Consumers should take the hand mixer away from children immediately and call BRIO toll-free at (888) 274-6869 between 8:30 a.m. and 5 p.m. CT Monday through Friday, for a refund or replacement item. Consumers also can send the mixer to BRIO Corp., SAFETY RECALL, N120 W18485 Freistadt Road, Germantown, WI 53022, for a refund or replacement. For more information, consumers can log on to the company website at www.briotoy.com.",01170,https://www.cpsc.gov/Recalls/2001/CPSC-BRIO-Announce-Recall-of-Toy-Baking-Sets
"Infinitoy Recalls Softimals Toy Sets Due to Choking and Aspiration Hazard",10/23/2013 ,"Infinitoy Inc. is recalling the Super Safari Set model #30025 and the Deluxe Circus Train Set model #30040. The model number can be found on the back of the box in the lower right corner. The sets come in a white box with Softimals. Build, Play, Repeat and Ages 1 ½ to 5 printed in a colorful font on the front and back of the package. The sets have numerous plastic pieces that can be connected and fit together to build a vehicle pulling cars with a hippo, giraffe, zebra and other animals. The drivers of the lead vehicles, Safari Sam and Mighty Mike, have removable blue or yellow plastic hats.",14003,https://www.cpsc.gov/Recalls/2014/Infinitoy-Recalls-Softimals-Toy-Sets
"AAFES Expands Recall of Soldier Bear Toy Sets Due to Lead Poisoning Hazard",7/18/2007 ,"This recall involves toy sets with various action figures, dinosaurs, animals and vehicles. The style number, Universal Product Code and Soldier Bear logo are printed on the product's packaging. Toy Set Style Code UPC # H.E.R.O.E.S. Dino Mega Cruiser 00047 4 98567 00047 4 Dinosaur Adventure Set (two styles) 91068 91074 6 98567 91068 1 6 98567 91074 2 Wild Animal Adventure Set 91074 6 98567 91074 2 H.E.R.O.E.S. Vehicle Play Set (three styles: military, police and fire rescue) 85939 6 98567 85939 3",07239,https://www.cpsc.gov/Recalls/2007/AAFES-Expands-Recall-of-Soldier-Bear-Toy-Sets-Due-to-Lead-Poisoning-Hazard
"Activity Center Recalled",3/28/1990 ,"CONTACT: MARCH 28, 1990 (301) 504-7908 Release # 90-059 Activity Center Recalled WASHINGTON, DC -- In cooperation with the U.S. Consumer Product Safety Commission (CPSC), Battat Incorporated, Plattsburgh, New York is voluntarily recalling an infant/toddler Activity Center, item BK-06. The spinner at the top of the activity center was not properly glued and may separate releasing small noisemaker beads that may pose a choking hazard to children under three years old. The multi-colored Activity Center consists of three rows of toys/activities and has KAWADA Made in Japan embossed on the bottom. Near the base is a metal rod holding five brightly colored beads. The middle row consists of a dog-face squeaker, a clicking lever, a rolling drum with lots of pictures with a chime, and a bell. The top row has a single plastic rod with a gear-shaped plastic spinner. This spinner may separate releasing small noisemaker beads that may pose a choking hazard. New production units identified with 1A engraved on the bottom of the toy are properly glued and are not being recalled. Approximately 4,463 improperly glued Activity Centers have been distributed nationally since October 1988. The CPSC learned of this problem from a consumer complaint involving a seven-month-old child. Neither CPSC nor Battat, Inc. is aware of any injuries associated with this toy. Consumers should immediately take this toy away from young children and return it to the store where purchased or send it to Battat, Inc., P.O. Box 1264, Plattsburgh, N.Y. 12901 for a full refund including postage",90059,https://www.cpsc.gov/Recalls/1990/Activity-Center-Recalled
"CPSC, Wal-Mart Stores and Infantino Announce Recall of Fun Frog Soft Gyms",6/15/2005 ,"The recalled Baby Connection Fun Frog Soft Gym is comprised of a multi-colored, frog-shaped padded fabric mat, from which blue and orange support arms extend. The support arms consist of thin steel wire covered by foam and fabric. They can be arched, allowing for three stuffed infant toys to hang above the product's mat. A label with the word Infantino is attached to each of the stuffed toys as well as the underside of the mat. Products sold under item 150-761, Infantino Activity Soft Gym, which have a stamp on the back of the product showing 150-761 Production Date June 2005, are not affected by this recall.",05197,https://www.cpsc.gov/Recalls/2005/CPSC-Wal-Mart-Stores-and-Infantino-Announce-Recall-of-Fun-Frog-Soft-Gyms
"Infantino Recalls Children's Toy Castles Due to Choking Hazard",7/3/2007 ,"The recalled toy castles have counting beads, four play figures and several different shapes and letters that fit into holes in the castle. infantino® is printed in the lower right-hand corner of the side with the letters. The recall only includes castles with the following date codes: 5349, 6087, 6132 and 0906. Castles with other date codes, no date code or with a plastic rod attached with a metal screw are not included in this recall. The date code is stamped on the underside of the blue top and can be viewed through the top square shape or top A letter openings.",07230,https://www.cpsc.gov/Recalls/2007/Infantino-Recalls-Childrens-Toy-Castles-Due-to-Choking-Hazard
"AAFES Recalls Soldier Bear Toy Sets Due to Lead Poisoning Hazard",5/23/2007 ,"This recall involves toy sets with multiple action figures and vehicles. The model number (88931), Universal Product Code (6 98567 88931 4) and Soldier Bear logo are printed on the product's packaging. The backs of the action figures are marked with letters TC-ST.",07193,https://www.cpsc.gov/Recalls/2007/AAFES-Recalls-Soldier-Bear-Toy-Sets-Due-to-Lead-Poisoning-Hazard
"Disney Store Recalls Toy Tool Sets Due to Choking Hazard",2/12/2009 ,"The recalled Playhouse Disney Handy Manny Tool Set is a plastic, eight-piece toy set that includes a tool box, hammer, saw, pliers, wrench, tape measure and two screwdrivers. The name Handy Manny is embossed on one side of the tool box. The UPC (#405144100614 or #422147400633) can be located on the product's packaging.",09128,https://www.cpsc.gov/Recalls/2009/Disney-Store-Recalls-Toy-Tool-Sets-Due-to-Choking-Hazard
"Mattel Recalls Barbie and Tanner™ Magnetic Toys Due to Magnets Coming Loose",8/14/2007 ,"The recall involves Barbie and Tanner™ play sets -- model numbers J9472 and J9560. The toys include a scooper accessory with a magnetic end. Recalled scoopers have a visible, silver-colored, disc-shaped magnet on the end of the scooper. Scoopers with a white material covering the magnet and products manufactured after January 31, 2007 are not recalled.",07271,https://www.cpsc.gov/Recalls/2007/Mattel-Recalls-Barbie-and-Tanner-Magnetic-Toys-Due-to-Magnets-Coming-Loose
"Unitrade Marketing Group Recalls Peg Pounder",7/22/1991 ,"July 22, 1991 Release # 91-095 Unitrade Marketing Group Recalls Peg Pounder WASHINGTON, DC -- In cooperation with the U.S. Consumer Product Safety Commission (CPSC), Unitrade Marketing of New York, NY is voluntarily recalling approximately 12,800 Peg Pounder sets, model number 8839 because the toy comes with small plastic nuts that CPSC has determined could be a fatal choking hazard to young children. The all-plastic Peg Pounder comes with a red workbench and eight shape sorting slots which hold four yellow and four blue shape sorting pieces. The set comes with a yellow or blue hammer and a yellow or blue wrench to assemble and disassemble the workbench. The Peg Pounder was sold nationwide from September 1989 to November 1989 for approximately $1.99. The State of Kentucky discovered this unsafe toy during a retail survey and notified the CPSC. The toy's box reads in part: Peg Pounder, BACO, Made in Yugoslavia for New Brite Consumer Products Ltd., Royton, Lancs, England. Neither the CPSC nor the company is aware of any injuries involving this toy. This voluntary recall is being conducted to prevent the possibility of injury. Consumers are urged to take the Peg Pounder away from young children immediately and return it to the store where purchased for a refund of the purchase price. Consumers with questions about this recall may contact Unitrade at (212) 366-1400. The CPSC's mission is to protect the public from unreasonable risks of injury and death associated with consumer products. The CPSC is the Federal agency responsible for consumer product safety. Some 15,000 different types of consumer products fall within the Commission's jurisdiction and each year these products are involved in an estimated 28.5 million injuries and 21,600 deaths",91095,https://www.cpsc.gov/Recalls/1991/Unitrade-Marketing-Group-Recalls-Peg-Pounder
"Target Recalls Activity Cart Toys Due to Choking Hazard",4/4/2007 ,"The recall involves Little Tree wooden activity cart toys. This is a multi-colored cart with an orange seat and a wooden tray. The cart has apple trees, a blue fence, and red, blue and green flowers painted on one side. The cart also has a wooden sheep, dog and horse affixed to that same side. The other side of the cart contains a board with multi-colored wooden magnets.",07148,https://www.cpsc.gov/Recalls/2007/Target-Recalls-Activity-Cart-Toys-Due-to-Choking-Hazard
"CPSC And Dakin Inc. Urge Consumers To Remove Small Pom Poms",5/26/1995 ,"May 26, 1995 Release # 95-124 WASHINGTON, D.C. - In cooperation with the U.S. Consumer Product Safety Commission (CPSC), Dakin Inc. of Woodland Hills, Calif., is warning consumers that the pom poms on approximately 66,500 of their Big Top Playmates toys can detach, posing a choking or aspiration hazard.CPSC is aware of ten incidents in which pom poms separated from the toys or children under one year old ate pieces of the pom poms or placed the pom poms in their mouths. No injuries were reported and no medical attention was required.The Big Top Playmates series features a variety of products based on circus animals. This corrective action affects bear, bunny and elephant soft fabric dolls (item no. 40319), bottle hugging dolls (item no. 40321), finger puppets (item no. 40320), crib attachments (item no. 40335), dolls attached to the musical mobile (item no. 40324), and ring shaped rattles with soft plush animal head and feet (item no. 40325). The products are decorated with pink, yellow and blue trim with small pom poms that measure .5 inches.The products' hang tags include the item number and product name and reads in part, THE FRASER COLLECTION, DAKIN, INC. San Francisco, CA, Product of China.Dakin Inc. distributed 66,500 Big Top Playmates products nationwide from February 1994 through April 1995. The products sell for $5.00 to $15.00 ($50.00 for the mobile) in approximately 3,800 specialty, toy and department stores.Consumers are urged to immediately cut the pom poms from the products and discard them. Consumers who have questions about this corrective action may contact Dakin Inc. toll- free at (800)227-6598 from 9:30 a.m. to 6 p.m. PST.Big Top Playmates products currently on store shelves are being modified and should not have pom pom trim",95124,https://www.cpsc.gov/Recalls/1995/CPSC-And-Dakin-Inc-Urge-Consumers-To-Remove-Small-Pom-Poms
"Battat Recalls Additional Magnetic Construction Sets; Ingested Magnets Pose Aspiration and Intestinal Hazards",3/13/2008 ,"This recall involves the 108-piece (item number BB1439H) and the 68-piece (item number BAT-34) Magnabild Magnetic Building System sets. The 108-piece set comes in a rotating display case containing sixty 1-inch rods with magnets and 48 metal balls. The 68-piece set comes in a window box and contains forty-four 1-inch rods with magnets and 24 metal balls. The rods come in different colors. All of the plastic building pieces have the word Magnabild in raised lettering on them. BB1439H is found on a hang tag attached to the display case. BAT-34 is found on the box. The products are designed for children older than three years.",08221,https://www.cpsc.gov/Recalls/2008/Battat-Recalls-Additional-Magnetic-Construction-Sets-Ingested-Magnets-Pose-Aspiration-and-Intestinal-Hazards
"Manhattan Group Recalls Parents Wooden Activity Toys Due to Choking Hazard",3/3/2011 ,"The Parents® Busy Time Activity Centers™ is a wooden activity center cube-shaped toy that has a multi-colored bead run on the top. Activities on each side include a 4-tone xylophone and rasp, butterfly and caterpillar spinners, zig-zag drum, castanets, and pockets with alligator, bear, and cat pillow characters. Only items with wooden pegs bearing date code 400090GC are involved in this recall. The date code can be found on the bottom of the product packaging near the UPC code and on the tags on the bear character.",11156,https://www.cpsc.gov/Recalls/2011/Manhattan-Group-Recalls-Parents-Wooden-Activity-Toys-Due-to-Choking-Hazard
"Graco Children's Products Recalls to Replace Soft Blocks Towers on Activity Centers Due to Choking Hazard",5/2/2007 ,"The soft block tower is a stack of three different shaped stuffed fabric blocks in red, yellow and blue. Pictures of apples, fire engines, ducks, bananas, birds and blueberries on the blocks are covered in plastic film. The soft blocks are one of nine toys that snap onto the tray of the activity center. Only model number 4635BEE with serial numbers 012705 through 063005, which indicates the manufacture dates of January 27, 2005 through June 30, 2005, are included in this recall. Model and serial numbers are located underneath the activity center's tray.",07176,https://www.cpsc.gov/Recalls/2007/Graco-Childrens-Products-Recalls-to-Replace-Soft-Blocks-Towers-on-Activity-Centers-Due-to-Choking-Hazard
"McDonald's and CPSC Announce Exchange for LEGO Building Set Toys Because of Choking Hazard",11/10/1986 ,"November 10, 1986 Release # 86-069 McDonald's and CPSC Announce Exchange for LEGO Building Set Toys Because of Choking Hazard WASHINGTON, DC -- McDonald's and the U.S. Consumer Product Safety Commission today asked customers with children younger than three who received LEGO Building Sets at McDonald's Restaurants between October 31 and November 7 to exchange them for DUPLO Building Sets designed by the LEGO Company for children under three. LEGO Building Sets have been safety tested and meet all mandatory and voluntary toy regulations. However, these sets contain small parts which could present a hazard if given to children younger than three. No incidents have been reported with any building sets distributed at McDonald's during this time. McDonald's is running a four week promotion of LEGO Building Sets for children three and older, and PDPLO Building Sets without small parts for children younger than three. During the first week of promotion, some McDonald's may not have had available DUPLO Building Sets for children under three. The LEGO Building Set package have solid colored borders and a warning on the front panel that the building sets contain small parts and are not intended for children younger than three. DUPLO Building Sets have a dotted border. Consumers who want to obtain further information may call McDonald's Customer Relations Department at (312) 575- 6198 or CPSC toll free hotline at 800-638-CPSC. The CPSC teletypewriter number for the hearing impaired is (301) 595-7054",86069,https://www.cpsc.gov/Recalls/1987/McDonalds-and-CPSC-Announce-Exchange-for-LEGO-Building-Set-Toys-Because-of-Choking-Hazard-
"Mattel Recalls Doggie Day Care™ Magnetic Toys Due to Magnets Coming Loose",8/14/2007 ,"The recalled Doggie Day Care play sets have various figures and accessories that contain small magnets. Product # Name H1532 Doggie Day Care Coco H1533 Doggie Day Care Sparley G4461 Doggie Day Care Lula and Baby G4462 Doggie Day Care Crockett and Baby G4464 Doggie Day Care Taffy and Baby G4459 Doggie Day Care Snack Time with Cookie G4460 Doggie Day Care Diaper Change with Ginger H1530 Doggie Day Care Ice Cream with Ranger G9703 Doggie Day Care Puppy Park with Dixie G4457 Doggie Day Care Dream House Nursery with Honey G4458 Doggie Day Care Bath Time with Beau",07272,https://www.cpsc.gov/Recalls/2007/Mattel-Recalls-Doggie-Day-Care-Magnetic-Toys-Due-to-Magnets-Coming-Loose
"DDI Inc. Recalls Toy Construction Play Sets Due to Violation of Lead Paint Standard",1/29/2009 ,"The recall involves the 136-piece Mega Construction Play Set (item# 911346) and includes various construction equipment, vehicles, buildings and roads. The play sets are packaged in a black and yellow box with the word Builder printed in the upper left hand corner of the package.",09113,https://www.cpsc.gov/Recalls/2009/DDI-Inc-Recalls-Toy-Construction-Play-Sets-Due-to-Violation-of-Lead-Paint-Standard
"Serious Injuries Prompt Recall of Mattel's Polly Pocket Magnetic Play Sets",11/21/2006 ,"The recalled Polly Pocket play sets contain plastic dolls and accessories that have small magnets. The magnets measure 1/8 inch in diameter and are imbedded in the hands and feet of some dolls, and in the plastic clothing, hair pieces and other accessories to help the pieces attach to the doll or to the doll's house. The model number is printed on the bottom of the largest pieces on some of the play sets. Contact Mattel if you cannot find a model number on your product to determine if it is part of the recall. Polly Pocket magnetic play sets currently on store shelves are not included in this recall. Polly Pocket Magnetic Play Sets Item Number Polly Pocket!™ Polly Place™ Hangin' Out House™ B2632 Polly Pocket!™ Polly Place™ Treetop Clubhouse™ B3158 Polly Pocket!™ Spa Day™ B3201 Polly Totally!™ Polly Place™ Totally Tiki Diner™ B7118 Polly Pocket!™ Quik-Clik™ Boutique G8605 Polly Pocket!™ Quik-Clik™ City Pretty Playset H1537 Polly Pocket!™ Quik-Clik™ Sporty Style Playset H1538 Polly Pocket!™ Totally Zen™ Playset H3211",07039,https://www.cpsc.gov/Recalls/2007/Serious-Injuries-Prompt-Recall-of-Mattels-Polly-Pocket-Magnetic-Play-Sets
"Lands' End Recall of Soft Farm Set",5/31/2002 ,"Lands' End Recall of Soft Farm Set Recall Alert U.S. Consumer Product Safety Commission Office of Information and Public Affairs Washington, DC 20207 May 31, 2002 Alert #02-544 CPSC, Lands' End, Inc. Announce Recall of Soft Farm Set PRODUCT: Soft Farm Set - Lands' End, Inc. of Dodgeville, Wis., is voluntarily recalling about 600 Soft Farm Sets, style number 76626. The recalled set is a polyester/cotton barn with polyester/cotton farm animals and accessories: chicken with legs, duck with legs, dog, pig, cow, horse, 2 fences, a bale of hay and a pond. Lands' End Inc. catalog and web site sold these sets nationwide from January 2002 to April 2002 for about $34. PROBLEM: The legs of the chicken and duck figures may detach, posing a risk of choking. INCIDENTS/INJURIES: Lands' End has received one report of detached legs. No injuries have been reported. WHAT TO DO: Consumers should stop using the toy immediately and either remove the legs from the chicken and duck figures or contact Lands' End to receive a full refund. For more information, call Lands' End, Inc. at (800) 613-2824 or visit the web site www.landsend.com Purchasers were sent direct mail notification of this recall.",02544,https://www.cpsc.gov/Recalls/2002/CPSC-Lands-End-Inc-Announce-Recall-of-Soft-Farm-Set
"Fisher-Price Recalls Little People Play 'n Go Campsite™ Due to Choking Hazard",8/5/2010 ,"This recall involves the Little People Play 'n Go Campsite. The seven-piece plastic play set includes Sonya Lee, a tent and other accessories. Product number R6935 is printed on the toy's packaging. The name Sonya Lee is printed on the underside of the figure. Only Sonya Lee figures that bend at the waist, have a green sweater and purple camera around the neck are included in this recall. No other Sonya Lee figure is affected. The remaining pieces of the Little People Play 'n Go Campsite are not affected.",10313,https://www.cpsc.gov/Recalls/2010/Fisher-Price-Recalls-Little-People-Play-n-Go-Campsite-Due-to-Choking-Hazard
