Disclaimer: CPSC does not guarantee the accuracy, completeness, or adequacy of the contents of the Publicly Available Consumer Product Safety Information Database on SaferProducts.gov, particularly with respect to information submitted by people outside of CPSC.
Title,Date,Summary,Recall Number,Recall URL
"Playskool Voluntarily Recalls Toy Tool Benches after the Death of Two Toddlers",9/22/2006 ,"The Team Talkin' Tool Bench™ is a 20-inch-tall plastic toy tool bench with an animated red toy saw, a yellow toy drill and a blue toy vice. The toy talks and makes various sound effects, including tool sounds. The product also includes a toy hammer, screwdriver, two 2¼-inch plastic screws, two 3-inch plastic nails and pieces to build a small toy plane. The red Playskool logo is on the front of the brown surface of the tool bench.",06266,https://www.cpsc.gov/Recalls/2006/Playskool-Voluntarily-Recalls-Toy-Tool-Benches-after-the-Death-of-Two-Toddlers
"KB Toys Recall of Activity Gym Toys",6/14/2001 ,"KB Toys Recall of Activity Gym Toys NEWS from CPSC U.S. Consumer Product Safety Commission Office of Information and Public Affairs Washington, DC 20207 Note: telephone number change FOR IMMEDIATE RELEASE Originally issued June 14, 2001, Revised February 26, 2004 Release # 01-174 Company Phone Number: (413) 496-3000 CPSC Consumer Hotline: (800) 638-2772 CPSC Media Contact: Nychelle Fleming, (301) 504-7063 CPSC, KB Toys Announce Recall of Activity Gym Toys WASHINGTON, D.C.- In cooperation with the U.S. Consumer Product Safety Commission (CPSC), KB Toys, of Pittsfield, Mass., is voluntarily recalling about 115,000 Electronic Light N' Learn activity gyms. Five detachable hanging rattle toys have small round pegs at the top of the toys that can break off, posing a choking hazard to young children. CPSC and KB Toys have received six reports of the pegs breaking off, including two reports of a 6- month-old-boy and a 14-month-old-boy beginning to choke off of a broken piece of the rattle attachment. The Electronic Light N' Learn activity gym is a multi-colored toy that converts into three different toys, including a crib toy, a floor gym and a musical keyboard. The gyms' main console has five buttons with numbers that make music when pressed and automatically light up when the continuous song play option is selected. Five detachable rattles in the shape of a bear, snail, star, half-moon and horse hang from the bottom of the console. A label under the handle on the gyms' main console reads in part ELECTRONIC LIGHT N' LEARN ACTIVITY GYM MODEL: 8735, MADE IN CHINA. KB Toy store, KB Toy Works, KB Toy Outlet, Big Lots, Odd Lots, Pic N Save and MacFrugals nationwide sold the toys from September 2000 through January 2001 for between $20 and $30. The toys also were sold online at KBKids.com. Consumers should take these toys away from young children immediately and return the toy to the store where purchased for a refund. Consumers who purchased the toy online, should return the toy to the closest KB Toy store or contact KB Toys for return information. For additional information, contact KB Toys at (413) 496-3000.",01174,https://www.cpsc.gov/Recalls/2001/CPSC-KB-Toys-Announce-Recall-of-Activity-Gym-Toys
"Toy Kitchen Is Recalled; Parts May Cause Choking",2/2/1989 ,"Toy Kitchen Is Recalled; Parts May Cause Choking NEWS from CPSC U.S. Consumer Product Safety Commission Office of Information and Public Affairs Washington, DC 20207 FOR IMMEDIATE RELEASE February 2, 1989 Release # 89-009 Toy Kitchen Is Recalled; Parts May Cause Choking WASHINGTON -- Amloid Company of Saddle Brook, NJ, is voluntarily recalling some 75,000 Cook N Clean Kitchen toys because small plastic parts may come off the toy and could pose a choking hazard to young children. Packaged in a yellow plastic, fold-up carrying case, Cook N Clean Kitchen is a toy kitchen for pre-school children. The toy kitchen includes a stove, sink, cupboard, pots, pans, utensils and placemats made of blue, red and yellow plastic. The temperature control knob on the stove and small red pegs on the back of the toy may come off and could present a choking hazard. Imported from Mexico, the toys were sold nationwide since April 1987 for about $6 to $8. Consumers should immediately take the toy away from young children and return it to the store where purchased for a refund of the full purchase price. The U.S. Customs Service identified the potentially hazardous toy at the Port of Laredo, Texas during Operation Toyland, a joint surveillance program with the U.S. Consumer Product Safety Commission.",89009,https://www.cpsc.gov/Recalls/1989/Toy-Kitchen-Is-Recalled-Parts-May-Cause-Choking
"Manhattan Toy Recalls Table Top Toys Due to Choking Hazard",3/31/2016 ,"Busy Loops table top toys have orange, green, blue and purple plastic tubing with plastic beads threaded on the tubing that can slide up and down. The tubes sit on a blue plastic base with an orange plastic suction cup. The toy is about 4.5 W x 4.5 L x 7 H. The model number 700470 and lot code FH are printed on the bottom of the blue base.",16129,https://www.cpsc.gov/Recalls/2016/Manhattan-Toy-Recalls-Table-Top-Toys
"Toys R Us Recalls Elite Operations Toy Sets Due to Lead and Laceration Hazards",3/13/2007 ,"This recall involves three styles of Elite Operations brand toy sets. The military-style play sets contain light and sound vehicles, action figures and accessories. Models included in this recall are: Super Rigs Transport Vehicle (Item # 087286), Command Patrol Center (Item # 920625) and Troop Carrier (Item # 773967). The item numbers are located on the back of the packaging above the barcode. Toy sets sold prior to January 2006 are not included in this recall. No other Elite Operations brand toys are affected by this recall.",07127,https://www.cpsc.gov/Recalls/2007/Toys-R-Us-Recalls-Elite-Operations-Toy-Sets-Due-to-Lead-and-Laceration-Hazards
"Toys R Us Recalls Imaginarium Activity Center Due to Choking Hazard",5/30/2012 ,"This recall involves the Imaginarium 5-Sided Activity Center. The multi-sided center has two triangle-shaped ends with a wooden multi-colored xylophone on one and a mirror on the other. The three sides are square-shaped and include moveable block letters, rotating gears and sliding shapes. The name Imaginarium appears in a blue, oval-shaped logo underneath the mirror on one end. The second 'i' in the logo is dotted with a shooting star. The recalled product has model number 46284; Toys R Us item number 295909; and has the barcode number 000799985462841. The model number is printed on the back of the box, directly above the bar code. These numerical markings do not appear on the actual product.",12188,https://www.cpsc.gov/Recalls/2012/Toys-R-Us-Recalls-Imaginarium-Activity-Center-Due-to-Choking-Hazard
"Toys R Us Recalls Imaginarium Activity Walker Due to Choking Hazard",3/13/2013 ,"The recalled Imaginarium Activity Walkers have a round wooden push handle on the top of a curved triangle-shaped wooden walker base with four wheels. There is a multi-colored metal xylophone with 2 triangle mallets, 1 multi-colored abacus and 1 scratch noise maker on the front of the walker. The walkers have multi-colored wooden, disc-shaped wheels. The walkers measure about 19 inches tall and about 13 inches wide. The recalled walkers have model number Toys 'R' Us 5F5E972 printed on the bottom of the activity walkers. Barcode number 3700217300319 is printed on the bottom of the activity walker box.",13139,https://www.cpsc.gov/Recalls/2013/Toys-R-Us-Recalls-Imaginarium-Activity-Walker
"Spin Around Playhouse Recalled by Illco",7/26/1989 ,"Spin Around Playhouse Recalled by Illco NEWS from CPSC U.S. Consumer Product Safety Commission Office of Information and Public Affairs Washington, DC 20207 FOR IMMEDIATE RELEASE July 26, 1989 Release # 89-073 Illco Toy Company Recalls Spin Around Playhouse WASHINGTON, DC -- Illco, Toy Company (U.S.A.) Inc., New York, New York is voluntarily recalling its Model No. 8634 Disney Babies Spin Around Playhouse. Components of this toy may separate and the resulting small parts may present a choking, aspiration or ingestion hazard. This toy consists of a house which spins around on a Lazy Susan with four different color doors, two on the front and two on the back. There are three Disney figures on top of the house. The box is labeled, Spin Around House Disney Babies Activity Toy and lists Illco's name. A total of 6,708 of these toys were sold nationwide in retail stores for approximately $14.00 from 1987 to 1988. Consumers should remove the product from their children's reach and return it-to the store where purchased for an exchange or refund. They may also return it to Illco Toy Co., Inc., 200 Fifth Avenue, New York, New York 10010.",89073,https://www.cpsc.gov/Recalls/1989/Illco-Toy-Company-Recalls-Spin-Around-Playhouse
"Toy Sundae Sets Sold at Target Recalled by Battat Inc. Due to Choking Hazard",3/13/2008 ,"The recalled wooden sundae set toy includes six wooden scoops of ice cream, three cherries that attach to the top of the ice cream scoops, banana slices, a spoon and bowl. The ice cream scoops are green, pink, brown, yellow and purple. The sundae set pieces attach to each other with Velcro. Model number DPCI-204-12-0526 is included in this recall and is located on the packaging.",08220,https://www.cpsc.gov/Recalls/2008/Toy-Sundae-Sets-Sold-at-Target-Recalled-by-Battat-Inc-Due-to-Choking-Hazard
"Imaginarium Activity Centers Sold at Toys R Us Recalled Due to Choking Hazard",4/3/2008 ,"This recall involves the Imaginarium Multi-Sided and Jungle activity centers. The multi-sided activity center has moveable block letters, clock face, sliding shapes and gears. The jungle activity centers have peg jumping monkeys, sliding fish, abacus beads, bead mazes and other animal-themed activities. Imaginarium and the name of the activity center are printed on the packaging. Item numbers 69042 (multi-sided) and 69083 (jungle) are printed on the back of the box, near the bar code.",08242,https://www.cpsc.gov/Recalls/2008/Imaginarium-Activity-Centers-Sold-at-Toys-R-Us-Recalled-Due-to-Choking-Hazard
"Fisher-Price Intelli-Table Toy Recall",3/29/2001 ,"Fisher-Price Intelli-Table Toy Recall NEWS from CPSC U.S. Consumer Product Safety Commission Office of Information and Public Affairs Washington, DC 20207 FOR IMMEDIATE RELEASE Originally issued March 29, 2001, Revised November 19, 2002 Release # 01-115 Fisher-Price Recall Hotline (800) 220-7137 CPSC Consumer Hotline: (800) 638-2772 CPSC Media Contact: Kim Dulic, (301) 504-7058 Fisher-Price Media Contact: Laurie Oravec, (716) 687-3395 Note: Web site change. CPSC, Fisher-Price Announce Recall of Infant and Toddler Toys WASHINGTON, D.C. - In cooperation with the U.S. Consumer Product Safety Commission (CPSC), Fisher-Price, of East Aurora, N.Y., is recalling about 20,000 infant and toddler Intelli-Table toys for repair. Two red knobs on the toy can break off, creating small parts that can pose a choking hazard for young children. Fisher-Price has received 32 reports of the knobs breaking off the toys. A 14-month old child was found with a knob in her mouth. Her mother removed it and no injuries have been reported. The Intelli-Table is a round, plastic activity table with a blue, removable top that uses three interchangeable play rings to help children learn numbers, music, and games. The toy is intended for children ages nine to 36 months. The base of the Intelli-Table is red with three legs that are blue, yellow and teal green. The play rings are colored white, yellow and teal green. The red knobs on the yellow ring and white ring can break off. The toy has a Fisher-Price logo on the blue removable top; and has the model number, 77148, and the words, Mattel, Inc. and China, molded into the bottom of the red base. Only models manufactured from September 25, 2000 through October 7, 2000 are being recalled. The recalled models have a date code from 269(0) through 281(0) molded into the underside of the blue, removable top. Toy, mass merchandise and discount stores sold these toys nationwide from October 2000 through March 2001 for about $70. Consumers should take the toys away from young children immediately and contact Fisher-Price toll-free at (800) 220-7137 anytime to order a free repair kit with replacement knobs. The repair kit consists of two replacement knobs with new screws. Consumers can also visit the Fisher- Price web site at http://www.service.mattel.com/us/recall.asp to determine if their toy is recalled.",01115,https://www.cpsc.gov/Recalls/2001/CPSC-Fisher-Price-Announce-Recall-of-Infant-and-Toddler-Toys
"Target Recalls Various Toys Due to Lead and Laceration Hazards",11/15/2006 ,"The recall involves Kool Toyz brand toys, including sets containing die-cast cars, playground set, doll house set, dinosaurs, trucks, boats and planes. The packaging is primary blue and has the Kool Toyz logo is on the upper left corner of the packaging. The following chart lists the toys involved in the recall, their item numbers written on the upper right corner of the packaging, and the specific hazards they pose: Product Name Item Number Hazard Truck Carry Case 087/01/0050 Lead Paint and Sharp Points Tiny Playground Play Set 086/10/0048 Lead Paint and Sharp Points Dream House Play Set 086/10/0048 Lead Paint and Sharp Points Discovery Dinosaur Habitat 087/01/0011 Lead Paint Command Center Action Figure Play Set 087/01/0034 Sharp Points Aircraft Carrier Action Figure Play Set 087/01/0034 Sharp Points Air, Land and Sea Defense Play Set 087/01/0036 Lead Paint Tank Action Figure Play Set 087/01/0040 Lead Paint Helicopter Action Figure Play Set 087/01/0040 Lead Paint Remote Control Trucks 087/01/0042 Sharp Points",07035,https://www.cpsc.gov/Recalls/2007/Target-Recalls-Various-Toys-Due-to-Lead-and-Laceration-Hazards
"CPSC, Wal-Mart Stores Inc. Announce Recall of Toy Sets",11/22/2005 ,"The recalled 10-IN-1 Wood Activity Trunk is a wood box with a removable lid. The trunk measures about 7 inches wide by 8½ inches high by 14½ inches long. The toy set provides 10 different activities, including a pounding bench, puzzle, stacking rings, bead maze/runner, wood alphabet blocks, wood stacking blocks of various shapes, wood train engine, and plastic building blocks. One side of the trunk contains an abacus with five rows of colored beads. The other side of the trunk contains the shape sorter and pictures of a yellow tiger and purple bear with building blocks. No writing is on the box. The red cardboard packaging reads, kidconnection® and 10-IN-1 Wood Activity Trunk.",06035,https://www.cpsc.gov/Recalls/2006/CPSC-Wal-Mart-Stores-Inc-Announce-Recall-of-Toy-Sets
"LJN Sling 'Em-Fling 'Em Wrestling Ring Toy Recalled",11/4/1991 ,"November 4, 1991 Release # 92-015 WASHINGTON, D.C. -- LJN Toys, Ltd., New York, NY, in cooperation with the U.S. Consumer Product Safety Commission (CPSC), recalled its World Wrestling Federation Sling 'Em- Fling 'Em wrestling ring toy because of potentially severe injuries should a child fall on one of the corner posts of the wrestling ring. LJN was a subsidiary of MCA, Inc. during the period of manufacture and sale of the wrestling ring. LJN, a publisher, marketer and distributor of home entertainment products, is no longer in the toy business. The Commission indicates that there were four very serious injuries which resulted when children, ranging in age from six to 10 years, fell onto one of these toys. In each case, one of the four rigid plastic corner posts penetrated the child's body cavity causing severe internal injury. LJN sold about 1.4 million toy wrestling rings between 1985 and 1989 for a retail price up to $20. The toy was promoted by featuring action figures of World Wrestling Federation (WWF) stars such as Hulk Hogan and Andre the Giant. The figures were sold separately. The ring has an 18-1/2 inch square plastic base that is 3-1/2 inches high with four 9-1/2 inch long rigid blue plastic posts that snap into place at each corner. Once in place, the posts are about six inches high. Red, white, and blue elastic bands form the ropes around the ring. A decal with the WWF logo was supplied with each toy. Consumers may identify the LJN wrestling ring by looking underneath the base for these words molded into the plastic: 1985 LJN TOYS LTD. TITAN SPORTS INC. MADE IN U.S.A. To prevent additional injuries, consumers who own these wrestling ring toys are urged to remove the four rigid plastic posts immediately. Because the posts are so rigidly secured, consumers may have to break the posts to remove them. LJN Toys Ltd. is out of business and cannot be contacted.The U.S. Consumer Product Safety Commission is announcing this recall as part of its mission to protect the public from unreasonable risks of injury and death associated with consumer products. The CPSC is the Federal agency responsible for consumer product safety. Some 15,000 different types of consumer products fall within the Commission's jurisdiction and each year these products are involved in an estimated 28.5 million injuries and 21,600 deaths",92015,https://www.cpsc.gov/Recalls/1992/LJN-Sling-Em-Fling-Em-Wrestling-Ring-Toy-Recalled
"Fisher-Price Recalls Learning Pots and Pans™ Toys Due to Choking Hazard",8/7/2008 ,"This recall involves Learning Pots and Pans™ toy sets with stackable pots and pans, a lid and shape-sorting blocks. The toys have light and sound features that operate on three AA batteries. Model number G6685 is located on the bottom of the blue pan.",08362,https://www.cpsc.gov/Recalls/2008/Fisher-Price-Recalls-Learning-Pots-and-Pans-Toys-Due-to-Choking-Hazard
"KB Toys Recalls Wooden Toys Due to Violation of Lead Paint Standard",10/4/2007 ,"Wooden Pull-Along Alphabet & Math Blocks Wagons and Learning Blocks Wagons: The recalled wooden toy wagons have 28 blocks and a pull string. The wagons measure about 7½ x 13 and have blocks with letters, words, numbers, or pictures on them. First Learning or My Kidz are printed on the products' packaging, in addition to UPC #834162002158 or #834162002165. 10-in-1 Activity Learning Carts: The recalled activity carts are three dimensional learning toys with various activities. The cart measures about 17¼ x 16½ x 7¾. First Learning and UPC #834162002127 are printed on the products' packaging. Flip-Flop Alphabet Blocks: The recalled wooden toys have blocks that flip with letters, words, numbers, and pictures on them. The toy measures about 10 1/8 x 10¾ x 2¾. First Learning and UPC #834162001212 are printed on the products' packaging.",08004,https://www.cpsc.gov/Recalls/2008/KB-Toys-Recalls-Wooden-Toys-Due-to-Violation-of-Lead-Paint-Standard
"Fisher-Price Recalls Infant Toys with Inflatable Balls Due to Choking Hazard",9/30/2010 ,"This recall involves the products listed below: Product Product Description 73408 Baby Playzone™ Crawl and CruisePlayground™ 6 months and uplayzone has three play modes for crawling, to pulling up and cruising, to walking in and out B2408 Baby Playzone™ Crawl and Slide Arcade™ 9 months and up Baby arcade converts to baby's first slide. C3068 Ocean Wonders™ Kick and Crawl™ Aquarium Birth and Up A soft gym with two toy bars. The gym converts to a crawl-through play space. H5704 Baby Gymtastics™ Play Wall 6 to 36 months Play wall with activities H8094 Ocean Wonders™ Kick and Crawl™ Aquarium Birth and Up A soft gym that features two toy bars. The gym converts to a crawl-through play space. J0327 1-2-3 Tetherball™ 6 months and Up Big inflatable ball (Approximately 12 inches in diameter) with light up base. K0476 Bat and Score Goal™ 6 months and Up Baby soccer goal with detachable ball.",10362,https://www.cpsc.gov/Recalls/2010/Fisher-Price-Recalls-Infant-Toys-with-Inflatable-Balls-Due-to-Choking-Hazard
"Mattel Recalls Various Barbie® Accessory Toys Due to Violation of Lead Paint Standard",9/4/2007 ,"The recall involves various Barbie accessory toys that were manufactured between September 30, 2006 and August 20, 2007. The model names, product numbers and affected date code numbers are listed in the chart below. The product and date code numbers are printed on the largest component of the toy sets. Product Product Number Date Code Number Product Photo Barbie® Dream Puppy House™ (lead paint on dog) J9485 286-6JX through 365-6JX or 001-7JX through 232-7JX (product number and date code are marked on the bottom of the house) Barbie® Dream Kitty Condo™ Playset (lead paint on cat) J9486 286-6JX through 365-6JX or 001-7JX through 232-7JX (product number and date code are marked on the bottom of the house) Barbie® Table and Chairs Kitchen Playset (lead paint on dog, chip platter, dinner plates) K8606 All (product number is marked under the table) Barbie® Bathtub and Toilet Playset (lead point on cat) K8607 All (product number is marked under the tub) Barbie® Futon and Table Living Room Playset (lead paint on cat) K8608 All (product number is marked on the cushion label) Barbie® Desk and Chair Bedroom Playset (lead paint on dog) K8609 All (product number is marked under the desk) Barbie® Couch & Table Living Room Playset (lead paint on purse) K8613 All (product number is marked under the table)",07301,https://www.cpsc.gov/Recalls/2007/Mattel-Recalls-Various-Barbie-Accessory-Toys-Due-to-Violation-of-Lead-Paint-Standard
"Small World Toys Recalls Children's Take-Apart Townhouse Toys; Detached Magnets Pose Aspiration and Intestinal Hazards",5/3/2007 ,"These wooden toys, for children ages 18+ months, are shaped like houses measuring 8.5 inches high by about 4.5 inches wide. They have nine pieces that children can disassemble and reassemble. Each house has a green chimney and a blue and yellow striped pillar with a purple base at each corner. The sides of the house have four removable panels of different shapes with red knobs that children use to pull the panels off. IQ Preschool™ appears on the side of the house below the blue and green rectangular panel. Model number 2408808 appears on the packaging.",07179,https://www.cpsc.gov/Recalls/2007/Small-World-Toys-Recalls-Childrens-Take-Apart-Townhouse-Toys-Detached-Magnets-Pose-Aspiration-and-Intestinal-Hazards
"Step2® Recalls Children's Transportation Station Toys Due to Choking Hazard",9/7/2010 ,"The Step2 ® Sand & Water Transportation Station is a standalone play station for children ages two and up. The toy station consists of: a round blue plastic table, including train tracks, train cars in blue, red and yellow, toy sailboats and a hand rake/shovel. A red Step2 logo decal is on the side of the table. Train cars with gray wheels are not included in this recall.",10334,https://www.cpsc.gov/Recalls/2010/Step2-Recalls-Childrens-Transportation-Station-Toys-Due-to-Choking-Hazard
"Evenflo Recalls Cake Toys on Children's Activity Centers Due to Choking Hazard",12/8/2009 ,"This recall involves Evenflo ExerSaucer® 1-2-3 Tea for Me™ activity learning centers. The tea party themed toys have a two-tier cake that is light blue, dark pink and yellow. Models included in the recall are 6161834 and 6161920. The model numbers are printed on the packaging and on a label located on the underside of the base of the product. The recommended age for use of this product is 4 months to walking.",10057,https://www.cpsc.gov/Recalls/2010/Evenflo-Recalls-Cake-Toys-on-Childrens-Activity-Centers-Due-to-Choking-Hazard
"CPSC, Fisher-Price Announce Recall of Little People® Animal Sounds Farms",4/23/2003 ,"Little People® Animal Sounds Farms Recalled by Fisher-Price NEWS from CPSC U.S. Consumer Product Safety Commission Office of Information and Public Affairs Washington, DC 20207 FOR IMMEDIATE RELEASE April 23, 2003 Release # 03-111 Fisher Price Recall Hotline: (866) 259-7873 CPSC Consumer Hotline: (800) 638-2772 CPSC Media Contact: Nychelle Fleming, (301) 504-7908 Fisher-Price Media Contact: Laurie Oravec, (716) 687-3395 CPSC, Fisher-Price Announce Recall of Little People® Animal Sounds Farms WASHINGTON, D.C. - In cooperation with the U.S. Consumer Product Safety Commission, (CPSC), Fisher-Price, of East Aurora, N.Y., is voluntarily recalling about 67,000 Little People® Animal Sounds Farms manufactured from June 17, 2002 through July 31, 2002. Two small metal screws that hold the toy stall doors in place can come off, posing an aspiration or choking hazard to young children. Fisher-Price has received 33 reports of the screws coming off of the toy, including four reports where a screw was found in the child's mouth and one report of a child that aspirated a screw into his lung. The latter case required the child to be hospitalized and undergo emergency surgery to remove the screw from his lung. The recalled Little People® Animal Sounds Farms are shaped like a barn and make animal sounds when the doors of the cow or horse stall are opened. The recalled toys have a model number of 77973 or 77746 and a six-character manufacturing date code that begins with 168 through 212, followed by the number 2 as the fourth digit. Both the model number and date code can be found on the underside of the green ramp. The Fisher-Price logo appears at the top of the tallest side of the barn in red and white. The recalled toys were manufactured in Mexico. Mass merchants and toy stores nationwide sold these toys between July 2002 and December 2002 for about $30. Consumers should take the toy away from young children immediately and contact Fisher-Price toll-free at (866) 259-7873 anytime to receive a free repair kit. Consumers also can log on to www.service.mattel.com to determine if their product is among the recalled models and to order the free repair kit online.",03111,https://www.cpsc.gov/Recalls/2003/CPSC-Fisher-Price-Announce-Recall-of-Little-People-Animal-Sounds-Farms-
