"Faratak, Inc. Recalls Musical Dolls Due To Potential Choking Hazards",4/2/1991 ,"April 2, 1991 Release # 91-045 Faratak, Inc. Recalls Musical Dolls Due To Potential Choking Hazards WASHINGTON, DC -- In cooperation with the U.S. Consumer Product Safety Commission (CPSC), Faratak, Inc., Alhambra, CA is voluntarily recalling approximately 48,000 Musical Dolls with Rotating Head model numbers 501A, B, C, 502A, B, C, 503A, B, C, 504A, B, C, 505A, B, C and 506A, B, C because of small parts that pose a potential choking hazard for children under three years of age. The potentially hazardous dolls were identified by CPSC during an inspection of Faratak, Inc. When CPSC tested the dolls in accordance with regulations under the Federal Hazardous Substances Act, the plastic button eyes separated from the dolls' heads creating small parts that pose a potential choking hazard for children under three years of age. The cloth wind-up musical dolls are in a sitting position measuring approximately seven inches tall. They are clothed in an array of colorful print dresses with brown, yellow, or white yarn hair. Their heads rotate when the wind-up key to the music box is activated to play It's A Small World. The label located underneath the doll's dress reads in part Faratak, Inc., Alhambra, CA, Made in China. All dolls, made under the model numbers listed above, with plastic button eyes are subject to recall. The different model numbers reflect differences in dress pattern, hair style and color although the head construction of all models is identical. The dolls, manufactured by Faratak, Inc., were sold nationwide to retail gift and specialty stores, including flower and hospital gift shops, from January 1989 to September 1990 and retail for about $20.00 each. Neither the CPSC nor Faratak, Inc. is aware of any injuries involving this product. This voluntary recall is being conducted to prevent the possibility of injury. Consumers are urged to take the toy away from children under three years of age immediately and return it to the store where purchased for a replacement or mail the product to Faratak, Inc. for a full refund of the purchase price and shipping costs. For more information about this recall, consumers may call 1-818-281-2424 or write Faratak, Inc. at 2620 Concord Ave., #102, Alhambra, CA 91830. The CPSC's mission is to protect the public from unreasonable risks of injury and death associated with consumer products. The CPSC is the Federal agency responsible for product safety. Some 15,000 different consumer products fall within the Commission's jurisdiction and each year these products are involved in an estimated 30 million injuries and 22,000 deaths",91045,https://www.cpsc.gov/Recalls/1991/Faratak-Inc-Recalls-Musical-Dolls-Due-To-Potential-Choking-Hazards
"Cabbage Patch Kids Snacktime Dolls Refund",1/6/1997 ,"Cabbage Patch Kids Snacktime Dolls Refund NEWS from CPSC U.S. Consumer Product Safety Commission Office of Information and Public Affairs Washington, DC 20207 Note: Change in Remedy Instructions and Phone Number. FOR IMMEDIATE RELEASE Originally issued January 6, 1997, Revised May 9, 2005 Release #97-055 CONTACT CPSC: (301) 504-7908 CONTACT MATTEL: Lisa McKendall (310) 252-4592 Mattel and the U.S. Consumer Product Safety Commission Announce Voluntary Refund Program for Cabbage Patch Kids & Snacktime Kids Dolls WASHINGTON, D.C. -- In response to concerns related to its Cabbage Patch Kids® Snacktime Kids dolls, Mattel, Inc., with the cooperation of the U.S. Consumer Product Safety Commission (CPSC), voluntarily announced today a refund program for all dolls purchased since the toy's introduction in the fall of 1996. Mattel will offer consumers a full cash refund of $40. At the same time, the company announced a withdrawal of the product from all retail shelves across the U.S., and will discontinue the distribution of the Snacktime Kids dolls. Mattel is taking this action following reports of people getting their hair and fingers caught in the mouths of the dolls. Neither Mattel's nor CPSC's testing of the product has identified a serious safety hazard associated with the dolls. Nonetheless, we remain deeply concerned with the satisfaction of all our consumers and in maintaining their long-standing confidence in the safety and value of our toys, said Jill E. Barad, Mattel's chief executive officer. Our job is to bring joy to children's lives. If any of our products are causing concerns, we are committed to responding in a responsible manner. We recognize that these incidents can be upsetting to children and adults, and we are pleased with the actions being taken by Mattel, said CPSC Chairman Ann Brown. According to Mattel, since the birth of Cabbage Patch Kids in 1983, more than 80 million dolls have been adopted by children throughout the world, and their unique individual features and representation of all races and ethnicities has established the dolls as one of the most beloved toys in history. To date, approximately 500,000 Cabbage Patch Kids Snacktime Kids dolls have been sold to consumers. This voluntary program serves as a reconfirmation of our commitment to the children who enjoy Cabbage Patch Kids and all the people who, for more than 50 years, have helped make our many toys the most popular in the world, said Barad. To receive a $40 refund, which includes estimated shipping and handling costs, consumers can call Mattel at (800) 524-8697, Mondays through Friday's from 8 a.m. to 5 p.m. PST.",97055,https://www.cpsc.gov/Recalls/1997/Mattel-and-the-US-Consumer-Product-Safety-Commission-Announce-Voluntary-Refund-Program-for-Cabbage-Patch-Kids--Snacktime-Kids-Dolls
"New York Importer Announces Refund Program For Funny Clown Dressing Doll",7/31/1990 ,"New York Importer Announces Refund Program For Funny Clown Dressing Doll NEWS from CPSC U.S. Consumer Product Safety Commission Office of Information and Public Affairs Washington, DC 20207 FOR IMMEDIATE RELEASE CONTACT: July 31, 1990 (301) 504-7908 Release # 90-133 New York Importer Announces Refund Program For Funny Clown Dressing Doll WASHINGTON, D.C. -- Brightly colored toy clown dolls, marketed as the Funny Clown or Dress-Me Clown, are the subject of a safety warning/recall program by JSNY of New York, NY because they contain small parts that present a choking risk to children under the age of three. The refund program is being conducted in cooperation with the U.S. Consumer Product Safety Commission. Over 250,000 clown dolls were sold by mail order catalogue and by retailers nationwide from 1986 to 1989 at a cost of about $5.00. Clothed primarily in red, blue and yellow, this doll has yellow string hair, a clown's cap and is about 13 inches long. It also has a snap, button, zipper, buckle and shoe laces intended to introduce children to various dressing functions. The doll may be identified by a cloth tag sewn onto the doll's cap that say: JSNY. While the dolls were advertised and age labelled for children over age three, they may be used by children under three. The Commission has tested the dolls and found that the button, buckle and zipper are small parts that present a choking, ingestion, and aspiration hazard to children under three. To date, no injuries have been reported. Consumers owning a JSNY Funny Clown dress up doll which is being used by a child under age three should immediately take it away from the child and may arrange for a refund by phoning the company at its toll-free number, 1-800-841-1007, or its office number, 212-989-7591.",90133,https://www.cpsc.gov/Recalls/1990/New-York-Importer-Announces-Refund-Program-For-Funny-Clown-Dressing-Doll
"Curious George Plush Dolls Recalled By Marvel Toys Due to Risk of Lead Exposure",11/8/2007 ,"This recall involves Curious George 12-inch plush dolls with a plastic face. The dolls are dressed to represent five various themes: birthday, fireman, sweet dreams, tool time and tool time with a soft face. The plush dolls were sold with a Curious George storybook or activity book. The following product and SKU numbers are printed on the packaging. Birthday 90253/ 8-83199-90253-5 Fireman 90246/ 8-83199-90246-7 Sweet Dreams 90247/ 8-83199-90247-4 Tool Time 90251/ 8-83199-90251-1 Tool Time (soft face) 90251/ 8-83199-90251-1",08079,https://www.cpsc.gov/Recalls/2008/Curious-George-Plush-Dolls-Recalled-By-Marvel-Toys-Due-to-Risk-of-Lead-Exposure
"Baby Dolls Recalled by Lakeshore Learning Materials Due to Choking Hazard",3/27/2012 ,"Feels Real Baby Dolls are 14-inch high plastic dolls with movable arms, legs, and head. The dolls are Hispanic, Caucasian, Asian and Black and are dressed in diapers with a colored hearts, stars and swirl print. Two labels are sewn inside the back of the diaper. Lakeshore is written on the larger label. The number 550200 is written on the smaller label.",12728,https://www.cpsc.gov/Recalls/2012/Baby-Dolls-Recalled-by-Lakeshore-Learning-Materials-Due-to-Choking-Hazard
"Choking Hazard Leads To Recall Of 2 Dolls",2/28/1989 ,"February 28, 1989 Release # 89-018 Choking Hazard Leads To Recall Of 2 Dolls WASHINGTON -- Learn and Play Pal and Soft Sisters dolls, which were sold nationwide last year in toy, chain and drug stores, are being recalled by Lovee Doll Company of Brooklyn, N.Y. in cooperation with the U.S. Consumer Product Safety Commission (CPSC). The buttons or a buckle on the clothing of the dolls could come off and present a choking hazard to young children.Standing 16 inches tall, Learn and Play Pals #41215 and 09-41215 are soft-filled dolls with brown or white faces and red or brown hair. They are dressed in a multi-striped shirt and blue overalls with a button, buckle, snap, zipper and shoelace attached, so children can learn how to use the items.Soft Sisters #35350 are baby dolls, 12 inches tall, with soft bodies, plastic faces, curly hair and black or white skin color. One doll comes dressed in overalls with straps which are attached in front by two half-inch buttons.According to the company, about 8,000 dolls distributed for sale in 1987. The Lovee label appears only on the package and not on the dolls.Consumers having any of the dolls with buttons or buckles on the clothing should immediately remove the buttons and buckles or take the dolls away from young children and return the dolls to the store where purchased for a refund of the full purchase price.U. S. Customs Service identified the potentially hazardous dolls imported from Hong Kong at the Port of Newark, N.J. during Operation Toyland, a joint surveillance program with the U.S. Consumer Product Safety Commission",89018,https://www.cpsc.gov/Recalls/1989/Choking-Hazard-Leads-To-Recall-Of-2-Dolls
"Craft Dolls Recalled; Arms May Present Choking Hazard",7/20/1989 ,"July 20, 1989 Release # 89-070 Craft Dolls Recalled; Arms May Present Choking Hazard WASHINGTON, D.C. -- Twelve models of dolls called Cupie Dolls and sold as home craft products since June 1982, are being voluntarily recalled by Mangelsen's of Omaha, Nebraska. Tests conducted by the U.S. Consumer Product Safety Commission (CPSC) show that the dolls' arms may come off and present a choking hazard to young children.Sold under the label, Doll Craftin, the recalled models include: 411 Cupie Doll models 155-67, 156-07, 156-09; 5 3/411 Cupie Doll model 156-13; 4 1/211 Sitting Honey Doll model 156-63; 4 3/411 Jill Doll with Top Knot model 157-96; 5 1/211 Honey Bun Doll models 158-43, 158-45, 158-46; 5 1/211 Curly-One Doll models 158-69, 158-70; 4 1/211 Sitting Curly-One Doll models 158-71 through 158-76; Honey Dear Dolls models 158-77 through 158-82; and two unnamed dolls, models 156-61 and 157-97.Cupie Dolls are soft plastic unclothed baby dolls with rooted fake hair, yarn hair, or molded hair. The dolls were sold in clear plastic bags with cardboard headers labeled, Doll Craftin and Made in Hong Kong or ... Taiwan.Consumers who have the recalled Cupie Doll dolls being recalled should immediately take-them away from young children and return them to Mangelsen's, Inc., 5455 South 90th Street, Omaha, NE 68127 for a refund of the full purchase price and postage; or consumers may request the next largest size doll which has no hazardous small parts",89070,https://www.cpsc.gov/Recalls/1989/Craft-Dolls-Recalled-Arms-May-Present-Choking-Hazard
"Baby Doll Pacifier Recall by JA-RU",7/24/1989 ,"Baby Doll Pacifier Recall by JA-RU NEWS from CPSC U.S. Consumer Product Safety Commission Office of Information and Public Affairs Washington, DC 20207 FOR IMMEDIATE RELEASE July 24, 1989 Release # 89-071 Replacement Program For Baby Doll Pacifier WASHINGTON, DC -- In cooperation with the U.S. Consumer Product Safety Commission (CPSC), JA-RU, INC., Jacksonville, Florida, has announced a replacement program for the baby doll pacifiers contained in its Model No. 1058 NEW BABY. The doll's pacifier violates CPSC's small parts regulation. JA-RU, Inc. is offering to replace the pacifier with a free baby milk bottle designed to eliminate the potential for accidental ingestion. Approximately 30,984 dolls were sold nationwide from January 2, 1987 to April 17, 1989 for $1.99. The doll, approximately 6 long, has a vinyl head (no hair) and vinyl arms and legs that attach to a soft body. The doll is dressed in a two piece pajama type outfit (pink or blue with white trim) with Velcro closures. The pacifier is hung on a string around the neck of the doll. Consumers are advised to discard the original doll pacifier immediately. Neither the Company nor CPSC has received any reports of ingestion or injury associated with the doll's pacifier. Consumers who desire a free baby bottle replacement should contact JA-RU, INC. at (904) 733-9311 or write to: JA-RU INC. 4030 Phillips Highway Jacksonville, Florida 32207",89071,https://www.cpsc.gov/Recalls/1989/Replacement-Program-For-Baby-Doll-Pacifier
"Hasbro, Inc. Recalls Love A Bye Baby",4/3/1990 ,"CONTACT: April 3, 1990 (301) 504-7908 Release # 90-066 Hasbro, Inc. Recalls Love A Bye Baby Washington, DC -- In cooperation with the U.S. Consumer Product Safety Commission (CPSC), Hasbro, Inc. is voluntarily recalling its Love-A-Bye Baby doll line because the CPSC has determined that the doll's arms, baby bottle and comb are small parts that could present a serious choking hazard to young children under three years of age. The dolls are 3-1/2 inches tall and come in black or white with curly or straight hair, with and without hair ribbons. The sets include a Love-A-Bye Baby doll, a 1-1/2 inch baby bottle, and a two-inch comb and sold for between $2.00 and $5.00 each. Other Love-A-Bye doll accessories are sold separately but are not being recalled. Approximately 3,749,000 were distributed nationwide from December 1987 to March 1989. Consumers should take the doll, baby bottle, and comb away from young children immediately and return them to the store where purchased for a refund. Consumers may also return them to Hasbro, Inc., 450 Division Street, Pawtucket, RI 02861 for a refund. For further information about this recall, consumers may call 1-800-242-7276. While neither the CPSC nor Hasbro, Inc. are aware of any injuries or complaints involving the Love-A-Bye Baby doll, this recall is being under taken to prevent that possibility",90066,https://www.cpsc.gov/Recalls/1990/Hasbro-Inc-Recalls-Love-A-Bye-Baby
"Doll Clothing Sets Recalled by Manhattan Group Due to Violation of Lead Paint Standard",12/3/2008 ,"The recalled doll clothing set features a two-piece pajama set, eye mask and slippers. The pajama top is pink satin and the pants are dark brown with multiple-colored flowers printed on them.",09059,https://www.cpsc.gov/Recalls/2009/Doll-Clothing-Sets-Recalled-by-Manhattan-Group-Due-to-Violation-of-Lead-Paint-Standard
"Direct Connection, Inc. Recalls Musical Dolls Due To Choking Hazard",3/28/1991 ,"March 28, 1991 Release # 91-051 Direct Connection, Inc. Recalls Musical Dolls Due To Choking Hazard WASHINGTON, DC -- In cooperation with the U.S. Consumer Product Safety Commission (CPSC), Direct Connection, Inc., City of Industry, CA is voluntarily recalling approximately 500 Musical Dolls model numbers DC-541, DC-542, DC-543, DC-544, DC-545, DC-546, DC-547, DC-548, DC-549, DC-550, DC-551 and DC-552. When CPSC tested the dolls in accordance with regulations under the Federal Hazardous Substances Act, the plastic button eyes separated from the dolls' heads. These eyes are small parts that pose a potential choking hazard for young children. The cloth wind-up musical dolls stand 12 inches tall; are clothed in an array of colorful print dresses; have bendable arms and legs (the legs may be adjusted for the doll to sit); colorful yarn hair with bow to match dresses, and panties, socks, and booties; and have a rotating head movement when the wind-up key to the music box is activated to play It's a Small World. The label located underneath the dress reads in part Direct Connections, Inc., S. El Monte, CA, Made in Philippines. Only dolls with the plastic button eyes are subject to recall. Dolls of the same style and model numbers, but with printed eyes are not being recalled. The dolls, imported by Direct Connection, Inc., were sold nationwide through retail stores and gift shops from April 1990 to August 1990 for $25.00 each. Consumers are urged to take the toy away from young children immediately and return it to the store where purchased for a refund or they may mail the product to Direct Connection, Inc., 15364 E. Valley Blvd., City of Industry, CA 91746, for a full refund of the purchase price and shipping costs. For more information about this recall, consumers in California may call Direct Connection at 1-818-855-2888. A toll free number, 1-800- 582-6565, is provided for consumers outside of California. Neither Direct Connection nor the CPSC is aware of any injuries involving this product. This voluntary recall is being conducted to prevent the possibility of injury. The potentially hazardous toys were identified by CPSC during an inspection of Direct Connection, Inc. The CPSC's mission is to protect the public from unreasonable risks of injury and death associated with consumer products. The CPSC is the Federal agency responsible for consumer product safety. Some 15,000 different types of consumer products fall within the Commission's jurisdiction and each year these products are involved in an estimated 30 million injuries and 22,000 deaths",91051,https://www.cpsc.gov/Recalls/1991/Direct-Connection-Inc-Recalls-Musical-Dolls-Due-To-Choking-Hazard
"Lan Enterprises Recalls Doll Strollers After Child's Finger Tip was Severed; Product Also Poses an Entrapment Hazard to Young Children",9/28/2007 ,"The Mini Zooper Doll Stroller has a silver metal frame with a bright pink cotton canvas seat cover. Pottery Barn Kids is printed on a label on the canvas seat cover.",07317,https://www.cpsc.gov/Recalls/2007/Lan-Enterprises-Recalls-Doll-Strollers-After-Childs-Finger-Tip-was-Severed-Product-Also-Poses-an-Entrapment-Hazard-to-Young-Children
"OKK Trading Recalls Baby Dolls Due to Choking Hazard",4/4/2007 ,"This recall involves the Lovely Baby and Happy Baby plastic dolls. The dolls come in different sizes ranging from six to 11 inches tall. Some dolls come in a basket and have a baby bottle and some sing when pressed on the abdominal area. The packaging is a clear plastic bag sealed at the top with a cardboard label with the name Lovely Baby or Happy Baby printed on it.",07146,https://www.cpsc.gov/Recalls/2007/OKK-Trading-Recalls-Baby-Dolls-Due-to-Choking-Hazard
"Craft Dolls Recalled By Wang's International",8/2/1988 ,"Craft Dolls Recalled By Wang's International NEWS from CPSC U.S. Consumer Product Safety Commission Office of Information and Public Affairs Washington, DC 20207 FOR IMMEDIATE RELEASE August 2, 1988 Release # 88-60 Wang's International Recalls Craft Dolls WASHINGTON, DC - In cooperation with the U.S. Consumer Product Safety Commission, Wang's International, Inc., Memphis, Tennessee is voluntarily recalling two styles of its craft dolls. These dolls have arms which may be pulled off and present a choking hazard to young children. Neither CPSC nor Wang's International know of any injuries involving these craft dolls. Wang's International packaged these unclothed soft plastic dolls in clear plastic bags with labels. One doll is a 4 1/2-inch Cupid doll #PDT 3538. The other is a 5 1/2-inch doll #PDT631D, which has red hair, freckles and red painted-on shoes. The identification numbers only appear on the package labels and not on the dolls themselves. These craft dolls were sold through craft stores nationwide, retailing for approximately $1.00 each. Consumers who purchased these dolls should take them away from young children and return the dolls to the place of purchase for a full refund of the purchase price. If you have any questions, call Wang's International, Inc. toll-free at 1-800-824-0467.",88060,https://www.cpsc.gov/Recalls/1988/Wangs-International-Recalls-Craft-Dolls
"Rainbow Kids Dolls Recalled By Importer",8/4/1988 ,"August 4, 1988 Release # 88-062 Rainbow Kids Dolls Recalled By Importer WASHINGTON, DC - Oriental Trading Company of Omaha, Neb., is voluntarily recalling its Sweetheart Rainbow Kids dolls because the arms and shoes can come off and present a choking hazard to young children. Neither the U.S. Consumer Product Safety Commission nor the Oriental Trading Company is aware of any reports of injuries involving the doll. The dolls, which are 5 1/2 inches tall, have rosy cheeks with freckles, striped caps, simple clothes and white plastic shoes. Made in Hong Kong is stamped on the doll's back. Some 45,000 dolls were sold nationwide between February 1986 and March 1988.Consumers should immediately take the dolls away from young children and return them to the place of purchase for a full refund. Anyone needing additional information may call Oriental Trading Company at 1-800-228-0475. Nebraska residents may call toll-free at 1-800-245-5749",88062,https://www.cpsc.gov/Recalls/1988/Rainbow-Kids-Dolls-Recalled-By-Importer-
"Love Me Tender Dolls Recalled By Tonka Products",11/3/1998 ,"November 3, 1988 Release # 88-093 Love Me Tender Dolls Recalled By Tonka Products WASHINGTON-Tonka Products, Division of Tonka Corporation, is voluntarily recalling its Love Me Tender dolls because the plastic eyes may come off and could present a choking hazard to young children. Tonka instituted the recall in cooperation with the U.S. Consumer Product Safety Commission (CPSC). The company acknowledged having received 76 reports from consumers about model #8900 and #8901 dolls where the eyes had come off. While no injuries have been reported, the company said it is recalling the dolls to prevent any ingestion of small parts. More that 100,000 of these dolls were sold nationwide since July 1987 for $18-$30. Consumers are urged to take the dolls away from young children and return the dolls either to the place of purchase or to Tonka Products, Attention: Department K, 2950 Robertson Avenue, Cincinnati, OH 45209, for a full refund of the purchase price. To obtain a prepaid mailing label or for more information, consumers may call the company toll-free at 1-800-548-7262 between 9 a.m. and 5 p.m. Eastern Standard Time",88093,https://www.cpsc.gov/Recalls/1988/Love-Me-Tender-Dolls-Recalled-By-Tonka-Products
"Jak Pak, Inc. Recalls Rain Or Shine Dolls",12/24/1991 ,"DECEMBER 24, 1991 Release # 92-038 Jak Pak, Inc. Recalls Rain Or Shine Dolls WASHINGTON, DC -- In cooperation with the U.S. Consumer Product Safety Commission (CPSC), Jak Pak, Inc., of Milwaukee, WI is voluntarily recalling 6,939 Rain or Shine Dolls, model JP #0137. When CPSC tested the dolls in accordance with regulations under the Federal Hazardous Substances Act, the doll's movable arms separated. The arms are small parts that pose a potential choking hazard for young children. The doll is plastic with brown rooted hair, painted facial features and stands 6-1/4 inches tall. It wears a removable plastic raincoat that fastens with velcro, removable shoes and socks, and underwear that is not removable. The doll's head, arms and legs move at the main body joints. The label on the cardboard header reads in part: Rain or Shine Doll . . . 1988 JAK PAK, INC. Milwaukee, WI 53201, Made in China . . . The Rain or Shine Doll imported by Jak Pak, Inc. was sold nationwide at all types of retail outlets from January 1990 through December 1991 for an estimated price of $2.00 to $3.00 each. Consumers are urged to take the doll away from young children immediately and return it to the store where purchased for a full refund of the purchase price. For more information about this recall, consumers may contact Jak Pak, Inc. at 1-800-526-0113. Neither the CPSC nor the company is aware of any injuries involving the dolls. This voluntary recall is being conducted to prevent the possibility of injury. The potentially hazardous dolls were identified at the Port of Milwaukee, WI, during a joint CPSC/U.S. Customs surveillance program. The CPSC is announcing this recall as part of its mission to protect the public from unreasonable risks of injury and death associated with consumer products. The Commission's objective is to reduce the estimated 28.5 million injuries and 21,600 deaths associated each year with the 15,000 different types of consumer products under CPSC's jurisdiction",92038,https://www.cpsc.gov/Recalls/1992/Jak-Pak-Inc-Recalls-Rain-Or-Shine-Dolls
