"XL Machine Ltd. Recalls Dollhouse Furniture Sets",8/20/2001 ,"XL Machine Ltd. Recalls Dollhouse Furniture Sets NEWS from CPSC U.S. Consumer Product Safety Commission Office of Information and Public Affairs Washington, DC 20207 FOR IMMEDIATE RELEASE August 20, 2001 Release # 01-219 XL Machine Ltd. Recall Hotline: (866) 746-8097 CPSC Consumer Hotline: (800) 638-2772 CPSC Media Contact: Nychelle Fleming, (301) 504-7063 CPSC, XL Machine Ltd. Announce Recall of Dollhouse Furniture Sets Sold at Target Stores WASHINGTON, D.C. - In cooperation with the U.S. Consumer Product Safety Commission (CPSC), XL Machine Ltd., of Eden Prairie, Minn., is voluntarily recalling about 10,000 sets of dollhouse bathroom furniture. The yellow paint on the furniture contains lead, which can present a risk of lead poisoning to young children. CPSC and XL Machine Ltd. have not received reports of any injuries relating to these dollhouse furniture sets. This recall is being conducted to prevent the possibility of injury. The Little Tree natural wood dollhouse bathroom furniture sets contain a tub, sink with mirror, toilet, shower, bench, towel rack and a wooden doll. The doll has hair made of yarn and bendable wire legs and arms. The fixtures on the bathroom furniture are painted yellow. The packaging for the set reads Little Tree, Distributed by Target Corporation, and MADE IN CHINA. Target stores nationwide sold these furniture sets from August 2000 through June 2001 for about $15. Consumers should immediately take these dollhouse furniture sets away from children, and return the sets to the Target store where purchased for a refund. For more information, call XL Machine Ltd. at (866) 746-8097 between 9 a.m. and 5 p.m. CT Monday through Friday, or visit Target's web site at www.target.com.",01219,https://www.cpsc.gov/Recalls/2001/CPSC-XL-Machine-Ltd-Announce-Recall-of-Dollhouse-Furniture-Sets-Sold-at-Target-Stores
"Doll Feeding Sets Recalled by Dollar Tree",7/12/2000 ,"Doll Feeding Sets Recalled by Dollar Tree NEWS from CPSC U.S. Consumer Product Safety Commission Office of Information and Public Affairs Washington, DC 20207 FOR IMMEDIATE RELEASE July 12, 2000 Release # 00-143 Dollar Tree Stores Recall Hotline: (800) 876-8077 CPSC Consumer Hotline: (800) 638-2772 CPSC Media Contact: Nychelle Fleming, (301) 504-7063 CPSC, Dollar Tree Stores Inc. Announce Recall of Doll Feeding Sets WASHINGTON, D.C. - In cooperation with the U.S. Consumer Product Safety Commission (CPSC), Dollar Tree Stores Inc., of Chesapeake, Va., is recalling about 700,000 doll feeding sets. The doll bib in the set has snaps that detach, presenting a choking hazard to young children. CPSC and Dollar Tree Stores Inc. are not aware of any injuries involving these bibs. This recall is being conducted to prevent the possibility of injuries. The recalled doll feeding set consists of a bib with pink and blue baby cupids, a plastic baby food jar with pink top and a label reading Love My Baby Baby Food, baby bottle, two-handle pink cup, and a small blue container. Writing on the packaging reads Love My Baby Doll Care Feeding Set. On the back right-hand corner of the package is SKU number 563239. The set was sold in a box labeled for children ages 4 years and over. Dollar Tree Stores nationwide sold the doll feeding sets during December 1999 for about $1.00. Consumers should take this recalled toy away from young children immediately and return it to any Dollar Tree Store for a refund. For additional information, call Dollar Tree Stores at (800) 876-8077 between 9 a.m. and 5 p.m. EDT Monday through Friday. The State of Connecticut, Department of Consumer Protection brought this matter to CPSC's attention.",00143,https://www.cpsc.gov/Recalls/2000/CPSC-Dollar-Tree-Stores-Inc-Announce-Recall-of-Doll-Feeding-Sets
"Child's Death Prompts Replacement Program of Magnetic Building Sets",3/31/2006 ,"All Magnetix magnetic building sets, including the X-treme Combo, Micro, and Extreme sets. The sets contain 20 to 200 plastic building pieces and 20 to 100 1/2-inch diameter steel balls. The building pieces are red, yellow, blue and green, and are shaped in 1 1/2-inch squares, 1-inch triangles and cylinder rods. Some plastic building pieces have Magnetix imprinted on them.",06127,https://www.cpsc.gov/Recalls/2006/Childs-Death-Prompts-Replacement-Program-of-Magnetic-Building-Sets
"LeapFrog Recalls to Repair Children's Activity Centers Due to Arm Entrapment Hazard",9/7/2006 ,"The Learn-Around Playground is a multi-colored, plastic musical activity center for young children ages 6 to 36 months. It includes a Slide and Sing alphabet panel and a ball drop on the left side, a Number Rock musical keyboard in the center, and a Flying Rhymes airplane, pop-up LittleLeap, and smart book on the right side. Leap Frog Baby is printed on the activity center. Item number 10200 is written underneath the activity table below Made in China.",06253,https://www.cpsc.gov/Recalls/2006/LeapFrog-Recalls-to-Repair-Childrens-Activity-Centers-Due-to-Arm-Entrapment-Hazard
"Children's Play Tables Recalled by Shelcore",7/21/2000 ,"Children's Play Tables Recalled by Shelcore NEWS from CPSC U.S. Consumer Product Safety Commission Office of Information and Public Affairs Washington, DC 20207 FOR IMMEDIATE RELEASE July 21, 2000 Release # 00-148 Shelcore Recall Hotline: (800) 777-0453 CPSC Consumer Hotline: (800) 638-2772 CPSC Media Contact:Kim Dulic, (301) 504-7058 CPSC, Shelcore Inc. Announce Recall Children's Play Tables to Replace Mallets WASHINGTON, D.C. - In cooperation with the U.S. Consumer Product Safety Commission (CPSC), Shelcore Inc., of Somerset, N.J., is voluntarily recalling about 124,000 Stand-Up 'N Play Tables to replace the xylophone mallets. The mallet that comes as part of this table set can be lodged into the throats of young children, posing a choking hazard. Shelcore received a report of the mallet being jammed into the throat of a 13-month old boy after he fell while teething on the ball end of the mallet. Lacerations in the throat resulted when an adult had to forcibly remove the mallet to prevent choking. The Stand-Up 'N Play Table measures 14 inches long, 14 inches wide and 13 inches high. The multi-colored play table includes a telephone, clicking dial, spinner, push-button squeaker, rolling ball, spinning gears, xylophone and mallet, three colorful shapes, and a shape sorter. The tray of the table is white, and the legs are red with yellow caps at the base. Writing on the box reads, Ages 9-36 Months, and Encourages Child to Pull-Up and Stand. Toy stores nationwide sold these play tables from March 1996 through March 1999 for between $18 and $20. Consumers should immediately throw the recalled mallets in the trash, and call Shelcore for a free replacement mallet. For more information, call Shelcore at (800) 777-0453 between 9 a.m. and 5 p.m. ET Monday through Friday, or write to Shelcore Inc., 347 Elizabeth Ave., Somerset, NJ 08873-1101. Consumers can also view a video clip about this recall (transcript). This is in streaming video format.",00148,https://www.cpsc.gov/Recalls/2000/CPSC-Shelcore-Inc-Announce-Recall-Childrens-Play-Tables-to-Replace-Mallets
"Inflatable Playrings for Babies Recalled by KinderkidsTM",8/29/2000 ,"Inflatable Playrings for Babies Recalled by Kinderkids TM NEWS from CPSC U.S. Consumer Product Safety Commission Office of Information and Public Affairs Washington, DC 20207 FOR IMMEDIATE RELEASE Originally issued August 29, 2000, Revised April 16, 2004 Release # 00-172 CPSC Consumer Hotline: (800) 638-2772 CPSC Media Contact: Nychelle Fleming, (301) 504-7063 Note: Firm is out of business and a refund is no longer available. Do not use these products. Please discard or destroy these products. CPSC, Kinderkids TM Announce Recall of Inflatable Playrings for Babies WASHINGTON, D.C. - In cooperation with the U.S. Consumer Product Safety Commission (CPSC), Kinderkids TM, of Lawrence, Kan., voluntarily recalled about 18,000 inflatable playrings. Babies sit inside the playring, which is used as an activity center and looks like a pool float. When a baby leans his face against the side of the playring, the soft surface covers the baby's nose and mouth, restricting airflow, and posing the risk of suffocation. CPSC has received one report of a 6-month old baby found gasping for air after falling asleep face down in the playring. The baby was removed from the playring without injury. CPSC is aware of infant suffocation deaths when their airflow is restricted from contact with soft surfaces. The recalled playring, which measures 40 inches in diameter, has a yellow, plastic, inflatable, inner tube with a multicolor cloth covering. The cloth covering features eight activities for babies, including a boat rattle, a mirror flower, a soft teether on a puppy's collar, a butterfly, and a squeak ball and fish. A tag on the bottom of the cloth covering reads Warning! and Recommended for children 6 to 18 months. The packaging reads, Discovery Playring, MADE IN CHINA and Not to be used in water. They are sold with plastic foot pumps for inflating the playrings. Walmart stores, and One Step Ahead, a mail-order company, sold the playrings from July 1998 though April 2000 for between $20 and $35. Consumers should stop using the playrings immediately and discard or destroy these products. The firm is out of business and cannot be contacted, and a refund is no longer available.",00172,https://www.cpsc.gov/Recalls/2000/CPSC-KinderkidsTM-Announce-Recall-of-Inflatable-Playrings-for-Babies
"Stroller Activity Bars Recalled by International Playthings Due to Choking Hazard",8/26/2008 ,"This recall involves the Taggies™ Strollin' Along stroller activity bars. The multicolored, fabric, and plastic activity bars feature a yellow giraffe, a purple hippo and a blue elephant attached to a 12 long elliptical base with straps that attach to a stroller. The Taggies™ and Earlyears® logos are located on woven and satin labels sewn into the seam on the lower left front of the activity bar.",08373,https://www.cpsc.gov/Recalls/2008/Stroller-Activity-Bars-Recalled-by-International-Playthings-Due-to-Choking-Hazard
"JA-RU Offers To Replace Parts Of Play To Learn Furniture Set",12/14/1989 ,"December 14, 1989 Release # 90-023 JA-RU Offers To Replace Parts Of Play To Learn Furniture Set WASHINGTON, D.C.--In cooperation with the U.S. Consumer Product Safety Commission (CPSC), JA-RU, Inc., Jacksonville, Florida has announced a replacement program for its Play to Learn furniture set Model No. 1411. Three components of the set violate CPSC's small parts regulation. The Play To Learn Furniture Set consists of two play figures and several furniture components made of plastic. JA-RU, Inc. is offering to replace the plastic lounge chair and two play figures because they are small parts which may present a choking hazard to young children. Neither the company nor CPSC has received any reports of ingestion or injury associated with these components. Approximately 144,000 Play To Learn Furniture Sets, Model No. 1411 were sold nationwide from January 1987 to the present for $1.59 each. Consumers should remove the original plastic lounge chair and the plastic boy and girl figures from their children immediately and request replacements by contacting JA-RU, Inc. at (904) 733-9311 or write: JA-RU INC., 4030 Phillips Highway, Jacksonville, Florida 32207",90023,https://www.cpsc.gov/Recalls/1990/JA-RU-Offers-To-Replace-Parts-Of-Play-To-Learn-Furniture-Set
"Evenflo Recalls Children's Activity Centers Due to Fall Hazard",2/17/2009 ,"The recall involves Evenflo ExerSaucer Triple Fun stationary activity centers made between October 2006 and December 2008. The model number is 6231711. Stage 3 position involves converting the product into an activity table. No other ExerSaucer models use end caps and, therefore, no other models are included in this recall.",09131,https://www.cpsc.gov/Recalls/2009/Evenflo-Recalls-Childrens-Activity-Centers-Due-to-Fall-Hazard
"Serious Intestinal Injury Prompts Kipp Brothers Recall of Mag Stix Magnetic Building Sets",7/5/2007 ,"The recalled Mag Stix sets contain 24 pieces including twelve 1-inch sticks, four 2.25-inch sticks, and eight metal balls. The sticks are yellow, green, blue and rust-colored. Item No. 40330 Made in China and UPC number 7 7704 40330 1 are printed on the packaging.",07231,https://www.cpsc.gov/Recalls/2007/Serious-Intestinal-Injury-Prompts-Kipp-Brothers-Recall-of-Mag-Stix-Magnetic-Building-Sets
"Additional Reports of Magnets Detaching from Polly Pocket Play Sets Prompts Expanded Recall by Mattel",8/14/2007 ,"The recalled Polly Pocket play sets contain plastic dolls and accessories that have small magnets. The magnets measure 1/8 inch in diameter and are embedded in the hands and feet of some dolls, and in the plastic clothing, hairpieces and other accessories to help the pieces attach to the doll or to the doll's house. The model number is printed on the bottom of the largest pieces on some of the play sets. Products manufactured after November 1, 2006 and are currently on store shelves are not included in this recall. Contact Mattel if you cannot find a model number on your product to determine if it is part of the recall.",07273,https://www.cpsc.gov/Recalls/2007/Additional-Reports-of-Magnets-Detaching-from-Polly-Pocket-Play-Sets-Prompts-Expanded-Recall-by-Mattel
"Magnetix Magnetic Building Set Recall Expanded Serious Injuries Continue to be Reported to CPSC",4/19/2007 ,"These magnetic building sets contain up to 250 plastic building pieces and 1/2-inch diameter steel balls. The building pieces include 1 1/2-inch squares, 1-inch triangles, cylinder rods, flexors, connectors, x-tenders, and curves and come in an assortment of colors such as metallic, primary, translucent, and glow in the dark. The recall includes all sets, except newer Magnetix sets sold since March 31, 2006, that are age-labeled 6+ and sets that contain the following caution label: CAUTION: Do not ingest or inhale magnets. Attraction of magnets in the body may cause serious injury and require immediate medical care.",07164,https://www.cpsc.gov/Recalls/2007/Magnetix-Magnetic-Building-Set-Recall-Expanded-Serious-Injuries-Continue-to-be-Reported-to-CPSC
"J.C. Penney Recalls Disney™ Winnie-the-Pooh Play Sets Due to Violation of Lead Paint Standard",10/11/2007 ,"The recalled play set consists of 23 pieces including: either a white or black baby doll and assorted Winnie-the-Pooh themed items such as a diaper bag, blanket, playpen, highchair, swing, stroller, and carrying bags.",08022,https://www.cpsc.gov/Recalls/2008/JC-Penney-Recalls-Disney-Winnie-the-Pooh-Play-Sets-Due-to-Violation-of-Lead-Paint-Standard
"CPSC, Little Tikes Co. Announce Toddle Tots Dinosaur Mountain Playset Recall",12/22/1995 ,"December 22, 1995 Release # 96-055 WASHINGTON, D.C. - In cooperation with the U.S. Consumer Product Safety Commission (CPSC), The Little Tikes Company of Hudson, Ohio, is recalling approximately 160,000 Toddle Tots Dinosaur Mountain playsets. Small plastic cups that hold palm trees may detach, posing a choking risk to young children.CPSC is aware of 12 incidents in which the cups detached. In eight cases, parents found the cups in a child's mouth. Parents found two of the children choking but were able to remove the piece. Aside from a cut finger, no other injuries have been reported.The beige plastic playsets, measuring 23 inches long, 17 inches wide and 16 inches high, resemble a rocky cave. Three palm trees, held in place by small plastic cups, surround the cave. A red footbridge extends out of the front of the cave, over a blue moat. The playset was packaged with a caveman, cavewoman, pink baby dinosaur, red Tyrannosaurus, blue Brontosaurus and an orange Stegosaurus. The cavepeople fit in the back of the blue dinosaur and in a log-shaped car, also included with the set.Toy stores and other retail stores sold the playsets nationwide between June 1994 and December 1995 for approximately $30 to $40.Consumers should not allow children to play with the playset and should call Little Tikes at (800) 321-0183 to exchange the product. The company will pay for shipping charges associated with the exchange. Consumers also may write to The Little Tikes Company at 2180 Barlow Road, Hudson, Ohio 44236",96055,https://www.cpsc.gov/Recalls/1996/CPSC-Little-Tikes-Co-Announce-Toddle-Tots-Dinosaur-Mountain-Playset-Recall-
"Wood Abacus Recalled by LTD Commodities LLC Due to Choking Hazard",9/22/2008 ,"The recalled wood abacus is a multi-sided activity center that has a chalkboard, movable block letters with pictures, sliding shapes, a fun maze with gears, and a blue and yellow clock on the side of the activity center with two pink moving hands. Product code E7A is printed on the packaging near the UPC bar code.",08608,https://www.cpsc.gov/Recalls/2008/Wood-Abacus-Recalled-by-LTD-Commodities-LLC-Due-to-Choking-Hazard
"VeggieTales Dave & the Giant Pickle Playset Recalled by Chariot Victor Publishing",3/8/1999 ,"VeggieTales Dave & the Giant Pickle Playset Recalled by Chariot Victor Publishing NEWS from CPSC U.S. Consumer Product Safety Commission Office of Information and Public Affairs Washington, DC 20207 FOR IMMEDIATE RELEASE Originally issued March 8, 1999, Revised July 10, 2001 Release # 99-074 CPSC Consumer Hotline: (800) 638-2772 CPSC Media Contact: Nychelle Fleming, (301) 504-7063 Note: Firm is out of business. Do not use these products. Please discard or destroy these products. CPSC, Chariot Victor Publishing Announce Recall of VeggieTales' Dave and the Giant Pickle Playset WASHINGTON, D.C. - In cooperation with the U.S. Consumer Product Safety Commission (CPSC), Chariot Victor Publishing, of Colorado Springs, Colo., is recalling about 44,000 VeggieTales' Dave and the Giant Pickle playsets. Six of the character figurines have plastic plugs in their base that can come out, presenting a small parts choking hazard for young children. The French Peas figurine also poses a choking hazard because of its size and shape. CPSC and Chariot Victor Publishing are aware of one report of a 2-year-old child found with a plug from the playset in his mouth. No injuries have been reported. VeggieTales' Dave and the Giant Pickle playsets contain 10 figurines based on the Dave and The Giant Pickle! video. They include asparagus, peas, a grape, gourds and a pickle. The set also includes two sheep and tents. The figurines were sold in a mostly blue box showing scenes from the animated video. The product number SPCN 9834501358 is under the UPC code on the back of the box. Major Christian bookstores and catalog companies sold these playsets nationwide from September 1998 through February 1999 for about $20. Consumers should immediately take the figurines with plugs in their base and the French Peas figurine away from children. The firm is out of business. Consumers with these products should immediately discard or destroy them.",99074,https://www.cpsc.gov/Recalls/1999/CPSC-Chariot-Victor-Publishing-Announce-Recall-of-VeggieTales-Dave-and-the-Giant-Pickle-Playset
"Nature Science Kit Recalled by Price Stern Sloan",11/26/1996 ,"Nature Science Kit Recalled by Price Stern Sloan NEWS from CPSC U.S. Consumer Product Safety Commission Office of Information and Public Affairs Washington, DC 20207 Note: Firm is out of business. Do not use these products. Please discard or destroy these products. FOR IMMEDIATE RELEASE CONTACT: Nychelle White Originally issued November 26, 1996; Revised July 10, 2001 (301) 504-7063 Release # 97-030 CPSC, Price Stern Sloan Announce Exploring Nature Science Activity Kit Recall WASHINGTON, D.C. - In cooperation with the U.S. Consumer Product Safety Commission (CPSC), Price Stern Sloan Inc. of Los Angeles is voluntarily recalling more than 34,000 Exploring Nature Funstation science activity book kits. The kit is packaged with a compass that may leak fluid containing kerosene. The compass can be hazardous to young children if they ingest the kerosene or inhale it into their lungs. Price Stern Sloan Inc. has received one report of a 16-month-old child who vomited after ingesting fluid from the compass. The kit is intended for children 8 and older. The Exploring Nature Funstation (ISBN # 08431-3942-0) contains a book with a number of science projects and items to perform the science projects including a compass, magnifying glass, petri dish, crayons, a tweezers, test tube, a thermometer, and stickers. Warehouse clubs, bookstores, chain stores, and whole salers sold the kits nationwide from March 1996 through August 1996 for about $13 to $22. Consumers should take these recalled kits away from children immediately. The firm is out of business. Please discard or destroy these products.",97030,https://www.cpsc.gov/Recalls/1997/CPSC-Price-Stern-Sloan-Announce-Exploring-Nature-Science-Activity-Kit-Recall
