"Creative Products, Inc. Recalls Lovely Sonny Doll Due To Choking Hazard",8/18/1992 ,"August 18, 1992 Release # 92-128 Creative Products, Inc. Recalls Lovely Sonny Doll Due To Choking Hazard PRODUCT: Lovely Sonny dolls, model number 1079, imported by Creative Products, Inc. PROBLEM: The doll's arms separated from the arm sockets and a small piece of plastic from inside the doll fell out of the socket presenting a potential choking hazard for young children. WHAT TO DO: Return to place of purchase for a refund. For more information about this recall, consumers may contact Creative Products, Inc. at (708)673-1900. WASHINGTON, DC -- In cooperation with the U.S. Consumer Product Safety Commission (CPSC), Creative Products, Inc., of Skokie, IL, is voluntarily recalling 4,334 Lovely Sonny dolls, model number 1079. When CPSC tested the dolls, the arms separated from the arm sockets and a small plastic piece from inside the doll fell out of the socket presenting a potential choking hazard for young children. The vinyl Lovely Sonny doll is 6-1/2 inches tall with a painted face, blond hair, and moveable arms and legs. It is dressed in a non- removeable one piece dress and was sold in a 7-1/4 inch woven basket with one handle on each side. When purchased, the doll was packaged in a cellophane wrapping with a cardboarder header. The label on the header reads in part: Lovely Sonny * * * MADE IN CHINA. The Lovely Sonny doll, imported by Creative Products, Inc., was sold at three stores: The Bazaar, Inc., Cicero, IL; One Dollar Shops, Inc., Branson, MO; and N.B. Wholesale, Houston, TX. The doll sold for $1.00 each from early December through December 31, 1991. Consumers are urged to take the dolls away from young children immediately and return them to the store where purchased for a full refund. For more information about this recall, consumers may contact Creative Products, Inc. at (708)673-1900. Neither CPSC nor the company is aware of any injuries involving this product. This voluntary recall is being conducted to prevent the possibility of injury. The potentially hazardous toy was identified at the Port of Chicago, IL, during a joint CPSC/U.S. Customs surveillance program. CPSC is announcing this recall as part of its mission to protect the public from unreasonable risks of injury and death associated with consumer products. The Commission's objective is to reduce the estimated 28.5 million injuries and 21,600 deaths associated each year with the 15,000 different types of consumer products under CPSC's jurisdiction",92128,https://www.cpsc.gov/Recalls/1992/Creative-Products-Inc-Recalls-Lovely-Sonny-Doll-Due-To-Choking-Hazard
"Miniature Rocking Chairs Recalled by Effanbee Doll Company",1/29/1998 ,"Miniature Rocking Chairs Recalled by Effanbee Doll Company NEWS from CPSC U.S. Consumer Product Safety Commission Office of Information and Public Affairs Washington, DC 20207 FOR IMMEDIATE RELEASE January 29, 1998 Release # 98-060 Company Phone Number: (800) 226-3647 CPSC Consumer Hotline: (800) 638-2772 CPSC Media Contact: Nychelle Fleming, (301) 504-7063 CPSC, Effanbee Doll Company Announce Recall of Miniature Rocking Chairs WASHINGTON, D.C. - In cooperation with the U.S. Consumer Product Safety Commission (CPSC), the Effanbee Doll Company of East Brunswick, N.J., is recalling about 2,500 miniature rocking chairs. The chair has excessive levels of lead in the paint, presenting a potential lead poisoning hazard to young children. CPSC and Effanbee are not aware of any illnesses or injuries involving this product. This recall is being conducted to prevent the possibility of illness or injury. The rocking chair is wooden and each side of the chair is shaped into a cat's profile. The chair is painted white and the cat profiles are painted white with yellow outlines. The cat wears a green collar decorated with yellow and red dots. The cat also has brown flecks around its paws and tail. The cat has a red mouth, black nose, and black and gray eyes and ears. The chair measures about 1.75 inches wide and 4 inches long at its base. The rocking chair is part of the Wee Patsy Travel Set, which includes a miniature suitcase, two dolls, a paper doll book, doll clothing, a miniature train, a clown clothes tree, a miniature jack-in-the box, a plastic cat and the miniature rocking chair. Only the rocking chair is being recalled. Doll, gift, collectible and specialty toy stores nationwide, J.C. Penney catalogs and the Effanbee Collector's Society sold the Wee Patsy Travel Set from June 1996 through December 1996 for about $115. Consumers should take the miniature rocking chair away from children immediately. Effanbee is offering consumers a $5 refund, including postage, for the return of the miniature rocking chair. For information on how to return the miniature rocking chair and obtain a refund, consumers should call Effanbee at (800) 226-3647 between 9 a.m. and 5 p.m. EST Monday through Friday or write to the company at 19 Lexington Ave., East Brunswick, NJ 08816.",98060,https://www.cpsc.gov/Recalls/1998/CPSC-Effanbee-Doll-Company-Announce-Recall-of-Miniature-Rocking-Chairs
"Flying Dolls Recalled by Rite Aid",2/17/1998 ,"Flying Dolls Recalled by Rite Aid NEWS from CPSC U.S. Consumer Product Safety Commission Office of Information and Public Affairs Washington, DC 20207 FOR IMMEDIATE RELEASE February 17, 1998 Release # 98-067 Company Phone Number: (888) 468-4356, ext. 8302 CPSC Consumer Hotline: (800) 638-2772 CPSC Media Contact: Nychelle Fleming, (301) 504-7063 CPSC, Rite Aid Corp. Announce Recall of Two Flying Dolls WASHINGTON, D.C. - In cooperation with the U.S. Consumer Product Safety Commission (CPSC), Rite Aid Corp. of Camp Hill, Pa., is recalling about 12,000 Cyber Fighter and Flying Angel dolls. During use, the wings of these flying dolls can break off, and possibly cause serious eye injuries to consumers. CPSC and Rite Aid have received one report of a doll's wing breaking off during use,resulting in a laceration above the eye of a nearby child. The Cyber Fighter doll, measuring about 5 1/2 inches tall, is made of plastic, and has black pants, silver arms, a helmet with black goggles, gold boots and a yellow lightning bolt on a red vest. Its arms are strapped onto black wings with red tips, which are outstretched from the doll's body. The doll can be attached to a blue plastic launcher with gold trim by a stand under its feet. The words, CHAP MEI CHINA are printed on the launcher. The Flying Angel doll, measuring about 6 inches tall, is dressed in a blue and purple tutu with gold trim. The doll has pink stockings and a purple bow in its orange hair. Its outstretched arms are attached to pink wings with red tips. The launcher is pink with the words, Flying Angel written in the white trim. The handle that pulls the string is gold. Both dolls are packaged on colorful cardboad backers with their launcher and are covered with clear plastic. Agglo and MADE IN CHINA are printed on the bottom front of the packages. Rite Aid drug stores in the eastern U.S. sold the dolls from February 1997 through January 1998 for about $3. Consumers should stop using the dolls immediately and return them to any Rite Aid store for a refund. For more information about this recall, consumers should call Rite Aid Corp. toll-free at (888) 468-4356, ext. 8302 between 9 a.m. and 4 p.m. EST Monday through Friday.",98067,https://www.cpsc.gov/Recalls/1998/-CPSC-Rite-Aid-Corp-Announce-Recall-of-Two-Flying-Dolls
"Star Wonders Flying Dolls Recall by Placo",8/27/1997 ,"Star Wonders Flying Dolls Recall by Placo NEWS from CPSC U.S. Consumer Product Safety Commission Office of Information and Public Affairs Washington, DC 20207 Note: Phone number change. FOR IMMEDIATE RELEASE CONTACT: Nychelle White Originally issued August 27, 1997; Revised July 9, 2001 (301) 504-7063 Release # 97-176 CPSC, Placo Announce Recall of Star Wonders Flying Dolls WASHINGTON, D.C. - In cooperation with the U.S. Consumer Product Safety Commission (CPSC), Placo Products Company of Commerce, Calif., is recalling about 140,000 Star Wonders dolls. During use, the wings of the flying dolls can break off, causing serious eye injuries to consumers. CPSC and Placo Products Company have received seven reports of the dolls' wings breaking off during use, resulting in serious eyes injuries, including corneal abrasions, torn retinas and blindness. The Star Wonders dolls, measuring 6 inches tall, are made of plastic in black or white flesh tones. They have colorful wings attached to their arms. The dolls have blond and purple hair and wear white body suits with red, blue, gold or green skirts and boots. The dolls can be attached by their feet to a 7-inch magical wand launcher decorated with a moon or a heart. The Star Wonders dolls spin into the air when consumers pull a retractable string on the magical wand launcher. A plastic star with a smile face is on the end of the retractable string. The words, Made in China, on the bottom of the magical wand launcher are the only identifying words on the product. The dolls are packaged in a colorful cardboard box with a clear plastic front from which the doll is visible. The box is labeled in part, Star Wonders...flies in the sky...Includes Star Wonders doll and magical wand. Toy, drug and discount stores nationwide sold the dolls from January 1996 through August 1997 for about $6. Consumers should stop using the dolls immediately and return them to the store where purchased for a full refund. For more information about this recall, consumers should call Placo Products Company at (626) 288-8220 between 9 a.m. and 4 p.m. PDT Monday through Friday.",97176,https://www.cpsc.gov/Recalls/1997/CPSC-Placo-Announce-Recall-of-Star-Wonders-Flying-Dolls-
"McCrory Corporation Recalls Sweet Family Blessings Baby Doll",3/8/1993 ,"FEBRUARY 8, 1993 Release # 93-040 PRODUCT: Approximately 89,000 Sweet Family Blessings Baby dolls, item numbers 208363 and 208371, model number 6957. The dolls are three inches tall, with vinyl heads and bodies, blond rooted hair and painted eyes. Each doll was sold in a blister pack with a comb, a brush, and one of the following: a rocking horse, cradle, high chair, stroller, bathtub, or a bed. PROBLEM: The arms and legs on the dolls could detach and become a choking hazard to young children. WHAT TO DO: Consumers are urged to take the dolls away from young children immediately and return them to the stores where purchased for a full refund. For more information, call 1-800-284-3704. WASHINGTON, DC -- CPSC, McCrory Corporation of York, PA is voluntarily recalling approximately 89,000 Sweet Family Blessings Baby dolls, item numbers 208363 and 208371, model number 6957, because the arms and legs could detach and become a choking hazard to young children. The Sweet Family Blessings Baby comes in six different styles. Each style comes with a three-inch doll with a vinyl head and body with blond rooted hair and painted eyes. Each doll was sold in a blister pack with a comb, a brush and one of the following items: a rocking horse, cradle, high chair, stroller, bathtub, or a bed. These dolls were sold nationwide between July 1, 1989 and October 31, 1992, by Britts, Elmore, McCrory, H.L. Green, Kress, McClellan, T.G.andY., Silver, J.J. Newberry, and G.C. Murphy, along with some independent variety stores. Each doll set sold for approximately $2.00. The package is labeled in part: Sweet Family Blessings Baby and Cititoy, Made in China Expressly for YDC, York, PA and For Ages 2 and Up. Neither CPSC nor the company is aware of any injuries involving these dolls. This voluntary recall is being conducted to prevent the possibility of injury. The potentially hazardous dolls were identified by the Connecticut Department of Consumer Protection and reported to CPSC. Consumers are urged to take the dolls away from young children immediately and return them to the stores where purchased for a full refund. Consumers with questions about this recall may contact McCrory Corporation toll-free at 1-800-284-3704. The U.S. Consumer Product Safety Commission is announcing this recall as part of its mission to protect the public from unreasonable risks of injury and death associated with consumer products. The Commission's objective is to reduce the estimated 28.5 million injuries and 21,600 deaths associated each year with the 15,000 different types of consumer products under CPSC's jurisdiction",93040,https://www.cpsc.gov/Recalls/1993/McCrory-Corporation-Recalls-Sweet-Family-Blessings-Baby-Doll
"Fisher-Price Recalls Snuggle Light Doll",8/12/1993 ,"August 12, 1993 Release # 93-102 PRODUCT: Approximately 420,000 Fisher-Price Snuggle Light dolls, model numbers 1372 and 1373, sold nationwide since February 1992. The Snuggle Light is a doll with a nightcap and pom-pom whose face lights up when its body is squeezed. PROBLEM: Fisher-Price has learned from consumers that very young children, primarily children five to seven months old, can get the doll's nightcap pom-pom into their mouths and choke or gag on it. Fisher-Price learned of five instances of children choking or gagging on the nightcap's pom-pom. The company has received no reports of injuries as a result of this problem. WHAT TO DO: Parents should cut off the doll's pom-pom and product label and send them to: Fisher-Price, Consumer Affairs, 636 Girard Avenue, East Aurora, NY 14052. Fisher-Price will send a new doll body (includes everything but the light component) on which the cap is sewn to the doll's head and does not swing freely. For more information, call Fisher-Price at 1-800-233-4004. WASHINGTON, DC -- CPSC, Fisher-Price, Inc., East Aurora, NY is announcing a recall program for its Snuggle Light dolls, model numbers 1372 and 1373, after learning of five instances of children choking or gagging on the doll's nightcap pom-pom. The program affects approximately 420,000 Snuggle Lights sold nationwide since February 1992. The company has received no reports of injuries as a result of this problem. The Snuggle Light is a doll whose face lights up when its body is squeezed. Fisher-Price has learned from consumers that very young children, primarily infants five to seven months old, can get the doll's pom-pom into their mouths and choke or gag on it. To eliminate this potential choking hazard, Fisher-Price is asking parents to cut off the pom-pom and the product label and send them to Fisher-Price, Consumer Affairs, 636 Girard Avenue, East Aurora, NY 14052. Fisher-Price will send a new Snuggle Light doll body (includes everything but light component) to consumers free of charge. If consumers have questions about this program, they can call Fisher-Price toll free at 1-800-233-4004 between 8:00 a.m. and 5:00 p.m. Eastern Time. Fisher-Price is asking that the dolls not be returned to retailers, but that consumers contact Fisher-Price for a new Snuggle Light doll body. Fisher-Price recently started shipping modified Snuggle Light dolls on which the cap is sewn to the doll's head and does not swing freely. This modification eliminates the possibility of a potential choking hazard. If you have this version of the doll, you need not contact Fisher-Price",93102,https://www.cpsc.gov/Recalls/1993/Fisher-Price-Recalls-Snuggle-Light-Doll
"CPSC, Lakeshore Learning Materials Announce Recall of Doll Sets",6/22/2004 ,"The recall involves Toddler Doll Family sets sold with four figurines, a mom, dad, brother and sister. The 4-inch-tall dolls have a wooden head, arms and feet. The body is constructed of wire, which makes the doll adjustable. Each doll has yarn hair and is dressed in various colored outfits.",04558,https://www.cpsc.gov/Recalls/2004/CPSC-Lakeshore-Learning-Materials-Announce-Recall-of-Doll-Sets
"CPSC, Disney Store Announce Recall of Monsters, Inc. Character Plush Dolls",11/21/2002 ,"The recall includes only the 12-inch Sulley with Boo plush dolls. The Sulley doll is a blue monster with purple spots, a tail and horns. Sulley is holding a Boo doll in his right arm. Boo is a little girl with dark hair and small pink ball ponytail holders and rubber bands. Both are characters in the 2001 animated film, Monsters, Inc. Labels on the Sulley doll read, Disney Store, SULLEY W/BOO 12, and Made in China.",03035,https://www.cpsc.gov/Recalls/2003/CPSC-Disney-Store-Announce-Recall-of-Monsters-Inc-Character-Plush-Dolls-
