20170221-EE22A-2147406872,2/22/2017 ,3/2/2017 ,3/16/2017 ,Consumer,"Kiddieland Disney Pixar Cars Lightning McQueen Activity Ride-On Push RacerInfo from Walmart:Manufacturer Part Number:053736Model:053736Info from Jet.comRelive the magic of Cars 2 with the star himself, Lightning McQueen! It's the Disney Pixar My McQueen Activity Racer! This fantastic kids toy is perfect for little racers who want to *vroom* around the house. The steering wheel is filled with buttons that when pressed bring the car to life. McQueen revs while music plays, getting pumped for the race, signal lights flash, the accelerator roars to life, and the brakes squeal. Kids can propel themselves or can be pushed around by a parent with a handy pop-up handle. !- Kiddieland Disney Pixar Cars Lightning McQueen Activity Racer- Disney Pixar Cars 2 themed Lightning McQueen- Turn ignition key for revving engine sound.- Hear rewarding fun sounds and see blinking signal lights.- Press to hear accelerator, brakes, and see flashing traffic lights for long hours of great riding fun- Requires 2 x AA batteries- Age: 12-36 Months- Part : 043067Info from Amazon:ASIN	B000EX0GW0Item model number	035154","Toys & Children","Riding Toys","Wheeled Riding Toys, Unpowered (1398)",1398,"Kiddieland Toys Limited","Kiddieland Disney Pixar","035154",,,,,"Target","California",11/11/2015 ,Yes,"I bought this Kiddieland Disney Pixar Cars Lightning McQueen Activity Ride-On Push Racer when my son turned 1 year old. He is now 27 months old. Ever since then, he's had numerous falls hurting himself in the face, chin or limbs when sitting on the car facing backwards. The car loses its balance and tips backward when the kid sits on it facing backwards and propels to move the car backward. My son suffered minor injuries so I did not feel the need to report it. However, 2 days ago, my friend's son rode on it sitting backward. The car lost its balance and tipped backward. Even though the dad was staying next to this son, the 20 month old baby fell with the car hitting his face on the ground cutting his lower lip open and caused severe nose bleeding. The bleeding did not stop until 45min later when they got home. They were about to bring the toddler to the hospital if it didn't stop after an hour.","San Jose",,95136,"Home/Apartment/Condominium","Injury - First Aid Received by Non-Medical Professional","Male","My Friend / Neighbor / Co-worker","1",Yes,No,,,No,No,No,," All of us at Kiddieland regret that this child has suffered a mild injury while using our ride on toy.  We have endeavored to speak to the individual that reported the incident and have not yet been able to connect, but will continue trying, of course.  At the heart of the issue is the plain fact that the toy was misused, and more than once, with little or no apparent adult supervision or guidance.  No ride on toy is designed to be ridden backwards the way in which this one was - and more that once with the same unfortunate results each time, per the report.  This is the reason all manufacturers clearly state Adult Supervision Required on their packages, including Kiddieland.  This particular product has been successfully tested over and over again for normal and reasonable use, but that use does not include riding backwards or standing on it or anything of the sort.",
20161225-2D5D9-2147408930,12/25/2016 ,2/8/2017 ,3/2/2017 ,Consumer,"Dixieland Disney Princess Rock'n Ride, 4 in 1 activity ride on","Toys & Children","Riding Toys","Wheeled Riding Toys, Unpowered (1398)",1398,"Kiddieland Toys Limited","Kiddieland","Dixieland Disney Princess Rock'n Ride",,,,,,,,No,"Child slipped from the seat and became trapped between the rail and the seat. this is a dangerous strangulation hazard.","Miami","Florida",33176,"Home/Apartment/Condominium","Incident, No Injury","Female","Other Relative","-1",Yes,No,,,No,No,No,," Kiddieland regrets the experience suffered by this family and are pleased to learn that no injury has resulted.  The product in question is age graded from 12-36 months, but it is always up to the discretion of parents as to the exact appropriateness of use governing each child, as the age grade is a guideline only.  In this case the child appears to be just 9 months old so there is a bit of a disconnect, especially since an incident resulted.  We are again glad that the admonition about Adult Supervision Required was followed and that the child was liberated quickly and safely.  In point of fact, this item (and others like it) are routinely tested according to the most stringent USA and worldwide standards and always passes without exception.  Therefore, we feel there is no cause for further action at this time.",
20170106-2FC60-2147408450,1/6/2017 ,1/27/2017 ,2/17/2017 ,Consumer,"Hauck toy pedal go kart hurricane","Toys & Children","Riding Toys","Wheeled Riding Toys, Unpowered (1398)",1398,"Hauck Toys For Kids","Hauck toys pedal go kart - hurricane",,,,,,"Costco","South Carolina",11/23/2016 ,Yes,"Purchased a pedal go kart from hauck toys at Costco.   After short routine usage by a 6 year old child the steering completely separated from the attachment point.  This appears to be a defect in how the steering wheel is made causing the attachment point to separate.  Once separated the child no longer has the ability to control the kart, in addition the steering column end is exposed and could cause severe injury to a child should there chest hit the exposed end.  No injury occurred but the potential is there if this is a defect in there design or manufacturing. ","Boiling Springs","South Carolina",29316,"Home/Apartment/Condominium","Incident, No Injury","Male","My Child","6",Yes,No,,,No,Yes,,"No response","",
20200110-6EFED-2147375475,1/10/2020 ,1/30/2020 ,2/20/2020 ,Consumer,"Toy Story 4 ride on car from Costco.  Lots of Buzz Lightyear on it.","Toys & Children","Riding Toys","Wheeled Riding Toys, Unpowered (1398)",1398,"Kiddieland Toys Limited","Disney/Pixar",,,,,,"Costco",,6/12/2019 ,No,"We bought a Toy Story 4 ride on car thingy for our toddler at Costco.  2 times now that thing has flipped over and he has busted his lip.  The wheels are in the wrong spot so it can flip too easy.","San Mateo","California",94401,"Home/Apartment/Condominium","Injury - First Aid Received by Non-Medical Professional","Male","My Child","1",Yes,No,,,No,No,No,"I will tell Costco"," The incidence about the Disney Buzz Plane Ride On was well received.  First of all, we felt deeply sorry to hear what has happened to the child.1. We would like to reinstate that product safety is always a major consideration in designing our toys.  As a result, all our items including the Buzz Plane are designed with safety in mind.   This Buzz Plane Ride On is designed to have 4 wheels plus an additional wheel in the front to ensure stability.   2. In addition to this, it has also been tested internally and by accredited independent testing laboratories using the strictest standards possible worldwide.  Such tests are performed many times in the course of the year to ensure the highest consistency of quality and safety, with no exceptions and zero tolerance for defects of any kind. 3. Last but not least, we always recommend the child playing with the toys under parent / adult supervision to ensure safety.    This recommendation has been stated on our packaging.We hasten to add that just because the item pass all known test requirements does not mean that it can not be improved.  In fact, we are already re-evaluating the item for any possible improvement in future production run.   Test report is always available for review upon request.",
20210317-DD1D9-2147365314,3/17/2021 ,3/24/2021 ,4/7/2021 ,Consumer,"hauck pedal car","Toys & Children","Riding Toys","Wheeled Riding Toys, Unpowered (1398)",1398,"Hauck Toys For Kids","hauck","hurricane",,,,,,,,No,"steering wheel broke off while riding","somerset","New Jersey",08873,"Home/Apartment/Condominium","Incident, No Injury","Male","My Child","8",,,,,,,,,"",
20210917-F868E-2147360484,9/17/2021 ,10/4/2021 ,10/26/2021 ,Consumer,"Real Tree 12V UTV  Ride on","Toys & Children","Riding Toys","Powered Riding Toys (1330)",1330,"BRC TOYS LLC","Real Tree ",,,,,,,,,No,"my sons real tree 12v UTV ride on caught on fire","Stroud","Oklahoma",74079,"Home/Apartment/Condominium","Incident, No Injury","Male","Unspecified","5",Yes,No,,,,No,,,"",
20250310-047B5-2147332649,3/10/2025 ,3/13/2025 ,3/27/2025 ,Consumer,"24V Realtree XD UTV Battery-Operated Ride-on with Remote, Kids 3+ Years, up to 5 MPHCamo toddler four wheeler (attached is the product on walmart website.)","Toys & Children","Riding Toys","Powered Riding Toys (1330)",1330,"BRC TOYS LLC","RealTree XD Powered UTV",,,,,,"Walmart",,2/1/2025 ,No,"I am writing today due to an incident that happened with a recent purchase from Walmart - 24v Realtree XD UTV Battery Operated Ride On. We purchased this in Jan/February of 2025 for roughly $400. My children have since been riding it - last week I noticed my kids were hitting things at full speed and then crying and incredibly scared, clearly an accident. My children do not hit things with their ride on toys and never have up until this point - which we found to be very odd. My husband checked the entire toy over to ensure there was no possible corrosion or mud stuck under the pedal - which there was not. Fast forward to this past Sunday around 11am - we were all out enjoying our backyard and the spring weather. My kids were driving the four wheeler when all of the sudden it goes barreling down the hill and doesn't stop. It hits our trampoline at max speed and the tires continue rolling and the four wheeler does not stop, even after hitting the trampoline. My 4 year old son was driving it and was crushed and his throat and the trampoline medal were touching, keep in mind the four wheeler's tires were still spinning and it was still trying to go. It would NOT STOP! We got our son out of the four wheeler and it was still running, almost like the gas was being pressed, except there was nobody on it or near it. This could have resulted in my son breaking his neck or worse - getting decapitated. This is all due to a gas pedal that is FAULTY. This could have KILLED MY INNOCENT TODDLER. This was supposed to be a safe toddler toy. Instead it could have killed him!As you can see in the attached images, the roll cage bar that is there for PROTECTION couldn't even protect him in an event like this as it broke into literal pieces! The four wheeler kept accelerating and wouldn't stop after it hit the trampoline and continued breaking pieces off it.This toy is going straight to the DUMP! As should all of the other ones located on store shelves. This is absolutely absurd! This should not have happened to a child. It should have been looked over a million times for safety before being sold for consumer purchase. AND, should come with some sort of braking system!To include, the age range specifically states 3-8 years old - this is untrue! This toy should NOT be utilized until AT LEAST 5 or 6 years old due to how fast it goes - although it says it only goes 5 MPH, I highly doubt.","wichita falls","Texas",76306,"Home/Apartment/Condominium","Incident, No Injury","Male","My Child","3",Yes,No,,,,Yes,,,"BRC TOYS LLC: We are committed to designing and manufacturing products that are safe and fun to ride. Our team has reached out to the consumer to better understand the consumer's concern and how product was kept and used.    We appreciate the consumer bringing her concerns to our attention and look forward to reviewing the product.",
20250326-7E700-2147332309,3/26/2025 ,3/28/2025 ,4/11/2025 ,Consumer,"Kiddieland: Spidey Team Activity, Ride-On Is blue and red in color about 20 in length and 10 in width","Toys & Children","Riding Toys","Wheeled Riding Toys, Unpowered (1398)",1398,"Kiddieland Toys Limited","Kiddieland: Spidey Team Activity, Ride-On","B08XPVL89F",,,,,,,,No,"Three year old daughter was riding the Kiddieland: Spidey Team Activity, Ride-On and the car tipped over forward cause her to face off landing face down with injury to her bottom lip","Cerritos","California",90703,"Unspecified","Injury - First Aid Received by Non-Medical Professional","Female","My Child","3",,,,,,,,,"",
20130429-D6A05-1324418,4/29/2013 ,6/13/2013 ,6/27/2013 ,Consumer,"plastic ride on toy green motorcycle","Toys & Children","Riding Toys","Riding Toys, Not Specified (5005)",5005,"WESCO NA Inc","Wesco ","F-79140CERIZAV",,,,,,,,No,"(04/23/2013) The consumer stated that her child was at the daycare.The consumer stated that she was told that her child was riding the toy and the toy tipped over. Her child tipped over the toy and fell on concrete on her right shoulder and broke her collar bone. The child was taken to Goodnight Pediatrics in Peoria, AZ. They xrayed her shoulder and found out that the child's collarbone was broken. She was referred to the ER at Banner Thunderbird Medical Center in Glendale, AZ. They put the child's arm in a sling.  She was also given pain medicine. The consumer stated that she had a follower- up 4/29 at Banner Children Specialist. The specialist looked at the shoulder and said that it was healing just fine. ",,,,"School","Injury - Emergency Department Treatment Received","Female","My Child","2",,,,,,,,,"",
20150629-C6166-2147430704,6/29/2015 ,7/8/2015 ,7/29/2015 ,Consumer,"Smart Trike Boutique 4-in-1 Red Tricycle The smarTrike® Boutique 4-in-1 tricycle is a premium baby tricycle with endless features and accessories.It grows with your child from 10 months to 3 years old, starting as a parent control trike that is easy to steer - just like a stroller, turning later on to a guided trike, still controlled by the parent, but with no back support. As your child begins to train the pedaling movement, the tricycle becomes a training trike, helping you to prepare your child to independent riding. Finally it transforms to a classic trike, as your child rides on his own.The Boutique tricycle has rubber wheels and shock absorber for smooth and quiet rides. With the bottle holder, toy phone and the huge storage bag, you can be sure that you are fully equipped for your journey. 	Features    Telescopic Touch Steering parent handle - for easy maneuvering. Red navigator button - for easy transition from parent control to child control of the trike.    Extendable UV protective sun canopy. Shock absorber and rubber wheels.    Parent bag and huge stylish storage bag. Padded seat with high back support.    Toy phone and bottle holder.Additional Info“R”Web#:963033SKU:A881DA2CUPC/EAN/ISBN:4897025794146Manufacturer #:1595202Product Weight:18.3 poundsProduct Dimensions (in inches):25.3 x 14.4 x 11.0","Toys & Children","Riding Toys","Tricycles (1301)",1301,"SMART-TRIKE USA LLC","SmartTrike","Smart Trike Boutique 4-in-1 Red Tricycle",,"4897025794146",,,"Toys R Us",,3/11/2015 ,No,"My 15 month old daughter was in her Smart Trike when she leaned over the side to touch the wheel. The whole tricycle tipped over with her in it onto the ground. ","Bloomsburg","Pennsylvania",17815,"Home/Apartment/Condominium","Incident, No Injury","Female","My Child","1",Yes,No,,,No,No,Yes,"I will contact them. I have contacted Toys R Us. ","",
20170510-EA8BE-2147403605,5/10/2017 ,7/17/2017 ,7/31/2017 ,Consumer,"Peanuts Flying Ace Ride-On Toys.  Wing and Wheel are both broken off of item.","Toys & Children","Riding Toys","Wheeled Riding Toys, Unpowered (1398)",1398,"LAROSE INDUSTRIES LLC",,"BCHTAR614A13-0515",,,,,"Fast Track IT","Ohio",5/6/2017 ,No,"Im not sure if this is where I report this, but I just bought Peanuts Flying Ace Ride-On Toy from Fast Track IT in Columbus, OH.  When I won the item from auction online, I knew it was missing a wheel and a wing on the toy and was going to get it fixed for my son to play with it.  While I was searching for replacement parts, I saw on https://www.cpsc.gov/Recalls/2015/larose-industries-recalls-peanuts-flying-ace-ride-on-toys that the toy was recalled back in 2015 and I could do nothing with the toy except destroy it.  I brought this to the auction houses attention and they did not want to take the item back, and I am worried they are selling more items that have been recalled.  If the item wasnt in as bad of shape, I would have not thought about it and not known that it was recalled and my son could have been injured (he is 2 yrs of age at this time, so alot of items still go in his mouth.)  He could have also been hurt by the item itself by the wing being broken off or the wheel missing.  I am highly upset.  I was hoping something could be done about the lack of effort on their end, so I started looking to see if it were even legal for them to sell this item to me.  Under USC 15, chapter 47, section 2068, it talks about it being illegal for anyone to offer recalled items to anyone else.  Going on in 2069, the law states that a fine of up to $100,000 could be assessed per item up to $15million, per day (if I read this correctly.)  I know they sold this item to me, I can provide any receipts or pictures as you desire, and can only think of how many more items they sell that fall into this category. This is only one of many locations this business has and Im sure there are many other illegal items being sold. Its very upsetting and I would like something to be done about it.  Please advise if there is anything else that you would like for me to do to assist.  Thanks","Columbus","Ohio",43207,"Other","Incident, No Injury","","Unspecified","",Yes,Yes,,No,No,Yes,,"I still have item.  Have contacted Fast Track to take back to no avail. Product was missing wheel and wing before purchase.","",
20230528-B9CBF-2147347327,5/28/2023 ,5/31/2023 ,6/14/2023 ,Consumer,"PONYEEHAW Ride on Horse Toys, Kids Riding Horse Toys Ride on Toys for 3-5 Years Old, Premium Plush Animals Toys Walking Horse with Wheels (Brown, 29.92 L x 9.84 W x 31.12 H)","Toys & Children","Riding Toys","Wheeled Riding Toys, Unpowered (1398)",1398,"PONYEEHAW","PONYEEHAW","B09Z1YJTMN","B09Z1YJTMN","B09Z1YJTMN",,,"Amazon",,12/2/2022 ,Yes,"This was a gift for my kids for Christmas from their Nana. At first we thought it was great, it’s soft and seemed safe. I’ll preface this with the fact that my kids never really rode it much. They like to pretend it’s a real horse and feed it, brush it etc. this morning my son (5 years, 42 lbs) sat on it and rocked for a little bit. The front spring broke through the plastic holding it on and the entire horse collapsed to the ground. His arm was bruised from the impact of the front post, and his leg was cut. Upon further clean up/inspection we realized he had a metal shard in his leg. When my husband barely moved the horse to try and figure out what happened the back spring then came disconnected and the whole thing fell down. This could’ve been my 3 year old, it could’ve been one of their eyes, or even knocked their front teeth out. This toy is highly concerning. My kids use it in my living room where they are constantly watched and I can’t imagine what would happen to a child in a playroom. This is headed straight to the dump and I’ll be sending the info in to get this toy recalled.","Shingle Springs","California",95682,"Home/Apartment/Condominium","Injury - First Aid Received by Non-Medical Professional","Male","My Child","5",Yes,No,,,,No,,,"",
20120902-7F246-2147464129,9/2/2012 ,9/11/2012 ,10/3/2012 ,Consumer,"Riding Horse on Wheels, Looks like a horse has push buttons on the ears that make different noises.  According to the tag on the product it shows to be made with a (STEEL) frame and shows to have passed inspections.","Toys & Children","Riding Toys","Wheeled Riding Toys, Unpowered (1398)",1398,"Giggles International Ltd","Nothing listed on toy",,,"none",7/11/2011 ,"Batch # P108105","Cracker Barrell","Arkansas",12/12/2011 ,No,"My 5 year old neice was ridding on the horse on wheels, when suddenly the front leg of the horse snapped and sent her crashing down on the hard floor, and she hit her head.  This has a tag on it that says its reccomded for children 3 and up. Also there is not a weight limit listed on the toy.   According to the tag the toy has a (STEEL) frame.   My neice weights around 60lbs at most.","Russellville","Arkansas",72801,"Home/Apartment/Condominium","Incident, No Injury","Female","Other Relative","5",Yes,No,,,No,,,,"",
20190430-752AA-2147381300,4/30/2019 ,10/3/2019 ,10/25/2019 ,Consumer,"Best Choice Products 3-in-1 Kids Indoor Outdoor Push and Pedal Car Toddler Ride-On Wagon Play Toy Stroller w/ Handle, Horn, Music - Red","Toys & Children","Riding Toys","Wheeled Riding Toys, Unpowered (1398)",1398,"BEST CHOICE PRODUCTS","Best Choice Products",,,,,,"Walmart.com",,4/7/2019 ,No,"Best Choice Products 3-in-1 Kids Indoor Outdoor Push and Pedal Car Toddler Ride-On Wagon Play Toy Stroller w/ Handle, Horn, Music - Red Purchased from Walmart.  This item has NO seat belt and child slipped out the side of the car.  Fortunately not hurt but was scared.  Any item like this should be required to have a seat belt and/or safety harness.  This is not a safe toy.  ","Mount Airy","Maryland",21771,"Home/Apartment/Condominium","Incident, No Injury","Unknown","Unspecified","",Yes,No,,,No,Yes,,"Walmart refunded full amount.  Efforts to convince the Best Choice that the ride needs a seatbelt or harness have been unsuccessful.  They wanted to give me a $5 credit to add a seatbelt - ridiculous.  This item NEEDS a seatbelt!","",
20120915-0C715-2147463718,9/15/2012 ,9/24/2012 ,10/9/2012 ,Consumer,"Laugh & Learn™ Stride-to-Ride™ Puppy by Fisher Pricehttp://www.fisher-price.com/en_US/brands/babytoys/products/67427","Toys & Children","Riding Toys","Wheeled Riding Toys, Unpowered (1398)",1398,"FISHER-PRICE BRANDS","Fisher-Price","Laugh & Learn™ Stride-to-Ride™ Puppy W9740",,,,,"Target",,8/7/2012 ,Yes,"My 15 month old child was riding on the toy in the following website.http://www.fisher-price.com/en_US/brands/babytoys/products/67427The head of the dog moves side to side as the toy moves forward, and there are several screw holes on the back of the head. My child stuck her finger into one of the holes, and the head moved to pinch her finger. And her finger got suck between the dog's head and the neck.","Seattle","Washington",98122,"Home/Apartment/Condominium","Injury - No First Aid or Medical Attention Received","Female","My Child","1",Yes,No,,,No,No,Yes,,"",
20180813-0BAB7-2147386196,8/13/2018 ,8/21/2018 ,9/5/2018 ,Local Government Agency,"Best Choice Products12V MP3 Kids Ride On Truck Care R/c Remote ControlLED Lights, AUX and MusicSKY2069 https://bestchoiceproducts.com/products/12v-mp3-kids-ride-on-truck-car-r-c-remote-control-led-lights-aux-and-music","Toys & Children","Riding Toys","Powered Riding Toys (1330)",1330,"BEST CHOICE PRODUCTS","Best Choice Products 12V MP3 Kids Ride On Truck Care R/c Rem",,,,,,,,,No,"Incident Specifics:Organization:[REDACTED][REDACTED][REDACTED][REDACTED]Incident: Number: [REDACTED]Date & Time: 08/13/2018 1:51A neighbor called to report a garage fire at the noted address. Complainant stated they were returning home and noted the fire in the open garage and called 911 and subsequently woke the residents. After extinguishing the fire, crews noted a large melted puddle of plastic with what appeared to be a battery and electrical wires in the center of the garage floor. There was little else involved in the fire. A security system picture revealed the location had been occupied by a battery operated riding child's toy. The resident supplied a picture of his child with the product and also a matching add from a Wal-Mart website. The toy appears to be: Best Choice Products12V MP3 Kids Ride On Truck Care R/c Remote ControlLED Lights, AUX and MusicSKY2069 https://bestchoiceproducts.com/products/12v-mp3-kids-ride-on-truck-car-r-c-remote-control-led-lights-aux-and-musicExamination of the site revealed the presence of no apparent charging connection and no apparent  source of ignition aside from the battery in the toy. This lead us to suspect the toy/battery. Understanding there have been similar issues with Fischer-Price Power Wheels toys and recalls involving the batteries we felt it was important to share our suspicions with you. Had the neighbor not been coming home at the odd hour, it is likely a significant level of damage to the home would have occurred and that the residents would have faced a significant threat of harm. ","Miami Township","Ohio",45439,"Home/Apartment/Condominium","Incident, No Injury","Male","Unspecified","36",No,,,,,No,No,,"",
20211108-CDC4A-2147358867,11/8/2021 ,11/12/2021 ,11/29/2021 ,Consumer,"Child ride on bumper car and ride on airplane","Toys & Children","Riding Toys","Powered Riding Toys (1330)",1330,"Kidzone","Kidszone","12v bumper car and 12v ride on aircraft",,,,,"kidzonetoys.com",,10/24/2021 ,No,"Two Child's ride on toys malfunctioned. One computer chip melted and other caught on fire.","CHATTANOOGA","Tennessee",37405,"Unspecified","No Incident, No Injury","","My Child","4",Yes,No,,,,Yes,,,"",
