20160709-2FDB0-2147417050,7/9/2016 ,8/1/2016 ,8/15/2016 ,Consumer,"Moderno Kids 1x Porsche Boxster Style 12V Kids Ride on Car, Battery powered wheels with remote control for parental controls Model MKSX158 ","Toys & Children","Riding Toys","Powered Riding Toys (1330)",1330,"Moderno, LLC","1x Porsche Boxster Style ","SX 158 or MKSX 158","3307004185/WJ60023",,,,"www.modernokids.com",,5/25/2016 ,No,"I am prompted to write this report for the following reason. I purchased Moderno Kids 1x Porsche Boxster 12V Kids Ride on car with battery powered wheels that also came with a remote control for parental control for my grand daughters 1st birthday.  However, one night while everyone was sleep the car came on by itself and the wheels of the car were turning but it did not move, both the car and the remote was downstairs in the family room.  My son in law ran downstairs to try to turn off the car but he could not get the car to cut off either by pressing the on/off switch in the car or with the remote so he had to lift the seat and detach the battery in order for the car to turn off.  At the time of the incident no one was using the ride on car, the on/off switch was off, the remote was off.  Fortunately, no one was injured.  The concern is that if the ride on car is able to come on by itself and can not be turned off with the power switch on the car or the remote control this could definitely be a safety issue/defect especially if the child is sitting in the car.  The second concern is that the battery is stored under the seat where the child is sitting and if the car won't shut off by pushing the on/off button or by the remote this could pose a safety risk to the child.  The third concern is that if no one was home and the car came on and was powered by the battery for a continuous amount of time could have resulted in overheating, fire or explosion. ","Mechanicsburt","Pennsylvania",17050,"Home/Apartment/Condominium","Incident, No Injury","Female","Unspecified","1",Yes,No,,,No,Yes,,"Q1. I still have the product and has contacted the vendor who refused to replace the car but is willing to send repair parts but stated they did not know exactly what the problem is."," FROM: Moderno LLCc/o Thomson Gabriele & Ollunga LLP750 Third Avenue, 9th FloorNew York, NY 10017(212) 335-0751 Ext 503TO: U.S. Consumer Product Safety CommissionAttention: Clearinghouse4330 East West HighwayBethesda, MD 20814-4408 Re: Report ID: 20160709-2FDB0-2147417050Dear Sir/Madam,We acknowledge receipt of the report submitted on July 9, 2016 and sent to us on August 1, 2016, with regards to our Model MKSX-158 kids toy car (the “Product”). We take every report of this nature very seriously hence our response below. We regret that the submitter expressed dissatisfaction with the Product. Customer satisfaction is our top priority. The submitter used and was in possession of the Product for more than 30 days before informing us that she wanted to replace it. Because she was in possession of the Product beyond our 30-day return period, as part of our customer service, we did inform the submitter that she could receive replacement parts of the Product in accordance with the terms of our warranty or allow us to inspect the Product to verify her concerns. Unfortunately, she did not exercise any of the available options. Without being afforded the opportunity to inspect the Product, we have no way of determining the substantive veracity of her claims.For the record, we have been selling the Product for about 2 years now. It is one of our best-selling products in the market. It has at least a 95% Amazon positive feedback rating, and great reviews from most of our customers thereon and on other online outlets. We sell thousands of the Product every month and have never received any complaints at all, not least of the nature alleged by the submitter. Before being released to the market, the Product underwent a battery of exhaustive testing. It meets the rigorous ASTM standards. It is ASTM approved, a prerequisite to being sold in the USA. It also meets the strict European standards on safety of toys. We have therefore met all the required safety standards and have been issued all the obligatory safety certificates as proof of this.Without questioning the motive of the submitter, the Product simply does not have the capacity nor the capability of automatically switching on of its own accord as alleged by the submitter. This is simply not possible. For it to turn on, it requires deliberate, discerning and cognizant physical action by a person.It is also important to note that the submitter appears to have purchased the Product for a 1 year old child against the clear warning and safety labels attached to the Product and specified in the product description online, as per regulatory requirements. It is rated for 2-plus year old children when used in remote model by parents. Children aged 3 years and over, can use it by themselves. In conclusion, and as earlier stated, we take every report seriously. Out of abundance of caution, we are in the process of reviewing our existing inventory of the Product to ensure and maintain the highest of safety standards.Sincerely,Serge KopilAuthorized RepresentativeModerno LLC",
20200210-C8CBE-2147374902,2/10/2020 ,3/3/2020 ,3/17/2020 ,Consumer,"Features	Side-by-SideBrand	HuffyGender	UnisexAge Group	Teen, ChildColor	BlackAge Range	8 yearsPower Type	ElectricManufacturer Part Number	17249Contains Batteries	YAssembled Product Weight	164 lbsAssembled Product Dimensions (L x W x H)	53.00 x 43.00 x 27.00 Inches","Toys & Children","Riding Toys","Powered Riding Toys (1330)",1330,"Huffy Corporation","Huffy","Torex 24v utv",,,,,"Walmart",,11/18/2019 ,No,"I bought a huffy Torex 24v four wheeler from my sons Christmas. Initially, we had issues with the triggers which only going into reversed. I was sent a replacement piece. After replacing the piece by popping out the old switch and pushing in the new one, I connected the battery to the vehicle. Without stepping on the gas pedal, it’s started accelerating by itself. I took a fall and injuring my knee.","Lexington ","Kentucky",40515,"Home/Apartment/Condominium","Injury - First Aid Received by Non-Medical Professional","Female","Self","34",No,No,,,No,No,,,"",
20200411-DE60D-2147372966,4/11/2020 ,4/20/2020 ,5/4/2020 ,Consumer,"barbie FRC29","Toys & Children","Riding Toys","Powered Riding Toys (1330)",1330,"FISHER-PRICE BRANDS","fisher price","frc29",,,,,"wallmart",,4/5/2020 ,No,"car jumps forward after foot is removed from gas ...battery lasts only for 10 min.of using... doors do not remain closed","haiku","Hawaii",96708,"Home/Apartment/Condominium","Incident, No Injury","","Unspecified","",Yes,,,,No,No,,,"",
20200831-4459E-2147370128,8/31/2020 ,10/26/2020 ,11/10/2020 ,Consumer,"Surge 12V Camo 4X4Name of product:Surge 12V Camo 4X4Model number:8803-31","Toys & Children","Riding Toys","Powered Riding Toys (1330)",1330,"Dynacraft BSC, Inc.","DYNACRAFT","Surge 12V Camo 4X4","DA0331H05323","87876 80415",,,"WALMART","Pennsylvania",,No,"MY YOUNG DAUGHTER WAS IN HERE Surge 12V Camo 4X4 RIDING IN OUR FENCED IN YARD. THE PEDAL STUCK CAUSING HER TO GO THROUGH/UNDER THE FENCE. THIS CAUSED SEVERAL SCRATCHES BRUISES AS WELL AS BROKEN GLASSES. THANKFULLY SHE WAS WEARING HER GLASSES OTHERWISE THIS SITUATION WOULD HAVE BEEN MUCH MUCH WORSE. I AM ASKING THAT THIS BE PULLED FROM ALL STORE SHELVES THIS IS A HAZARD FOR OUR CHILDREN AND THANKFULLY WE WERE OUTSIDE DURING THIS AND NO VEHICLES WERE TRAVELING ON OUR STREET AT THIS TIME. I AM REQUESTING A FULL REFUND FOR THIS PRODUCT. I HAVE SEVERAL VIDEOS ON THIS PRODUCT STILL ACCELERATING HOURS LATER, AS WELL AS THE PHOTOS OF THE INJURIES TO BOTH MY CHILD AND MY HUSBAND. IF NEEDED I CAN SEND THEM AS WELL. ","ALLISON","Pennsylvania",15413,"Home/Apartment/Condominium","Injury - First Aid Received by Non-Medical Professional","Female","My Child","7",Yes,No,,,No,Yes,,"VIA EMAIL AWAITING A REPLY "," Dynacraft BSC, Inc. has reviewed this report, which it appreciates receiving given its concern for the safety of its products. The consumer reported that the foot pedal on her child’s 12V Camo 4x4 ride-on, model 8804-15, purchased approximately two years ago in 2018, recently became stuck.  Dynacraft’s team is in the process of investigating the reported incident and understands that the ride-on was used regularly without any problems up to the time of the incident.  Dynacraft is also working to resolve the consumer’s claim.",
20210322-286C7-2147365242,3/22/2021 ,3/30/2021 ,4/13/2021 ,Consumer,"Huffy Torex  24v  black and red 2 seaterModel 17249","Toys & Children","Riding Toys","Powered Riding Toys (1330)",1330,"Huffy Corporation","Huffy","17249","dont have on hand","not sure",10/14/2020 ,,"walmart ",,1/15/2021 ,No,"we bought the Huffy Torex 24v ride on toy on 01/15/2021 for my 5 year old birthday and yesterday 3/21/2021 My 3 year old and my 5 year old were riding it around the yard and when they drove by my house they yelled at me that it wouldnt stop it was in fact stuck in high speed they drove to towards the back of my house coming within feet of my pond before hitting a puddle and the edge of the grass and it stopped but the wheels continued to spin.. i pushed the on and off button multiple times to turn it off but it continued to go full speed. we got it out of the puddle and even with 140 lb adult in it continued to go full speed even when turned off. we guided him into our trampoline where it was held up so we could unplug the battery.. we have a big pond in which this could have been seriously bad had they of gone a few more feet. Im not ok then i get on here to find contact info to email about it and find out it was recalled for doing this exact thing and the recall was before we even bought it how is this even possible?","Wolf Creek","Oregon",97497,"Home/Apartment/Condominium","Incident, No Injury","Male","My Child","3",Yes,No,,,,Yes,,,"",
20210519-65D71-2147364033,5/19/2021 ,5/21/2021 ,6/7/2021 ,Consumer,"Torex product no 17310","Toys & Children","Riding Toys","Powered Riding Toys (1330)",1330,"Huffy Corporation","Huffy","17310",,,,"23020","Walmart",,3/31/2021 ,Yes,"Son was driving and went to stop but brakes did not work. He crashed into the porch and when he went to try to back up, reverse was also not working ","Prospect","New York",13435,"Home/Apartment/Condominium","Injury - No First Aid or Medical Attention Received","Male","My Child","9",,,,,,,,,"",
20210224-BEB21-2147365674,2/24/2021 ,3/10/2021 ,3/24/2021 ,Consumer,"Huffy Torex New 24V UTV Kids' 4x4 Side-By-Side Electric 4-wheeler Quad, it is red and black, Manufacturer Part Number 17310, Assembled Product Dimensions (L x W x H)	53.00 x 43.00 x 27.00 Inches53.00 x 43.00 x 27.00 Inches. ","Toys & Children","Riding Toys","Powered Riding Toys (1330)",1330,"Huffy Corporation","Huffy Torex","manufacturer number 17310",,"Walmart # 58678",,,"Walmart in Prosper Tx",,1/18/2020 ,No,"My son was using his huffy torex and the battery sparked and burnt his hand. Then the battery caught on fire. It also would go forward when the pedal was not being pushed. It would not stop when the pedal for the brakes was pushed as well. ","Frisco","Texas",75033,"Home/Apartment/Condominium","Injury - First Aid Received by Non-Medical Professional","","My Child","1",,,,,,,,,"",
20210309-32429-2147365438,3/9/2021 ,3/18/2021 ,4/1/2021 ,Consumer,"Barbie camper van.","Toys & Children","Riding Toys","Riding Toys, Not Specified (5005)",5005,"FISHER-PRICE BRANDS","Fisher price","FRC29-9993",,,,"2548Q1",,,,No,"Barbie car continued a fan over child's arm even though she was no longer in the car.",,,,"Home/Apartment/Condominium","Injury - First Aid Received by Non-Medical Professional","Female","My Child","5",Yes,No,,,,No,,,"",
20210409-EA159-2147364890,4/9/2021 ,4/14/2021 ,4/28/2021 ,Consumer,"Kids [REDACTED] - Explorer 2 (Two) Seater 12V Power Kids Ride-On Car Truck with R/C Parental Remote + EVA Rubber LED Wheels + Leather Seat + MP3 Music Player Bluetooth by Moderno Kids","Toys & Children","Riding Toys","Powered Riding Toys (1330)",1330,"Moderno, LLC","moderno Kids","Explorer 2 (Two) Seater 12V Power Kids Ride","N/A","N/A",,,"Amazon",,11/27/2020 ,No,"I purchased a Explorer 2 (Two) Seater 12V Power Kids Ride-On Car Truck with R/C Parental Remote + EVA Rubber LED Wheels + Leather Seat + MP3 Music Player Bluetooth by Moderno Kids. Since the [REDACTED] was put together, the remote doesn't work with the car. When the remote is in the forward position, the car will sometimes not move or it will only go for a few feet and then slow down or completely stop. The ride is very choppy.  Unfortunately, this is a safety hazardfor my 3 year old riding in the vehicle. If a car comes on the road while I am driving her in the toy [REDACTED], I am worried the [REDACTED] will not work properly to get her out of the way. I would not want her to become hurt. ","Pompano Beach","Florida",33062,"Street or Highway","Incident, No Injury","Female","My Child","3",Yes,No,,,,Yes,,,"",
20210721-ABC9F-2147361721,7/21/2021 ,7/23/2021 ,8/6/2021 ,Consumer,"Huffy torex utv 24v","Toys & Children","Riding Toys","Powered Riding Toys (1330)",1330,"Huffy Corporation","Huffy torex utv","Huffy torex utv model 17249 ","19019","028914172491",,"19019","Walmart","Iowa",5/20/2020 ,No,"Huffy torex would not stop going forward.  Child was driving huffy torex UTV model number 17249 date code 19019 JF in back yard and vehicle was going full speed would not slow down even when brake engaged. Child got a bloody lip and lump on head when huffy torex utv crashed into tree at full speed. UTV got damaged from the tree going about 10 mph when it hit.  It would just take off and would not stop. Kids hit tree and got hurt.","Cedar Rapids","Iowa",52402,"Home/Apartment/Condominium","Injury - First Aid Received by Non-Medical Professional","Unknown","My Child","8",,,,,,,,,"",
20220202-D009B-2147357733,2/2/2022 ,2/14/2022 ,3/4/2022 ,Local Government Agency,"The product involved in the fire can best be described as a lithium ion battery powered sit down scooter designed for kids 6+ that is can be ridden on the street at speeds of up to 6.5mph (according to the manufacturer).","Toys & Children","Riding Toys","Powered Riding Toys (1330)",1330,"Evenflo Company, Inc.","24V Nighthawk NexGen","Model # W502AC","Serial # W502AC-WH-21-001187","N/A",4/1/2021 ,"4/21",,,,No,"I am the Fire Marshal for a small Fire District in Granite Bay California.  On Monday January 31st at approximately 2038hrs. our agency responded to reported fire in the garage of one of the homes in our District.  Upon arrival, Fire Crews found that a battery powered sit down scooter had caught fire while plugged into an electrical receptacle in the garage.  Thankfully the home has a Residential Fire Sprinkler system that activated when the fire occurred and extinguished the fire before it spread to the home.","Granite Bay ","California",95746,"Home/Apartment/Condominium","Incident, No Injury","Unknown","Unspecified","",,,,,,,,,"Evenflo Company, Inc.: Goodbaby International (Rollplay) received the above-referenced report on February 14, 2022. Rollplay has reviewed the report and responds as follows:No information is available about the owner’s name or purchase date of the toy; therefore, we cannot verify the chain of ownership through our registration database for the subject electric ride-on toy. There is also no information available about the product’s usage, storage and possible prior damage leading up to the fire. Furthermore, no information is available regarding the condition of this garage’s electrical outlet in the home where the family charged the battery. There were potentially other factors that could have been contributors to this incident other than the toy. We are awaiting a copy of the fire marshal’s report and related photographs to aid us in our investigation. All Rollplay products are designed and tested to industry-accepted standards and is safe for use when used per the instructions. ",
20230712-3AC9B-4284587,7/12/2023 ,7/26/2023 ,8/16/2023 ,Consumer,"24v 2-seater kids ride-on car truck","Toys & Children","Riding Toys","Powered Riding Toys (1330)",1330,"Joy Whale","Joy Whale","ASIN: B09BFFY2Y2",,,,,"Amazon",,5/4/2023 ,No,"The consumer indicates that the childrens electric 24 volt car truck was sitting unplugged in her niece's garage when it spontaneously caught fire and completely melted. The garage was filled with smoke and there was significant damage to it; the garage will have to be redone.The Fire and Police Departments were called, as well as an insurance adjuster, and reports were filed.The consumer contacted the Manufacturer and explained the situation; the representative she spoke to refunded her the cost of the product.The consumer states that, prior to the incident, the unit was used four to six times per week for between thirty to sixty minutes.The consumer's niece plans on keeping the ride-in car truck for at least the next thirty days in case an investigation ensues.","Croton On Hudson","New York",10520,"Home/Apartment/Condominium","Incident, No Injury","Unknown","Unspecified","",Yes,No,,,No,Yes,,,"",
20230420-70F59-2147347995,4/20/2023 ,4/28/2023 ,5/12/2023 ,Consumer,"coolster challenger blue see pictures THIS HAS BEEN SITTING FOR SOMETIME, WE OCCASIONALLY GOT IT RUNNING AND THEN THE CHAIN OR BRAKES WOULD POP AND WE WERE BACK AT IT, WE HAVE IT LISTED FOR PARTS BUT THANKFULLY SOMEONE NOTICED AND SAID THERE WAS A RECALL ON THESE BRANDS SO NOW KNOWING THIS AND THE ISSUES SURROUNDING AND MY CHILD BE SHUCKED OFF WE NOW KNOW THERE WAS A REASON IT WASNT JUST A ONE OFF ISSUE(SORRY CAPS STUCK ON LAP TOP)","Toys & Children","Riding Toys","Powered Riding Toys (1330)",1330,"E COOLSTER DBA MAXTRADE LLC","coolster","challenger ","VIN   [REDACTED]",,,"UNSURE SEE UPLOAD ","rj romano (see original email  upload as proof)",,12/21/2018 ,Yes,"QUAD is unbalanced , spring shot off requiring us to replace it on our childs quad  2 months into ownership, the chain link keeps snapping and gets caught and it cause child to be shucked off. he had gear and helmet so thankfully only bruises..this happend a while ago i have to add  also   Brakes would  not work efficiently  would grind .. Repairing all these to try to make it safe (all guided by [REDACTED]) was useless and  now we we were trying to sell....I was unaware there was even an area to report recalls or there was one on this quad...I was informed by a person who inquired about the sale and asked if I knew of any recalls and I found this which after seeeing the issues checked all the boxes and waved all the red flags.","BEACON","New York",12508,"Home/Apartment/Condominium","Injury - First Aid Received by Non-Medical Professional","Male","My Child","8",,,,,,,,,"",
20240823-06CA6-2147336988,8/23/2024 ,8/28/2024 ,9/19/2024 ,Consumer,"Best Choice Products 12V Kids Ride on Truck Car w/ parent remote control, spring suspension, LED Lights - purple, purchased at Walmart.com. 26 tall, 39.2 long, 26 wide. It is a remote jeep for children to ride in and parents to drive.","Toys & Children","Riding Toys","Powered Riding Toys (1330)",1330,"Best Choice Products","Best Choice Products","cannot find",,,,,"walmart",,6/11/2024 ,No,"We obtained a motorized jeep with remote control. We had some concern that it could flip, so elected to have our children wear a helmet while riding. Our daughter was riding in the jeep while my husband was driving it via remote on our relatively flat driveway (there is a very slight incline). He was reversing the vehicle, stopped reversing to go forward. In doing this, the truck completed flipped backwards onto our child. Again, this was a very slight incline, we have a relatively flat driveway, so the momentum to flip came from the fact that the truck is heaviest in the back and the change in directions. Thankfully our daughter was not injured physical, just scared, likely due to our decision to have her wear a helmet while riding the truck.","Chattanooga","Tennessee",37405,"Home/Apartment/Condominium","No Incident, No Injury","Female","My Child","2",No,No,,,,No,,,"Best Choice Products: Best Choice Products takes customer complaints and product safety seriously.  The toy identified in this complaint has been tested and evaluated by an independent 3rd party CPSC approved testing laboratory and is certified to comply with all applicable ASTM F963 and US CPSIA safety regulations.  BCP is investigating the complaint given the facts we have been provided. ",
20240827-CFD2B-2147336894,8/27/2024 ,9/10/2024 ,9/24/2024 ,Consumer,"Polaris Ranger RZR 900 pink","Toys & Children","Riding Toys","Powered Riding Toys (1330)",1330,"PEG PEREGO,U.S.A.,INC.","Peg perego",,,,,,"Walmart",,,No,"My children were riding their Polaris Ranger RZR 900 for only a few minutes when I noticed smoking, I got them off the vehicle and noticed the smoking continued. I quickly disconnected the battery and monitored it for a short time. I didn't see any smoke after the battery was disconnected but there was still a hot electrical burning smell for a while after.","Granville","New York",12832,"Home/Apartment/Condominium","Incident, No Injury","","My Child","5",Yes,No,,,,Yes,,,"",
20240105-3B990-2147343005,1/5/2024 ,1/10/2024 ,1/26/2024 ,Consumer,"Toyota FJ40 24V Kids Ride on Car,Wisairt 2 Seater Battery Powered Electric Vehicle w/ Remote Control,[REDACTED],LED Lights(Black)","Toys & Children","Riding Toys","Powered Riding Toys (1330)",1330,"Zhongshan Chuangxi Electronic Technology Co., Ltd","Infans","Toyota FJ40 RC",,,,,"walmart.com",,12/1/2023 ,No,"My daughter was riding the car and a fire starts under the car. Thanks God I was beside her so I had chance to react, take her out and stop the fire with a bottle of water I had with me.","anaheim hills","California",92807,"Other Public Property/Office","Incident, No Injury","","My Child","5",,,,,,,,,"",
20240216-8FECD-4617541,2/16/2024 ,3/15/2024 ,3/29/2024 ,Consumer,"Bumper car","Toys & Children","Riding Toys","Riding Toys, Not Specified (5005)",5005,"Flybar, Inc.","Flybar","Item#FB101886",,,,,"Sam's Club",,11/20/2023 ,Yes,"Model*FB101886Color: Blk no serial # on item.  Shipped from China to US. Caller stated that the fly bar 12 volt bumper car xl while her children was playing with it, started to emanate smoke and there was a burning odor.  She stated that after they had let it cool off and try to operate it again the same incident occurred.  Caller stated that after a few attempts the car stopped working.  Caller stated that they followed the instructions of charging the battery.  No more than 8hrs + max weight i175(12/30/23) Caller stated that she contacted the company and they finally reached out on (2/9/24) requesting pictures and a copy of the receipt.  Flybar unresponsive.Item# 990300409 (purchased from Sama Club)PO# [REDACTED]mfg#3631Caller feels that this product is a fire hazard and should be reported.","Mayflower","Arkansas",72106,"Home/Apartment/Condominium","Incident, No Injury","","My Child","7",Yes,No,,,No,Yes,,"12/30/23,1/29/24,2/9/24,2/12/24 Telephone # for them states to leav message. Sent email w/ contact info + receipt for sales@flybar.com. no response.","Flybar, Inc.: We are investigating this incident with both product factory as well as  battery supplier. This is the first of this type of incident reported for this product.  ",
20241210-7DED9-5047567,12/10/2024 ,1/24/2025 ,2/7/2025 ,Consumer,"12-volt one seater all terrain battery-powered ride-on car for kids ","Toys & Children","Riding Toys","Powered Riding Toys (1330)",1330,"SHENZHEN SAILVAN NETWORK TECHNOLOGY CO., LTD.","Homdox","Unknown",,,,,"wayfair.com",,8/12/2024 ,No,"(12/08/2024) The consumer stated that the car caught on fire. Her three-year-old grandson was riding the car when he told his mother that there was a light under the car. When she looked under the car, she could see a spark. She quickly took the car outside and threw it in the grass. The consumer had to call the fire department because the fire was so hugh. The car was completely destroyed. The consumer stated that she has two more of the same ride-on cars that she is afraid for the children to use.  ","Kansas City","Missouri",64133,"Home/Apartment/Condominium","Incident, No Injury","Male","Other Relative","3",No,No,,,No,Yes,,"However, the consumer was not able to speak with a live person. The burn up parts that's left and 2 other cars, I bought 3 of them","",
20241230-6C26E-2147334268,12/30/2024 ,1/3/2025 ,1/23/2025 ,Consumer,"24V 4X200W Ride on UTV w/Remote Control, 20 Spacious 2 Seater Blue","Toys & Children","Riding Toys","Powered Riding Toys (1330)",1330,"JOYRACER US","Joyracer",,"JYRA1003",,,,"Wayfair [REDACTED] ",,9/15/2024 ,No,"This battery-operated UTV does not stop when the child lets off the pedal. The child was unable to bring the UTV to a stop and inadvertently ran over his cousin. Thankfully, no injuries occurred. I have contacted the company and they have not responded. The lack of the UTV stopping is a reproducible event and a video was sent to the company. They have made no attempts to correct the concern.","Danielsville","Georgia",30633,"Home/Apartment/Condominium","Incident, No Injury","","Other Relative","5",Yes,No,,,,Yes,,,"",
20220519-C06A6-2147356115,5/19/2022 ,5/23/2022 ,6/7/2022 ,Consumer,"Audi Q5 Two Seat 24 Volt Remote Control Ride On SUV With Leather Seat and Rubber TiresBlack -","Toys & Children","Riding Toys","Powered Riding Toys (1330)",1330,"Car Tots LLC","Car tots","Audi Q5 ",,,,,"https://www.cartots.com/products/audi-q5-two-seat-",,6/10/2021 ,Yes,"Car tots kid size car started sparking and smoking","Richmond","Texas",77406,"Home/Apartment/Condominium","Incident, No Injury","Unknown","My Child","2",,,,,,,,,"",
