Disclaimer: CPSC does not guarantee the accuracy, completeness, or adequacy of the contents of the Publicly Available Consumer Product Safety Information Database on SaferProducts.gov, particularly with respect to information submitted by people outside of CPSC.
Report No.,Report Date,Sent to Manufacturer / Importer / Private Labeler,Publication Date,Category of Submitter,Product Description,Product Category,Product Sub Category,Product Type,Product Code,Manufacturer / Importer / Private Labeler Name,Brand,Model Name or Number,Serial Number,UPC,Date Manufactured,Manufacturer Date Code,Retailer,Retailer State,Purchase Date,Purchase Date Is Estimate,Incident Description,City,State,ZIP,Location,(Primary) Victim Severity,(Primary) Victim's Sex,My Relation To The (Primary) Victim,(Primary) Victim's Age (years),Submitter Has Product,Product Was Damaged Before Incident,Damage Description,Damage Repaired,Product Was Modified Before Incident,Have You Contacted The Manufacturer,If Not Do You Plan To,Answer Explanation,Company Comments,Associated Report Numbers
20110623-F10BD-2147477908,6/23/2011 ,,7/18/2011 ,Consumer,"Disney Princess Activity Ride-OnFeel like a real princess with Princess Activity Ride-on.    * engine and horn sounds    * glowing castle and pop-up princesses    * sturdy construction Ages 1-3. Measures 20x10x19H. Uses two type AA batteries, not included. ","Toys & Children","Riding Toys","Wheeled Riding Toys, Unpowered (1398)",1398,"Kiddieland Toys Limited",,,,,,,"Gift",,,No,"I would like to report the Kiddieland Disney Baby Princess Activity Ride-on toy. The seat of this toy is a lid to a storage compartment beneath the seat.  Little  fingers can get caught and smashed as the lid closes and a rider sits on the seat. This almost happened with my toddler and I ended up tapping the seat closed so the kids could not open the lid/seat. Kiddieland also has this same type of storage seat on other of their ride-on toys. http://www.amazon.com/Kiddieland-Disney-Princess-Activity-Ride-/dp/B000EX0DFA/ref=sr_1_1?s=toys-and-games&ie=UTF8&qid=1308877363&sr=1-1","Pasadena","California",91107,"Home/Apartment/Condominium","Incident, No Injury","","Unspecified","",Yes,No,,,No,No,No,"Stlll have the toy.","",
20110709-0478C-2147477391,7/9/2011 ,,7/29/2011 ,Consumer,"Radio Flyer brand Model 312PGirls' Push Pull & Ride Snail Style Ride On Toy","Toys & Children","Riding Toys","Wheeled Riding Toys, Unpowered (1398)",1398,"Radio Flyer INC.","Radio Flyer","Model 312P ",,,,,"Gift for Christmas from friends",,12/1/2010 ,Yes,"The toy is the Radio Flyer Model 312P Girls' Push Pull & Ride Snail Ride On toy.  This was actually the third time that this happened with this toy, which is why I felt prompted to write you today.  The first time, I chalked it up to an uncoordinated child who was riding the toy, the second time I thought it was just a coincidence.  The third time, I decided to write, as this is just a terrible toy. This is a poorly designed toy in which the balance is off.  The front of the toy tips forward very easily, with the slightest movement when it is in the ride-on position.  (The toy is marketed as having three positions for play). It is obvious to me now that it is very easy for a child to pitch forward and smash their face on the ground, in addition to being unassisted by their hands to break the fall, since they are holding onto the handles of it.  As an adult handling the toy and manipulating it in this manner, it becomes apparent that it is a design flaw, as it happens so easily with minimal effort. In two previous separate incidents (not reported prior to this), two visiting children had pretty bad forward-tipping accidents on this toy.  In one of those incidents, the child tipped forward while riding on the toy and hit her chin, while her teeth penetrated her bottom lip, sustaining a rather nasty bloody laceration from the impact.  We were grateful that it happened in the house on the wood floor and not outside on the concrete or asphalt. (Yikes!) The incidence that just occurred this week (7/5/11) was a close call with my own child.  She was just sitting there, hardly even moving on the toy, and I was sitting on the ground nearby playing with my older child.  Suddenly, as she stretched her feet out forward on the wheels of the toy, the toy pitched forward and I caught my daughter by her face just in time before she and the toy hit the ground.  The toy is now out of reach, as we have determined it to be an unsafe toy that causes injury.",,,92084,"Home/Apartment/Condominium","Injury - Level of care not known","Female","My Child","1",Yes,No,,,No,No,No,," Radio Flyer takes product safety issues very seriously. We investigate each CPSC database incident report. We encourage our customers to provide additional information about incidents to our Customer Service, by calling 800-621-7613, or visiting our website at www.radioflyer.com ",
20240824-05A96-2147336965,8/24/2024 ,8/28/2024 ,9/12/2024 ,Consumer,"Wisairt 24V Kids Ride on Truck, 2 Seater Powered Ride on Car w/ Remote Control and Storage Space, 3 Speeds, [REDACTED], LED Lights (Black)","Toys & Children","Riding Toys","Powered Riding Toys (1330)",1330,"Zhongshan Chuangxi Electronic Technology Co., Ltd","wisairt ",,,,,,"Walmart ",,8/11/2024 ,No,"My 4 year old pressed the pedal to go  when a 6 year old grabbed the back of the toy. The toy flipped upside down and on top of my 4 year old trapping him underneath and ejecting him from the toy.","Oklahoma City ","Oklahoma",73131,"Home/Apartment/Condominium","Injury - First Aid Received by Non-Medical Professional","Male","My Child","4",Yes,No,,,,Yes,,,"",
20171224-3DD28-2147394325,12/24/2017 ,3/15/2018 ,3/30/2018 ,Consumer,"Fisher Price 3-in-1 Sit, Stride, and Ride Lion","Toys & Children","Riding Toys","Wheeled Riding Toys, Unpowered (1398)",1398,"FISHER-PRICE BRANDS","Fisher Price ","DHW02?","DHW02-E518-01 1100843582?",,,"2667T2","Target ","Arizona",11/15/2017 ,Yes,"My grandson was playing with the Fisher Price 3-in-1 Sit, Stride, & Ride Lion.  He put his hand and arm into the ball return and cried that his hand was stuck.  It was extremely hard to turn the toy over so that I could get to the screws to take the toy apart.  He was in pain every time we tried to move the toy.  When we got all of the screws out, the top of the toy came off and his hand was free.  His thumb was swollen with two red marks.  Putting ice on his hand brought the swelling down with no apparent problems.  I was not sure why he put his hand up into the ball return, but a small toy figure came out when the lion was disassembled.  He said that he was not holding the toy when he got his hand stuck.","Phoenix ","Arizona",85048,"Home/Apartment/Condominium","Injury - First Aid Received by Non-Medical Professional","Male","Other Relative","3",Yes,No,,,No,No,No,"Still have it but plan to return it.","",
20230322-A822E-2147348544,3/22/2023 ,3/24/2023 ,4/10/2023 ,Consumer,"Kids ride on toy truck.  Made by Hikiddo. Model JC222. 24 volt. Black and yellow.","Toys & Children","Riding Toys","Powered Riding Toys (1330)",1330,"SHENZHEN FOREDOM TECHNOLOGY & INNOVATION CO., LTD.","Hikiddo","Model JC222        part no.TK3X1161","unknown",,,,"walmart.com",,12/6/2022 ,No,"Toy started on fire completely burning the toy and other items around it. My trailer also had damage.","INDIO","California",92201,"Unspecified","No Incident, No Injury","Female","My Child","1",Yes,No,,,,Yes,,,"",
20180717-72E16-2147386716,7/17/2018 ,7/25/2018 ,8/8/2018 ,Consumer,"Buggly Wuggly ride on toy. Primarily orange with red, purple and teal highlights. Insect themed, eye stalks are handles with eyeball buttons that light up and make sounds. For ages 1-3.","Toys & Children","Riding Toys","Wheeled Riding Toys, Unpowered (1398)",1398,"MAISON BATTAT INC","B Toys","Buggly Wuggly","H577o0-01",,5/18/2017 ,,"Target",,11/12/2017 ,Yes,"My 19-month-old child’s leg was injured while riding on a ride-on toy as the manufacturer intended. The toy has a small storage compartment under the seat. If the seat is not closed all the way, when the child sits on the toy a pinch can occur on the thigh. This is what happened to my 19-month-old, he has a one inch blood blister on his inner thigh.The product is called a Buggly Wuggly made by B Toys purchased at Target.","Centerville","Ohio",45458,"Home/Apartment/Condominium","Injury - First Aid Received by Non-Medical Professional","Male","My Child","1",Yes,No,,,No,No,Yes,"I still have the product. I plan to contact B Toys.","",
20200707-17BDF-2147371238,7/7/2020 ,7/29/2020 ,8/12/2020 ,Consumer,"Ages 12m+ (1-4yrs)Three ways to play: walk, ride and scootGrow-with-me features encourage motor skills development, balance and coordinationStage 1: Walker/wagon mode captivates early walkers when learning to walk and allows them to push and pull favorite toys alongStage 2: Wagon converts to seat for ride-on mode and is great for toddlers learning foot-to-floor motionStage 3: As toddlers grow, easily converts from a ride-on to a scooterAdjustable handle for a comfortable height when standingPress button for headlight, melodies, and fun sound effectsRequires 3 AAA batteries (not included)Available in our signature ZOO® characters: Unicorn & DogSize (inches): 22.75l x 13.5w x 20.5h; (cm): 57.7l x 34w x 52h","Toys & Children","Riding Toys","Wheeled Riding Toys, Unpowered (1398)",1398,"Skip Hop, Inc.","Skip Hop Zoo 3 in 1",,,,,,"Skip Hop Website",,4/15/2020 ,Yes,"My 3 year old son was riding on his little brother’s Skip Hop Zoo ride on toy.  When the toy is in the seated position if you sit too close to the handle bars it will tip forward.  He tipped it forward and landed on his face.  He has a busted lip and a bloody nose.My 1 year old son also tipped the toy forward two times this weekend.  It appears that the toy is not steady enough to ride while seated.","Knoxville","Tennessee",37934,"Home/Apartment/Condominium","Injury - First Aid Received by Non-Medical Professional","Male","My Child","3",Yes,No,,,No,No,,,"",
20150408-43593-2147433902,4/8/2015 ,4/15/2015 ,4/29/2015 ,Consumer,"Rocy-A-Bye Rocker/Lulu Ladybug design:  Small child rocker designed for up to 80lbs.  ","Toys & Children","Riding Toys","Nonwheeled Riding Toys, Unpowered (1327)",1327,"ROCKABYE TOYS INC.","Rock-A-Bye","Lulu Ladybug","85025","663488850255",10/1/2013 ,,"Manufacturer",,10/1/2013 ,Yes,"Grand Child was playing on Lulu Ladybug Rocker sold by Rock-A-Bye.  She is a petite 2yrs old at an approximate weight of 36lbs.  Rocker stated it was designed for up to 80lbs.  She was play and enjoying the rocker when it flipped forward on her landing her a face plant then the rocker slammed into her head has it completely flipped upside down.  This was a new toy and had not been played with.  She received it for Christmas 2013 and rocker remained in closet until her visit with me at the first of April 2015.  She just turned 2 yrs old.  This rocker is unsafe and should be recalled.","Vale","North Carolina",28168,"Home/Apartment/Condominium","Incident, No Injury","Female","My Child","2",Yes,No,,,No,Yes,,"Have toy and contacted manufacturer about incident. ","",
20110827-5020D-2147475879,8/27/2011 ,,9/20/2011 ,Child Service Provider,"Radio Flyer Scoot & Zoom","Toys & Children","Riding Toys","Wheeled Riding Toys, Unpowered (1398)",1398,"Radio Flyer INC.","Radio Flyer","Scoot & Zoom #711",,,,,,,1/1/2011 ,Yes,"Feed back on Radio Flyer Sccot & ZoomI own a private childcare and purchased 12 radio flyer scoot & Zoom ride on toys about 6 months ago.  The model we have is all the 711 which you have now recalled.  We use these toys for indoor active play on a smooth Composite Tile Floor.  We have had no incidents or injuries related to this toy while using indoors on smoth service.  I also have the same toy at my home for my grandson to ride on.  I  have had problems with tipovers while using this toy outside on rough concrete and indoors at bumps in floor like door way thresh holds.  I  have removed all of these from the school and my home and have requested the newer model from radio flyer. I agree the longer wheel base of the new model would make it better but also think a label for iuse on smooth surfaces only or be careful of use on non-smooth surface as toy may be prone to tip-over on any riding toy of this type..Thanks,[REDACTED]",,,,"Home/Apartment/Condominium","Incident, No Injury","","Unspecified","",,,,,,,,," Radio Flyer takes product safety issues very seriously. We investigate each CPSC database incident report. We encourage our customers to provide additional information about incidents to our Customer Service, by calling 800-621-7613, or visiting our website at www.radioflyer.com.",
20170719-C3CDC-1679964,7/19/2017 ,12/19/2017 ,1/4/2018 ,Consumer,"Ride-on Toy ","Toys & Children","Riding Toys","Powered Riding Toys (1330)",1330,"PEG PEREGO,U.S.A.,INC.","Peg Perego Polaris RVR Ranger","IGOD0516",,,,,"Amazon.com",,12/7/2015 ,No,"Caller is reporting that she experienced similar problems with the ride on toy she purchased for her child as [REDACTED] Hazard:A relay on the circuit board can fail causing the vehicle’s motor to overheat and ignite, posing fire and burn hazards.Caller stated that the control panel caught fire while it was in use, it dissipated in a few mins by itself.  The toy remains inoperable.  She stated that there had been other incidents that it overheated and the control board and harness wiring was replaced.  This will be the 4th incident.Caller feels that this toy should be included in recall.","Overland Park","Kansas",66221,"Home/Apartment/Condominium","Incident, No Injury","","Unspecified","",Yes,No,,,No,Yes,,," In order to better understand the details of the customers claim we request for them to contact our company directly.  We are unable to provide a detailed response without knowing the customer's name to locate their history in our database.",
20170104-C0052-1620280,1/4/2017 ,8/11/2017 ,8/25/2017 ,Consumer,"Riding toys","Toys & Children","Riding Toys","Powered Riding Toys (1330)",1330,"Dynacraft BSC, Inc.","Surge Dynacraft","8803-31","12v / 08032016",,,,"Walmart","New Mexico",11/28/2016 ,No,"Caller is reporting that the ride on toy gas pedal would not stop while the 4 year old child was on it, there is no off and on switch to use.  The riding toy slammed into a flower pot, fortunately the child did not receive any injuries.  12/27 The manufacturer was contacted and she was advised that a replacement part would be sent out because the part that operate the gas pedal got stuck.Caller feels that this toy is unsafe and should be reported.","Las Cruces","New Mexico",88001,"Home/Apartment/Condominium","Incident, No Injury","","Unspecified","4",Yes,No,,,No,Yes,,," Dynacraft BSC, Inc. has reviewed this report, which it appreciates receiving given its concern for the safety of its products, and provides the following in response. The consumer’s product is subject to recall 17-162. The consumer contacted Dynacraft and after receiving a replacement pedal reported that the product was working properly.",
20180929-83CD2-2147385293,9/29/2018 ,10/11/2018 ,11/1/2018 ,Consumer,"We are the Original inventor of the Ponycycle ride on toy-----world first simulated walking animal. Through 13 years of development, manufacturing improvement, riding test and safety test, Ponycycle has dedicated to create the best walking animal and spread exhilaration to every family. Our adorable pony is comfortable to ride, soft to touch and handy to maneuver. Its function well on all kinds of movement: cantering, accelerating, swerving and stopping in a safe and efficient condition. Encounter a pony now! Ponycycle will fulfill your kids’ fantasy and also become their best childhood memory.The item number is N3184SKU: 080101318402","Toys & Children","Riding Toys","Powered Riding Toys (1330)",1330,"Dalian Pony Toy Co.","PonyCycle","PonyCycle Medium Brown Horse",,"110101415105",,,"PonyCycle",,9/25/2018 ,No,"Three days ago I got two a PonyCycle Horse Ride on toy. The UPC is: 110101415105 Here's a link to what the toy is: https://www.target.com/p/pony-cycle-brown-white-horse-ride-on-toy/-/[REDACTED]or www.ponycycle.comThe first day, my 5 year old son was riding on a smooth flat sidewalk and fell off the pony. He instantly started bleeding from this nose and teeth. Now 2 days later, my nine year old had the pony tip while he was turning in our garage. He also instantly had his nose bleeding and teeth bleeding. Both of them also got bumps on their noses and foreheads. I reported the problem to PonyCycle and they just said that it was tested safe. My kids aren't accident prone and rarely get hurt. These PonyCycles are extremely dangerous. My kids weren't doing anything abnormal with the toy. They were just riding them around normally. The ponies don't even go very fast. The problem is that their wheel base is too narrow and they tip easy. These toys really need to be recalled. I have pictures of the second accident. Please call me [REDACTED]. I'd be happy to talk with someone. I just don't want any other kid to get hurt. I do toy reviews for a living and have never seen a toy so dangerous. I've never reported a toy either. This PonyCycle is just so dangerous, that I knew I needed to report it. ","Kihei","Hawaii",96753,"Home/Apartment/Condominium","Injury - First Aid Received by Non-Medical Professional","Male","My Child","9",Yes,No,,,No,Yes,,"The incident just happened today, so I have the PonyCycle stored in a high place where my kids can't touch the toy. I contacted PonyCycle but got a canned response saying their ponycycle is safety tested. ","",
20160608-234AE-1575274,6/8/2016 ,6/30/2016 ,7/15/2016 ,Consumer,"Riding train toy","Toys & Children","Riding Toys","Wheeled Riding Toys, Unpowered (1398)",1398,"Kiddieland Toys Limited","Kiddieland","052670/02231015",,,,,"Target","Virginia",5/26/2016 ,No,"Caller stated that her 2 year old child arm got stuck in the Riding toy.  The child put her hard up to her forearm in the smoke stack of the train.  The caller spouse used olive oil to remove the child's arm from the toy.  There were no injuries.The manufacturer was not contacted as yet.Caller feels that the riding toy train is a safety hazard and should be reported.","Inwood","Virginia",25428,"Home/Apartment/Condominium","Incident, No Injury","Female","Unspecified","2",Yes,No,,,No,No,Yes,," The product in question meets or exceeds every testing standard, as always.  However, the customer brings up a good point about kids being too curious and sticking their hands into openings such as the train smokestack: from which the popping balls emerge.  This is not covered under any existing regulation at the moment.  Kiddieland has promptly addressed the issue by adding a warning label on the smokestack that alerts adults to the possibility of a stuck arm so it can be avoided with proper adult supervision, as is the case with all toys.  The warning goes a little further in the event that a child's hand or arm gets stuck anyway and offers a simple method to dislodge same by pouring a small amount of warm water and mild soap, such as dish washing liquid, into the space.  Neither the child nor the toy is harmed and the hand/arm is liberated quickly and safely.",
20200319-F971E-2147374306,3/19/2020 ,3/26/2020 ,4/9/2020 ,Consumer,"KiddieLand riding construction truck in yellow 05943602010819","Toys & Children","Riding Toys","Wheeled Riding Toys, Unpowered (1398)",1398,"Kiddieland Toys Limited","KiddieLand",,,,,,"Walmart ","Pennsylvania",,No,"My baby was playing with the backhoe arm and had his finger pinched. He screamed for a couple minutes before I was able to calm him back down. After he pinched his finger I checked the toy out and realized that he could’ve lost his finger with how hard this toy will pinch and push down if your finger gets in the wrong spot on the toy. ",,,,"Home/Apartment/Condominium","Injury - No First Aid or Medical Attention Received","Male","My Child","-1",Yes,No,,,No,No,Yes,"I have tried to look up how to contact the company and cannot figure out how to do that. "," Every attempt to discuss this with the mother issuing the complaint has failed.  There was only an email address to follow up and after 3 days of waiting there has been no response, so this will attempt to address the few facts already known.  First, the item in question has been rigorously tested multiple times by the factory, Intertek and Walmart, where it is distributed.  It has passed every line item for children 12-36 months, which leads to the other known fact that the child using it was only 8 months old.  This may or may not have been a factor surrounding the issue but unless and until the mother is willing to engage in a conversation about circumstances, this is as far as a response can go at this point in time.  Kiddieland always regrets any incident where a child is involved and will continue to try communicating about this particular situation in the hope that more information can be gleaned.     ",
20121121-740DD-2147461727,11/21/2012 ,12/13/2012 ,1/8/2013 ,Consumer,"Hasbro Playskool Sit 'N Spin.  Children are supposed to sit on it and turn the wheel to spin around.  Model: Classic SIT'N SPIN Model Item Number: 34848. The only other marking on the toy is etched on the bottom with no identifer as to what it is: '11041' ","Toys & Children","Riding Toys","Nonwheeled Riding Toys, Unpowered (1327)",1327,"HASBRO INC.","Playskool","Sit 'N Spin (classic model)  34848","confiscated by police",,,,"Toys R Us","Georgia",1/2/2012 ,Yes,"My 27-month old child has a Hasbro Playskool Sit 'N Spin toy which is rated by Hasbro for 18 months+.  My child tried to step on the toy (bottom wheel on the floor that spins) and lost balance when the wheel spun.  My child fell backwards and to the side and broke the femur in the right leg in half because the spinning motion twisted the leg.  Now my child is in a full body cast from the chest down (including both legs and feet to stabilize the pelvis) for approximately 5-6 weeks.  Hospital admission (including EMT transfer via ambulance to a pediatric hospital) and anethesia were required to treat the injury.  Note that the toy was at ground level (not elevated on anything) and the fall was on carpeting.  I see many, many comments from product owners online (e.g. eopinions.com) where it is stated that this toy is dangerous, the age rating is too low and that their children have fallen off from stepping on it as my child did.  Children this young do not understand how to safely use the toy, and it should be rated much higher than 18 months (at least 3 years in my opinion).  I followed the recommended age set by the manufacturer not realizing how dangerous this toy is.  Had I known, I never would have purchased it.  The police investigated and confiscated the toy.  I no longer have it in my possession.  ","Kissimmee","Florida",34741,"Home/Apartment/Condominium","Injury - Hospital Admission","Male","My Child","2",No,No,,,No,Yes,,"I contacted Hasbro on 11/20 and reported the incident and injury to Customer Service.  I was told that they take this VERY seriously and that the information would be forwarded to Quality Assurance who would call me back by EOD.  Nobody called me back."," Product safety is a top priority at Hasbro; thank you for your feedback and contacting Hasbro directly. Should you have any further questions please contact our trained professionals at 800 255 5516 or going to http://hasbro.custhelp.com ",
